대문,주석,대문표점,주석표점,대문해석,주석해석
,或人之言可謂厚矣然以聖人之言觀之則見其出於有意之私而怨德之報皆不得其平也必如夫子之言然後二者之報各得其所然怨有不讎而德無不報則又未嘗不厚也此章之言明白簡約而其指意曲折反覆如造化之簡易易知而微妙無窮學者所宜詳玩也,,或人之言，可謂厚矣。然以聖人之言觀之，則見其出於有意之私，而怨德之報皆不得其平也。必如夫子之言，然後二者之報各得其所。然怨有不讎，而德無不報，則又未嘗不厚也。此章之言，明白簡約，而其指意曲折反覆。如造化之簡易易知，而微妙無窮，學者所宜詳玩也。,,"혹자의 말은 후덕(厚德)하다고 이를 만하다. 그러나 성인(聖人)의 말씀을 가지고 살펴보면 유의(有意)의 사심(私心)에서 나와 원한과 덕에 대한 보답이 모두 공평함을 얻지 못함을 볼 수 있으니, 반드시 부자(夫子)의 말씀과 같이 한 뒤에야 두 가지의 보답이 각기 제 자리를 얻게 된다. 그러나 원한을 원수로 여기지 않고, 덕은 갚지 않음이 없으니, 그렇다면 또 후덕(厚德)하지 않은 것이 아니다. 이 장(章)의 말씀은 명백하고 간략하면서도 그 뜻은 곡절(曲折)이 있고 반복되어서 마치 조화의 간이(簡易)가 알기는 쉽지만 미묘한 진리가 무궁한 것과 같으니, 배우는 자들이 마땅히 자세히 완미(玩味)해야 할 것이다."
子曰莫我知也夫,夫子自歎以發子貢之問也,子曰：“莫我知也夫！”,夫子自歎，以發子貢之問也。,공자(孔子)께서 말씀하셨다. “나를 알아주는 이가 없구나!”,부자(夫子)께서 스스로 탄식하여 자공(子貢)의 질문을 유발하신 것이다.
子貢曰何爲其莫知子也子曰不怨天不尤人下學而上達知我者其天乎,不得於天而不怨天不合於人而不尤人但知下學而自然上達此但自言其反己自修循序漸進耳無以甚異於人而致其知也然深味其語意則見其中自有人不及知而天獨知之之妙蓋在孔門唯子貢之智幾足以及此故特語以發之惜乎其猶有所未達也,子貢曰：“何爲其莫知子也？”子曰：“不怨天，不尤人。下學而上達。知我者其天乎！”,不得於天而不怨天，不合於人而不尤人，但知下學而自然上達。此但自言其反己自修，循序漸進耳，無以甚異於人而致其知也。然深味其語意，則見其中自有人不及知而天獨知之之妙。蓋在孔門，唯子貢之智幾足以及此，故特語以發之。惜乎其猶有所未達也！,"자공(子貢)이 말하였다. “어찌하여 선생님을 알아주는 이가 없는 것입니까?” 하자, 공자(孔子)께서 말씀하셨다. “<나는> 하늘을 원망하지 않으며 사람을 탓하지 않고, 아래로 <인간(人間)의 일을> 배우면서 위로 <천리(天理)를> 통달하나니, 나를 알아주는 것은 하느님이실 것이다.”","하늘에게 <좋은 시운을> 얻지 못하여도 하늘을 원망하지 않으며, 사람에게 합하지 못하여도 사람을 탓하지 않고, 다만 아래로 인간의 일을 배우며, 자연히 위로 천리(天理)를 통달하는 것만 안다는 것이니, 이는 다만 자기 몸에 반성하고 자신을 닦아서 차례를 따라 점점 나아갈 뿐이요, 남보다 심히 다르게 하여 그 알아줌을 이루게 함이 없음을 말씀한 것이다. 그러나 그 말씀의 뜻을 깊이 음미해보면, 그 가운데 스스로 사람들은 미쳐 알지 못하고 하늘만이 홀로 알 수 있는 묘(妙)가 있음을 볼 수 있다. 이는 공자(孔子)의 문하(門下)에서 오직 자공(子貢)의 지혜만이 거의 여기에 미칠 수 있었기 때문에 특별히 말씀하여 발명(發明)하신 것이다. 애석하다. 자공(子貢)도 통달하지 못한 바가 있었으니."
,程子曰不怨天不尤人在理當如此又曰下學上達意在言表又曰學者須守下學上達之語乃學之要蓋凡下學人事便是上達天理然習而不察則亦不能以上達矣,,程子曰：“不怨天，不尤人，在理當如此。”又曰：“下學上達，意在言表。”又曰：“學者須守下學上達之語，乃學之要。蓋凡下學人事，便是上達天理。然習而不察，則亦不能以上達矣。”,,"정자(程子)가 말씀하였다. “하늘을 원망하지 않으며 사람을 탓하지 않는 것은 도리(道理)에 있어 마땅히 이와 같아야 하는 것이다.” 또 말씀하였다. “하학(下學)·상달(上達)은 뜻이 말 밖에 있다.” 또 말씀하였다. “배우는 자들은 모름지기 하학(下學)·상달(上達)의 말씀을 지켜야 할 것이니, 이것이 바로 학문(學問)의 요점이다. 대개 아래로 인간(人間)의 일을 배우면 곧 위로 천리(天理)를 통달하게 된다. 그러나 익히기만 하고 살피지 않으면 또한 위로 통달할 수 없는 것이다.”"
公伯寮愬子路於季孫子服景伯以告曰夫子固有惑志於公伯寮吾力猶能肆諸市朝,公伯寮魯人子服氏景諡伯字魯大夫子服何也夫子指季孫言其有疑於寮之言也肆陳尸也言欲誅寮,公伯寮愬子路於季孫。子服景伯以告，曰：“夫子固有惑志於公伯寮，吾力猶能肆諸市朝。”,公伯寮，魯人。子服氏，景諡，伯字，魯大夫子服何也。夫子，指季孫。言其有疑於寮之言也。肆，陳尸也。言欲誅寮。,"공백료(公伯寮)가 자로(子路)를 계손(季孫)에게 참소하니, 자복경백(子服景伯)이 공자(孔子)께 아뢰기를 “부자(夫子)[계손(季孫)]께서 진실로 공백료(公伯寮)의 말에 마음을 의혹하고 계시니, 내 힘이 그래도 공백료(公伯寮)의 시신을 거리에 널어놓을 수 있습니다.”","공백료(公伯寮)는 노(魯)나라 사람이다. 자복(子服)은 성(姓)이고 경(景)은 시호이며 백(伯)은 자(字)이니, 노(魯)나라 대부(大夫) 자복하(子服何)이다. 부자(夫子)는 계손(季孫)을 가리키니, 그가 공백료(公伯寮)의 말에 의혹을 두었다는 말이다. 사(肆)는 시신을 늘어놓은 것이니, 공백료(公伯寮)를 목베고자 함을 말한다."
子曰道之將行也與命也道之將廢也與命也公伯寮其如命何,謝氏曰雖寮之愬行亦命也其實寮無如之何愚謂言此以曉景伯安子路而警伯寮耳聖人於利害之際則不待決於命而後泰然也,子曰：“道之將行也與？命也。道之將廢也與？命也。公伯寮其如命何！”,謝氏曰：“雖寮之愬行，亦命也。其實寮無如之何。”愚謂言此以曉景伯，安子路，而警伯寮耳。聖人於利害之際，則不待決於命而後泰然也。,"공자(孔子)께서 말씀하셨다. “도(道)가 장차 행해지는 것도 명(命)이며 도(道)가 장차 폐해지는 것도 명(命)이니, 공백료(公伯寮)가 그 명(命)에 어떻게 하겠는가?”","사씨(謝氏)가 말하였다. “비록 공백료(公伯寮)의 참소가 행해진다 하더라도 이 또한 명(命)이니, 실상은 공백료(公伯寮)가 어떻게 할 수 없는 것이다.” 내 생각건대, 이를 말씀하여 경백(景伯)을 깨우쳐주고 자로(子路)를 안심(安心)시키고 공백료(公伯寮)를 깨우쳐 주셨을 뿐이다. 성인(聖人)이 이해(利害)의 사이에 있어서 명(命)에 결정하기를 기다린 뒤에야 태연(泰然)해지는 것은 아니다."
子曰賢者辟世,天下無道而隱若伯夷太公是也,子曰：“賢者辟世。”,天下無道而隱，若伯夷太公是也。,"공자(孔子)께서 말씀하셨다. “현자(賢者)는 세상을 피하고,","천하(天下)에 도(道)가 없으면 은둔하는 것이니, 백이(伯夷)와 태공(太公) 같은 분이 바로 그들이다."
其次辟地,去亂國適治邦,其次辟地。,去亂國，適治邦。,"그 다음은 지방을 피하고,",어지러운 나라를 떠나 다스려지는 나라로 가는 것이다.
其次辟色,禮貌衰而去,其次辟色。,禮貌衰而去。,"그 다음은 색(色)을 <보고> 피하고,",예모(禮貌)가 쇠하면 떠나는 것이다.
其次辟言,有違言而後去也,其次辟言。,有違言而後去也。,그 다음은 말을 <어기면> 피한다.”,말을 어김이 있은 뒤에 떠나는 것이다.
,程子曰四者雖以大小次第言之然非有優劣也所遇不同耳,,程子曰：“四者雖以大小次第言之，然非有優劣也，所遇不同耳。”,,"정자(程子)가 말씀하였다. “이 네 가지는 비록 크고 작은 차례로써 말씀하였으나, 그러나 우열(優劣)이 있는 것은 아니요, 당한 바가 같지 않기 때문이다.”"
子曰作者七人矣,李氏曰作起也言起而隱去者今七人矣不可知其誰何必求其人以實之則鑿矣,子曰：“作者七人矣。”,李氏曰：“作，起也。言起而隱去者，今七人矣。不可知其誰何。必求其人以實之，則鑿矣。”,공자(孔子)께서 말씀하셨다. “일어나 은둔한 자가 일곱 사람이다.”,"이씨(李氏)가 말하였다. “작(作)은 일어나는 것이니, 일어나 은둔하려고 떠나간 자가 지금 일곱 사람임을 말씀한 것이다. 그 누구인지는 알 수 없으니, 굳이 그 사람들을 찾아서 채우려 한다면 천착(穿鑿)하는 짓이다.”"
子路宿於石門晨門曰奚自子路曰自孔氏曰是知其不可而爲之者與,石門地名晨門掌晨啓門蓋賢人隱於抱關者也自從也問其何所從來也胡氏曰晨門知世之不可而不爲故以是譏孔子然不知聖人之視天下無不可爲之時也,子路宿於石門。晨門曰：“奚自？”子路曰：“自孔氏。”曰：“是知其不可而爲之者與？”,石門，地名。晨門，掌晨啓門，蓋賢人隱於抱關者也。自，從也，問其何所從來也。胡氏曰“晨門知世之不可而不爲，故以是譏孔子。然不知聖人之視天下，無不可爲之時也。”,"자로(子路)가 석문(石門)에서 유숙하였었는데, 신문(晨門)이 묻기를 “어디에서 왔는가?” 하자, 자로(子路)가 “공씨(孔氏)에게서 왔오.”라고 대답하니, 그는 “바로 불가능(不可能)한 줄을 알면서도 하는 자 말인가.” 하였다.","석문(石門)은 지명(地名)이다. 신문(晨門)은 새벽에 성문을 열어주는 것을 맡은 자이니, 아마도 현자(賢者)로서 관문을 지키는 〔抱關〕 직업에 은둔한 자인 듯하다. 자(自)는 부터이니, 어느 곳으로부터 왔는가를 물은 것이다. 호씨(胡氏)가 말하였다. “신문(晨門)은 세상의 불가능함을 알고 하지 않은 자이다. 그러므로 이 말로써 공자(孔子)를 조롱한 것이다. 그러나 성인(聖人)이 천하(天下)를 봄에는 훌륭한 일을 하지 못할 때가 없다는 것을 알지 못한 것이다.”"
子擊磬於衛有荷蕢而過孔氏之門者曰有心哉擊磬乎,磬樂器荷擔也蕢草器也此荷蕢者亦隱士也聖人之心未嘗忘天下此人聞其磬聲而知之則亦非常人矣,子擊磬於衛。有荷蕢而過孔氏之門者，曰：“有心哉！擊磬乎！”,磬，樂器。荷，擔也。蕢，草器也。此荷蕢者，亦隱士也。聖人之心未嘗忘天下，此人聞其磬聲而知之，則亦非常人矣。,"공자(孔子)께서 위(衛)나라에서 경쇠를 두들기셨는데, 삼태기를 메고 공씨(孔氏)의 문 앞을 지나가는 자가 듣고서 말하였다. “마음이 천하(天下)에 있구나. 경쇠를 두들김이여!”","경(磬)은 악기(樂器)이다. 하(荷)는 메는 것이요, 궤(蕢)는 풀[짚]로 만든 그릇이다. 이 삼태기를 멘 자도 또한 은사(隱士)이다. 성인(聖人)의 마음은 일찍이 천하(天下)를 잊은 적이 없는데, 이 사람이 그 경쇠소리를 듣고서 그 마음을 알았으니, 역시 범상한 자가 아니다."
旣而曰鄙哉硜硜乎莫己知也斯已而已矣深則厲淺則揭,硜硜石聲亦專確之意以衣涉水曰厲攝衣涉水曰揭此兩句衛風匏有苦葉之詩也譏孔子人不知己而不止不能適淺深之宜,旣而曰：“鄙哉！硜硜乎！莫己知也，斯已而已矣。深則厲，淺則揭。”,硜硜，石聲，亦專確之意。以衣涉水曰厲，攝衣涉水曰揭。此兩句，衛風匏有苦葉之詩也。譏孔子人不知己而不止，不能適淺深之宜。,"조금 있다가 말하였다. “비루하다. 너무도 단단하구나! 나[자신]를 알아주지 못하면 그만두어야 할 것이니, 물이 깊으면 옷을 벗고 건너고, 얕으면 옷을 걷고 건너야 하는 것이다.”","경경(硜硜)은 돌 소리이니, 또한 전일(專一)하고 확고(確固)하다는 뜻이다. 옷을 벗어 가지고 물을 건너는 것을 여(勵)라 하고, 옷을 걷고 물을 건너는 것을 게(揭)라 한다. 이 두 구(句)는 《시경(詩經)》〈위풍(衛風) 포유고엽(匏有苦葉)〉의 시(詩)이다. 공자(孔子)가 남들이 알아주지 못하는데도 그치지 아니하여 얕고 깊은 곳에 따라 마땅하게 적응하지 못함을 조롱한 것이다."
子曰果哉末之難矣,果哉嘆其果於忘世也末無也聖人心同天地視天下猶一家中國猶一人不能一日忘也故聞荷蕢之言而嘆其果於忘世且言人之出處若但如此則亦無所難矣,子曰：“果哉！末之難矣。”,果哉，嘆其果於忘世也。末，無也。聖人心同天地，視天下猶一家，中國猶一人，不能一日忘也。故聞荷蕢之言，而嘆其果於忘世。且言人之出處，若但如此，則亦無所難矣。,공자(孔子)께서 말씀하셨다. “과감하구나! 어려울 것이 없겠구나!”,"과재(果哉)는 그 세상을 잊는 데 과감함을 탄식한 것이다. 말(末)은 없는 것이다. 성인(聖人)은 마음이 천지(天地)와 같아서 천하(天下) 보기를 한 집안과 같이하고 중국(中國) 보기를 한 사람과 같이하여 하루도 잊지 못한다. 그러므로 삼태기를 멘 자의 말을 듣고서 그 세상을 잊는 데 과감함을 탄식하셨으며, 또 사람의 출처(出處)를 만일 다만 이와 같이 한다면 또한 어려울 것이 없다고 말씀한 것이다."
子張曰書云高宗諒陰三年不言何謂也,高宗商王武丁也諒陰天子居喪之名未詳其義,子張曰：“書云：‘高宗諒陰，三年不言。’何謂也？”,高宗，商王武丁也。諒陰，天子居喪之名，未詳其義。,"자장(子張)이 말하였다. “《서경(書經)》에 이르기를 ‘고종(高宗)이 양음(諒陰)에서 삼년(三年) 동안 말하지 않았다.’하니, 무엇을 말합니까?”","고종(高宗)은 상왕(商王)인 무정(武丁)이다. 양음(諒陰)은 천자(天子)가 거상(居喪)[집상(執喪)]하는 곳의 명칭인데, 그 뜻은 자세하지 않다."
子曰何必高宗古之人皆然君薨百官總己以聽於冢宰三年,言君薨則諸侯亦然總己謂總攝己職冢宰大宰也百官聽於冢宰故君得以三年不言也,子曰：“何必高宗，古之人皆然。君薨，百官總己以聽於冢宰三年。”,言君薨，則諸侯亦然。總己，謂總攝己職。冢宰，大宰也。百官聽於冢宰，故君得以三年不言也。,"공자(孔子)께서 말씀하셨다. “하필 고종(高宗) 뿐이겠는가. 옛사람이 다 그러하였으니, 군주(君主)가 죽으면 백관(百官)들은 자기의 직책을 총괄하여 총재(冢宰)에게 <명령을> 듣기를 삼년(三年) 동안 하였다. ”","“군주(君主)가 죽었다.”고 말하였으니, 그렇다면 제후(諸侯)도 이와 같은 것이다. 총기(總己)는 자기의 직책을 총괄하는 것이다. 총재(冢宰)는 태재(太宰)이다. 백관(百官)들이 총재(冢宰)에게 명령을 들으므로, 군주(君主)가 3년 동안 말하지 않을 수 있는 것이다."
,胡氏曰位有貴賤而生於父母無以異者故三年之喪自天子達子張非疑此也殆以爲人君三年不言則臣下無所稟令禍亂或由以起也孔子告以聽於冢宰則禍亂非所憂矣,,胡氏曰：“位有貴賤，而生於父母無以異者。故三年之喪，自天子達。子張非疑此也，殆以爲人君三年不言，則臣下無所稟令，禍亂或由以起也。孔子告以聽於冢宰，則禍亂非所憂矣。”,,"호씨(胡氏)가 말하였다. “지위는 귀천(貴賤)이 있으나 부모(父母)에게서 태어남은 다름이 없다. 그러므로 삼년상(三年喪)은 천자(天子)로부터 <서인(庶人)까지> 공통되는 것이다. 자장(子張)이 이것을 의심한 것이 아니요, 군주(君主)가 3년 동안 말하지 않으면 신하가 명령을 품할 곳이 없어서 화란(禍亂)이 혹 이로 말미암아 일어날까 의심한 것이다. 공자(孔子)께서 총재(冢宰)에게 <명령을> 듣는다고 말씀해 주셨으니, 그렇다면 화란(禍亂)은 걱정할 바가 아니다.”"
子曰上好禮則民易使也,謝氏曰禮達而分定故民易使,子曰：“上好禮，則民易使也。”,謝氏曰：“禮達而分定，故民易使。”,공자(孔子)께서 말씀하셨다. “위에서 예(禮)를 좋아하면 백성을 부리기 쉽다.”,사씨(謝氏)가 말하였다. “예(禮)가 통달해져서 분수가 정해짐으로 백성을 부리기가 쉬운 것이다.”
子路問君子子曰修己以敬曰如斯而已乎曰修己以安人曰如斯而已乎曰修己以安百姓修己以安百姓堯舜其猶病諸,修己以敬夫子之言至矣盡矣而子路少之故再以其充積之盛自然及物者告之無他道也人者對己而言百姓則盡乎人矣堯舜猶病言不可以有加於此以抑子路使反求諸近也蓋聖人之心無窮世雖極治然豈能必知四海之內果無一物不得其所哉故堯舜猶以安百姓爲病若曰吾治已足則非所以爲聖人矣,子路問君子。子曰：“修己以敬。”曰：“如斯而已乎？”曰：“修己以安人。”曰：“如斯而已乎？”曰：“修己以安百姓。修己以安百姓，堯舜其猶病諸！”,修己以敬，夫子之言至矣盡矣。而子路少之，故再以其充積之盛，自然及物者告之，無他道也。人者，對己而言。百姓，則盡乎人矣。堯舜猶病，言不可以有加於此。以抑子路，使反求諸近也。蓋聖人之心無窮，世雖極治，然豈能必知四海之內，果無一物不得其所哉？故堯舜猶以安百姓爲病。若曰吾治已足，則非所以爲聖人矣。,"자로(子路)가 군자(君子)에 대하여 물으니, 공자(孔子)께서 “경(敬)으로써 몸을 닦는 것이다.” 하셨다. <자로(子路)가>“이와 같은 뿐입니까?” 하자, “몸을 닦아서 사람을 편안하게 하는 것이다.” 하고 대답하셨다. 다시 “이와 같을 뿐입니까?” 하고 묻자, 다음과 같이 말씀하셨다. “몸을 닦아서 백성을 편안하게 하는 것이니, 몸을 닦아서 백성을 편안하게 함은 요순(堯舜)께서도 오히려 부족하게 여기셨다.”","‘경(敬)으로써 몸을 닦는다.’는 부자(夫子)의 말씀이 지극하고 다하였는데, 자로(子路)가 이것을 하찮게 여겼으므로, 다시 충적(充積)함이 성(盛)하여 자연히 남에게 미치는 것을 가지고 말씀하셨으니, 다른 방법이 있는 것은 아니다. 인(人)[남]이란 자기와 상대로 말한 것이요, 백성은 모든 남을 다한 것이다. 요순(堯舜)께서 오히려 부족하게 여기셨다는 것은 이보다 더할 수가 없음을 말씀하여 자로(子路)를 억제해서 가까운 것에서 돌이켜 구하게 하신 것이다. 성인(聖人)의 마음은 무궁하여 세상이 비록 지극히 잘 다스려지더라도 어찌 반드시 천하(天下)에 과연 한 물건이라도 제자리를 얻지 못함이 없다고 알[장담]수 있겠는가? 그러므로 요순(堯舜)도 오히려 백성을 편안히 하는 것을 부족하게 여기신 것이다. 만일 나의 다스림이 이미 만족하다고 한다면 성인(聖人)이 될 수 있는 것이 아니다."
,程子曰君子修己以安百姓篤恭而天下平唯上下一於恭敬則天地自位萬物自育氣無不和而四靈畢至矣此體信達順之道聰明睿知皆由是出以此事天饗帝,,程子曰：“君子修己以安百姓，篤恭而天下平。唯上下一於恭敬，則天地自位，萬物自育，氣無不和，而四靈畢至矣。此體信達順之道，聰明睿知皆由是出，以此事天饗帝。”,,"정자(程子)가 말씀하였다. “군자(君子)가 몸을 닦아서 백성을 편안히 하고 공경(恭敬)을 독실히 하여 천하가 화평해지니, 오직 상하(上下)가 공경(恭敬)에 한결같이 하면 천지(天地)가 스스로 자리를 잡고 만물(萬物)이 스스로 생육(生育)되어 기운이 화평하지 않음이 없어서 사령(四靈)이 모두 이를 것이다. 이는 신(信)[성(誠)]을 체행(體行)하고 순리를 통달하는 방법이다. 총명예지(聰明睿智)가 모두 이로 말미암아 나오는 것이니, 이로써 하늘을 섬기고 상제(上帝)에 제향하는 것이다.”"
原壤夷俟子曰幼而不孫弟長而無述焉老而不死是爲賊以杖叩其脛,原壤孔子之故人母死而歌蓋老氏之流自放於禮法之外者夷蹲踞也俟待也言見孔子來而蹲踞以待之也述猶稱也賊者害人之名以其自幼至老無一善狀而久生於世徒足以敗常亂俗則是賊而已矣脛足骨也孔子旣責之而因以所曳之杖微擊其脛若使勿蹲踞然,原壤夷俟。子曰：“幼而不孫弟，長而無述焉，老而不死，是爲賊！”以杖叩其脛。,原壤，孔子之故人。母死而歌，蓋老氏之流，自放於禮法之外者。夷，蹲踞也。俟，待也。言見孔子來而蹲踞以待之也。述，猶稱也。賊者，害人之名。以其自幼至老，無一善狀，而久生於世，徒足以敗常亂俗，則是賊而已矣。脛，足骨也。孔子旣責之，而因以所曳之杖，微擊其脛，若使勿蹲踞然。,"원양(原壤)이 걸터앉아 <공자(孔子)를> 기다리니, 공자(孔子)께서 말씀하시기를 “어려서는 공손하지 못하고, 장성해서는 칭찬할 만한 일이 없고, 늙어서도 죽지 않는 것이 바로 적(賊)이다.” 하시고, 지팡이로 그의 정강이를 두드리셨다.","원양(原壤)은 공자(孔子)의 고인(故人)[친구]로, 어머니가 죽자, 노래를 불렀으니, 노자(老子)의 무리로서 스스로 예법(禮法)의 밖에 방탕한 자이다. 이(夷)는 걸터앉은 것이고, 사(俟)는 기다리는 것이니, 공자(孔子)가 오는 것을 보고 걸터앉아서 기다림을 말한다. 술(述)은 칭(稱)[칭찬]과 같다. 적(賊)은 사람을 해치는 것의 명칭이다. 어려서부터 늙음에 이르기까지 한 가지도 잘한 내용이 없이 오래 세상에 살아서 한갓 상도(常道)[인륜]를 무너뜨리고 풍속을 어지럽히니, 이는 바로 적(賊)일 뿐인 것이다. 경(脛)은 정강이이다. 공자(孔子)께서 이미 꾸짖고, 뒤이어 끄시던 지팡이로 그의 정강이를 가볍게 쳐서 그로 하여금 걸터앉지 말게 하려는 듯이 하신 것이다."
闕黨童子將命或問之曰益者與,闕黨黨名童子未冠者之稱將命謂傳賓主之言或人疑此童子學有進益故孔子使之傳命以寵異之也,闕黨童子將命。或問之曰：“益者與？”,闕黨，黨名。童子，未冠者之稱。將命，謂傳賓主之言。或人疑此童子學有進益，故孔子使之傳命以寵異之也。,"궐당(闕黨)의 동자(童子)가 <공자(孔子)의> 명령을 전달하는 일을 맡아보자, 혹자가 묻기를 “학문(學問)이 진전(進展)된 자여서입니까?” 하였다.",궐당(闕黨)은 당(黨)[행정구역 단위]의 이름이다. 동자(童子)는 관례(冠禮)를 하지 않은 자의 칭호이다. 장명(將命)은 손님과 주인의 말을 전달하는 것을 말한다. 혹자는 이 동자(童子)가 학문(學問)이 진익(進益)[진전(進展)]이 있으므로 공자(孔子)께서 그로 하여금 명령을 전달하게 하여 총이(寵異)하신 것인가 하고 의심한 것이다.
