대문,주석,대문표점,주석표점,대문해석,주석해석
子路問政子曰先之勞之,蘇氏曰凡民之行以身先之則不令而行凡民之事以身勞之則雖勤不怨,子路問政。子曰：“先之，勞之。”,蘇氏曰：“凡民之行，以身先之，則不令而行。凡民之事，以身勞之，則雖勤不怨。”,"자로(子路)가 정사(政事)를 묻자, 공자(孔子)께서 말씀하셨다. “솔선할 것이며 부지런히 해야 한다.”","소씨(蘇氏)가 말하였다. “백성들이 행해야 할 것〔道理〕을 자신〔爲政者〕이 먼저 솔선하면 윗사람이 명령하지 않아도 행해지고, 백성들이 해야 할 일을 자신이 부지런히 애써 하면 백성들이 비록 수고롭더라도 <윗사람을> 원망하지 않는다.”"
請益曰無倦,吳氏曰勇者喜於有爲而不能持久故以此告之,請益。曰：“無倦。”,吳氏曰：“勇者喜於有爲而不能持久，故以此告之。”,"더 자세히 말씀해 주시기를 청하자, “게을리 하지 말아야 한다.” 하셨다.",오씨(吳氏)가 말하였다. “용맹스런 자는 일 하기를 좋아하나 오래 버티지 못한다. 그러므로 이것으로 말씀해 주신 것이다.”
,程子曰子路問政孔子旣告之矣及請益則曰無倦而已未嘗復有所告姑使之深思也,,程子曰：“子路問政，孔子旣告之矣。及請益，則曰‘無倦’而已。未嘗復有所告，姑使之深思也。”,,"정자(程子)가 말씀하였다. “자로(子路)가 정사(政事)를 묻자, 공자(孔子)께서 이미 말씀해 주셨고, 더 자세히 말씀해 주시기를 청하자, ‘게을리 하지 말라.’하셨을 뿐이요, 일찍이 다시 말씀해 주신 것이 없었으니, 이것은 우선 깊이 생각하게 하려고 하신 것이다.”"
仲弓爲季氏宰問政子曰先有司赦小過擧賢才,有司衆職也宰兼衆職然事必先之於彼而後考其成功則己不勞而事畢擧矣過失誤也大者於事或有所害不得不懲小者赦之則刑不濫而人心悅矣賢有德者才有能者擧而用之則有司皆得其人而政益修矣,仲弓爲季氏宰，問政。子曰：“先有司，赦小過，擧賢才。”,有司，衆職也。宰兼衆職，然事必先之於彼，而後考其成功，則己不勞而事畢擧矣。過，失誤也。大者於事或有所害，不得不懲；小者赦之，則刑不濫而人心悅矣。賢，有德者。才，有能者。擧而用之，則有司皆得其人而政益修矣。,"중궁(仲弓)이 계씨(季氏)의 가신(家臣)이 되어 정사(政事)를 묻자, 공자(孔子)께서 말씀하셨다. “유사(有司)에게 먼저 시키고 작은 허물을 용서해주며, 어진이와 유능한 이를 등용해야 한다.”","유사(有司)는 여러 가지 직책을 맡은 자이다. 가신〔宰〕은 여러 직책을 겸한다. 그러나 모든 일을 반드시 저〔有司〕들에게 먼저 시키고 뒤에 그 이룬 공적을 살핀다면, 자신은 수고롭지 않고서도 일이 모두 거행될 것이다. 과(過)는 실수로 잘못한 것이다. 큰 잘못은 일에 혹 해로운 바가 있으니 징계하지 않을 수 없거니와, 작은 허물은 용서해주면 형벌이 남용되지 않아 민심이 기뻐할 것이다. 현(賢)은 덕(德)이 있는 자요, 재(才)는 재능이 있는 자이니, 이들을 등용하여 쓰면 유사(有司)가 모두 적임자〔其人〕를 얻어 정사(政事)가 더욱 닦아지게 될 것이다."
曰焉知賢才而擧之曰擧爾所知爾所不知人其舍諸,仲弓慮無以盡知一時之賢才故孔子告之以此程子曰人各親其親然後不獨親其親仲弓曰焉知賢才而擧之子曰擧爾所知爾所不知人其舍諸便見仲弓與聖人用心之大小推此義則一心可以興邦一心可以喪邦只在公私之間爾,曰：“焉知賢才而擧之？”曰：“擧爾所知。爾所不知，人其舍諸？”,仲弓慮無以盡知一時之賢才，故孔子告之以此。程子曰：“人各親其親，然後不獨親其親。仲弓曰‘焉知賢才而擧之’、子曰：‘擧爾所知，爾所不知，人其舍諸’便見仲弓與聖人用心之大小。推此義，則一心可以興邦，一心可以喪邦，只在公私之間爾。”,"“어떻게 어진이와 유능한 이를 알아 등용합니까?” 하고 묻자, “네가 아는 자〔賢才〕를 등용하면 네가 미처 모르는 자를 남들이 내버려두겠느냐?” 하셨다.","중궁(仲弓)은 한 세상의 어진이와 유능한 이를 다 알 수 없을까 염려하였다. 그러므로 공자(孔子)께서 이것으로 말씀해 주신 것이다. 정자(程子)가 말씀하였다. “사람들은 각기 그 친척을 친히 하여야 한다. 그런 뒤에는 친척만을 친히 하지는 않는 것이다.” 중궁(仲弓)이 “어떻게 어진이와 유능한 이를 알아 등용합니까?” 하고 묻자, 공자(孔子)께서 네가 아는 현재(賢才)를 등용하면 네가 모르는 현재(賢才)를 사람들이 내버려두겠느냐?”라고 하셨으니, 중궁(仲弓)과 성인(聖人)의 마음씀에 크고 작음을 볼 수 있다. 이 뜻을 미루어 나간다면, 한 마음이 나라를 부흥시킬 수도 있고, 한 마음이 나라를 잃을 수도 있는 것이, 다만 공(公)과 사(私)의 사이에 달려 있을 따름이다.”"
,范氏曰不先有司則君行臣職矣不赦小過則下無全人矣不擧賢才則百職廢矣失此三者不可以爲季氏宰況天下乎,,范氏曰：“不先有司，則君行臣職矣；不赦小過，則下無全人矣；不擧賢才，則百職廢矣。失此三者，不可以爲季氏宰，況天下乎？”,,"범씨(范氏)가 말하였다. “유사(有司)에게 먼저 시키지 않으면 군주(君主)가 신하(臣下)의 일을 행하게 될 것이요, 작은 허물을 용서하지 않으면 아래에 온전한 사람이 없게 될 것이요, 어진이와 유능한 이를 등용하지 않으면 모든 직무가 마비될 것이니, 이 세 가지를 잃으면 계씨(季氏)의 가신(家臣)도 될 수 없는데, 하물며 천하(天下)를 다스림에 있어서랴!”"
子路曰衛君待子而爲政子將奚先,衛君謂出公輒也是時魯哀公之十年孔子自楚反乎衛,子路曰：“衛君待子而爲政，子將奚先？”,衛君，謂出公輒也。是時魯哀公之十年，孔子自楚反乎衛。,자로(子路)가 말하였다. “위(衛)나라 군주(君主)가 선생님을 기다려 정사를 하려고 하십니다. 선생께서는 장차 무엇을 우선하시렵니까?”,"위(衛)나라 군주(君主)는 출공(出公) 첩(輒)을 이른다. 이 때는 노(魯)나라 애공(哀公) 10년으로, 공자(孔子)는 초(楚)나라에서 위(衛)나라로 와 계셨다."
子曰必也正名乎,是時出公不父其父而禰其祖名實紊矣故孔子以正名爲先謝氏曰正名雖爲衛君而言然爲政之道皆當以此爲先,子曰：“必也正名乎！”,是時出公不父其父而禰其祖，名實紊矣，故孔子以正名爲先。謝氏曰：“正名雖爲衛君而言，然爲政之道，皆當以此爲先。”,공자(孔子)께서 대답하셨다. “반드시 명분을 바로잡겠다.”,"이 때 출공(出公)은 자기의 아버지를 아버지로 여기지 않고, 자기의 할아버지를 아비로 삼아, 명분(名分)과 실상(實狀)이 문란하였다. 그러므로 공자(孔子)께서 명분을 바로잡는 것을 우선으로 삼으신 것이다. 사씨(謝氏)가 말하였다. “명분을 바로잡는 일은 비록 위(衛)나라 군주(君主) 때문에 하신 말씀이나, 정사(政事)를 하는 도리는 모두 당연히 이것을 우선으로 삼아야 하는 것이다.”"
子路曰有是哉子之迂也奚其正,迂謂遠於事情言非今日之急務也,子路曰：“有是哉，子之迂也！奚其正？”,迂，謂遠於事情，言非今日之急務也。,자로(子路)가 말하였다. “이러하십니다. 선생님의 우활(迂闊)하심이여! 어떻게 바로잡을 수 있겠습니까?”,"우(迂)는 사정과 거리가 멂을 이름이니, 오늘날 급선무(急先務)가 아님을 말한 것이다."
子曰野哉由也君子於其所不知蓋闕如也,野謂鄙俗責其不能闕疑而率爾妄對也,子曰：“野哉由也！君子於其所不知，蓋闕如也。”,野，謂鄙俗。責其不能闕疑，而率爾妄對也。,공자(孔子)께서 말씀하셨다. “비속(鄙俗)하구나 유(由)여! 군자(君子)는 자기가 알지 못하는 것에는 말하지 않고 가만히 있는 것이다.,"야(野)는 비속(鄙俗)함을 이른다. 그가 의심스러운 것을 그대로 놓아두지〔闕疑〕 못하고, 경솔하게 함부로 대답함을 책망하신 것이다."
名不正則言不順言不順則事不成,楊氏曰名不當其實則言不順言不順則無以考實而事不成,名不正，則言不順；言不順，則事不成；,楊氏曰：“名不當其實，則言不順。言不順，則無以考實而事不成。”,"명분이 바르지 못하면 말이 <이치에> 순하지 못하고, 말이 <이치에> 순하지 못하면 일이 이루어지지 못하고,","양씨(楊氏)가 말하였다. “명분이 그 실제와 합당하지 않으면 말이 <이치에> 순하지 못하고, 말이 <이치에> 순하지 못하면 실상을 살필 수 없어 일이 이루어지지 못한다.”"
事不成則禮樂不興禮樂不興則刑罰不中刑罰不中則民無所措手足,范氏曰事得其序之謂禮物得其和之謂樂事不成則無序而不和故禮樂不興禮樂不興則施之政事皆失其道故刑罰不中,事不成，則禮樂不興；禮樂不興，則刑罰不中；刑罰不中，則民無所措手足。,范氏曰：“事得其序之謂禮，物得其和之謂樂。事不成則無序而不和，故禮樂不興。禮樂不興，則施之政事皆失其道，故刑罰不中。”,"일이 이루어지지 못하면 예악(禮樂)이 일어나지 못하고, 예악(禮樂)이 일어나지 못하면 형벌(刑罰)이 알맞지 못하고, 형벌(刑罰)이 알맞지 못하면 백성들이 손발을 둘 곳이 없어진다.","범씨(范氏)가 말하였다. “일이 그 질서(秩序)를 얻음을 예(禮)라 이르고, 사물이 그 화(和)함을 얻음을 악(樂)이라 이른다. 일이 이루어지지 못하면 질서가 없어지고 화(和)하지 못한다. 그러므로 예악(禮樂)이 일어나지 못하고, 예악(禮樂)이 일어나지 못하면 정사(政事)를 시행함에 모두 정리(正理)를 잃게 된다. 그러므로 형벌(刑罰)이 알맞지 못하는 것이다.”"
故君子名之必可言也言之必可行也君子於其言無所苟而已矣,程子曰名實相須一事苟則其餘皆苟矣,故君子名之必可言也，言之必可行也。君子於其言，無所苟而已矣。,程子曰：“名實相須。一事苟，則其餘皆苟矣。”,"그러므로 군자(君子)가 이름[명분]을 붙이면 반드시 말할 수 있으며, 말할 수 있으면 반드시 행할 수 있는 것이니, 군자(君子)는 그 말에 대하여 구차히 함이 없을 뿐이다.”","정자(程子)가 말씀하였다. “명분과 실상은 서로 필요하니, 한 가지 일이 구차하면 그 나머지도 모두가 구차하게 된다.”"
,胡氏曰衛世子蒯聵恥其母南子之淫亂欲殺之不果而出奔靈公欲立公子郢郢辭公卒夫人立之又辭乃立蒯聵之子輒以拒蒯聵夫蒯聵欲殺母得罪於父而輒據國以拒父皆無父之人也其不可有國也明矣夫子爲政而以正名爲先必將具其事之本末告諸天王請于方伯命公子郢而立之則人倫正天理得名正言順而事成矣夫子告之之詳如此而子路終不喩也故事輒不去卒死其難徒知食焉不避其難之爲義而不知食輒之食爲非義也,,胡氏曰：“衛世子蒯聵恥其母南子之淫亂，欲殺之不果而出奔。靈公欲立公子郢，郢辭。公卒，夫人立之，又辭。乃立蒯聵之子輒，以拒蒯聵。夫蒯聵欲殺母，得罪於父，而輒據國以拒父，皆無父之人也，其不可有國也明矣。夫子爲政，而以正名爲先。必將具其事之本末，告諸天王，請于方伯，命公子郢而立之。則人倫正，天理得，名正言順而事成矣。夫子告之之詳如此，而子路終不喩也。故事輒不去，卒死其難。徒知食焉不避其難之爲義，而不知食輒之食爲非義也。”,,"호씨(胡氏)가 말하였다. “위(衛)나라 세자(世子) 괴외(蒯聵)가 그의 모친인 남자(南子)의 음란(淫亂)함을 부끄럽게 생각하여 죽이려고 하다가 결행하지 못하고 외국으로 도망하자, 영공(靈公)은 공자(公子) 영(郢)을 세우려고 하였는데 영(郢)은 사양하였다. 영공(靈公)이 죽자 부인〔南子〕이 영(郢)을 세웠으나 또다시 사양하니, 이에 괴외(蒯聵)의 아들인 첩(輒)을 임금으로 세워 괴외(蒯聵)를 막게 하였다. 괴외(蒯聵)는 어머니를 살해하려 하다가 부왕(父王)에게 죄를 얻었고, 첩(輒)은 나라를 차지하고서 아버지를 막았는 바, 모두 아버지가 없는 자들이니, 이들이 나라를 소유할 수 없음이 분명하다. 부자(夫子)께서 정사(政事)를 하시면 명분을 바로잡는 것을 우선으로 삼았으니, 반드시 장차 그 일의 본말(本末)을 갖추어 천왕(天王)에게 아뢰고 방백(方伯)에게 청하여 공자(公子) 영(郢)을 명하여 군주(君主)로 세웠을 것이다. 이렇게 하면 인륜(人倫)이 바루어지고 천리(天理)에 맞아 명분이 바르고 말이 이치(理致)에 순해져서 일이 이루어질 것이다. 부자(夫子)께서 상세하게 말씀해 주신 것이 이와 같았는데도 자로(子路)는 끝내 깨닫지 못하였다. 그러므로 첩(輒)을 섬기고 떠나지 않다가 마침내 그 난리에 죽었으니, 이는 한갓 그 사람의 녹봉을 먹었으면 그 난(難)을 피하지 않는 것이 의(義)가 되는 것만을 알고, 첩(輒)의 녹봉을 먹는 것이 의(義)가 아님은 알지 못한 것이다.”"
樊遲請學稼子曰吾不如老農請學爲圃曰吾不如老圃,種五穀曰稼種蔬菜曰圃,樊遲請學稼，子曰：“吾不如老農。”請學爲圃。曰：“吾不如老圃。”,種五穀曰稼，種蔬菜曰圃。,"번지(樊遲)가 농사일을 배우기를 청하자, 공자(孔子)께서는 “나는 늙은 농부(農夫)만 못하다.” 하셨다. 채전(菜田)을 가꾸는 것을 배우기를 청하자, “나는 늙은 원예사만 못하다.” 하셨다.","오곡(五穀)을 심는 것을 가(稼)라 하고, 채소를 심는 것을 포(圃)라 한다."
樊遲出子曰小人哉樊須也,小人謂細民孟子所謂小人之事者也,樊遲出。子曰：“小人哉，樊須也！”,小人，謂細民，孟子所謂小人之事者也。,"번지(樊遲)가 나가자, 공자(孔子)께서 다음과 같이 말씀하셨다. “소인(小人)이구나! 번수(樊須)여!","소인(小人)은 벼슬이 없는 일반 서민(庶民)들을 이르니, 맹자(孟子)가 말씀한 바 ‘소인(小人)의 일’이란 것이다."
上好禮則民莫敢不敬上好義則民莫敢不服上好信則民莫敢不用情夫如是則四方之民襁負其子而至矣焉用稼,禮義信大人之事也好義則事合宜情誠實也敬服用情蓋各以其類而應也襁織縷爲之以約小兒於背者,上好禮，則民莫敢不敬；上好義，則民莫敢不服；上好信，則民莫敢不用情。夫如是，則四方之民襁負其子而至矣，焉用稼？,禮、義、信，大人之事也。好義，則事合宜。情，誠實也。敬服用情，蓋各以其類而應也。襁，織縷爲之，以約小兒於背者。,"윗사람이 예(禮)를 좋아하면 백성들이 윗사람을 공경하지 않는 이가 없고, 윗사람이 의(義)를 좋아하면 백성들이 복종하지 않는 이가 없고, 윗사람이 신(信)을 좋아하면 백성들이 감히 실정〔情〕대로 하지 않는 이가 없는 것이다. 이렇게 되면 사방(四方)의 백성들이 자식을 포대기에 업고 올 것이니, 어찌 농사짓는 것을 쓸 필요가 있겠는가?”",예(禮)·의(義)·신(信)은 대인(大人)〔爲政者〕의 일이다. 의(義)를 좋아하면 일이 마땅함에 합한다. 정(情)은 성실(誠實)함이다. 백성들이 공경하고 복종하고 실정대로 하는 것은 각기 그 유(類)에 따라 응하는 것이다. 강(襁)은 실로 짜서 만들어 어린아이를 등에 묶는 것이다.
,楊氏曰樊須遊聖人之門而問稼圃志則陋矣辭而闢之可也待其出而後言其非何也蓋於其問也自謂農圃之不如則拒之者至矣須之學疑不及此而不能問不能以三隅反矣故不復及其旣出則懼其終不喩也求老農老圃而學焉則其失愈遠矣故復言之使知前所言者意有在也,,楊氏曰：“樊須遊聖人之門，而問稼圃，志則陋矣，辭而闢之可也。待其出而後言其非，何也？蓋於其問也，自謂農圃之不如，則拒之者至矣。須之學疑不及此，而不能問。不能以三隅反矣，故不復。及其旣出，則懼其終不喩也，求老農老圃而學焉，則其失愈遠矣。故復言之，使知前所言者意有在也。”,,"양씨(楊氏)가 말하였다. “번수(樊須)가 성인(聖人)의 문하(門下)에 있으면서 농사 짓는 법과 채전(菜田) 가꾸는 것을 물었으니, 뜻이 비루하다. 공자(孔子)께서 말하여 물리치심[열어줌]이 옳았을 터인데, 그가 나가기를 기다린 뒤에 그의 잘못을 말씀하신 것은 어째서인가? 그의 물음에 대해서 스스로 늙은 농부와 원예사만 못하다고 말씀하셨으니, 거절하기를 지극히 하신 것이다. 번수(樊須)의 학문은 의심컨대 이에 미치지 못하여 능히 묻지 못하였으니, 이는 한 귀퉁이를 들어 일러줌에 세 모퉁이를 반증(反證)하지 못한 것이다. 그러므로 다시 말해주지 않으신 것이다. 그가 이미 밖으로 나감에 미쳐서는 끝내 깨닫지 못하고 늙은 농부와 늙은 원예사를 찾아가 배우게 된다면 그 잘못됨이 더욱 커질까 두려웠다. 그러므로 다시 말씀하시어 앞에서 말한 것은 뜻이 다른 데 있음을 알게 하신 것이다.”"
子曰誦詩三百授之以政不達使於四方不能專對雖多亦奚以爲,專獨也詩本人情該物理可以驗風俗之盛衰見政治之得失其言溫厚和平長於風諭故誦之者必達於政而能言也,子曰：“誦詩三百，授之以政，不達；使於四方，不能專對；雖多，亦奚以爲？”,專，獨也。詩本人情，該物理，可以驗風俗之盛衰，見政治之得失。其言溫厚和平，長於風諭。故誦之者，必達於政而能言也。,"공자(孔子)께서 말씀하셨다. “《시경(詩經)》 3백편(百篇)을 외우면서도 정치를 맡겼을 때에 제대로 해내지 못하고, 사방(四方)에 사신(使臣)으로 나가 혼자서 처결하지 못한다면, 비록 많이 외운다 한들 어디에 쓰겠는가?”","전(專)은 홀로이다. 《시경(詩經)》의 시(詩)는 인정(人情)에 근본하고 사물의 이치를 포괄하여, 풍속의 성쇠를 징험하고 정치의 잘잘못을 볼 수 있으며, 그 말[내용]들이 온후(溫厚)하고 화평(和平)하여 풍자해서 깨우침에 뛰어나다. 그러므로 시(詩)를 외우는 자는 반드시 정치에 통달하고 언어에 능한 것이다."
,程子曰窮經將以致用也世之誦詩者果能從政而專對乎然則其所學者章句之末耳此學者之大患也,,程子曰：“窮經將以致用也。世之誦詩者，果能從政而專對乎？然則其所學者，章句之末耳，此學者之大患也。”,,"정자(程子)가 말씀하였다. “경서(經書)를 궁구(窮究)함은 장차 실용(實用)을 이루려는 것이니, 세상에 시(詩)를 외우는 자들이 과연 능히 정치에 종사하며 혼자서 처결할 수 있겠는가? <절대로 그렇지 못하다.> 그렇다면 그가 배운 것은 장구(章句)의 지엽적인 것일 뿐이니, 이는 배우는 자들의 큰 병통이다.”"
子曰其身正不令而行其身不正雖令不從,,子曰：“其身正，不令而行；其身不正，雖令不從。”,(주석없음),"공자(孔子)께서 말씀하셨다. “자기 자신이 바르면 명령하지 않아도 행해지고, 자신이 바르지 못하면 비록 명령한다 하더라도 따르지 않는다.”",(주석해석없음)
子曰魯衛之政兄弟也,魯周公之後衛康叔之後本兄弟之國而是時衰亂政亦相似故孔子嘆之,子曰：“魯衛之政，兄弟也。”,魯，周公之後。衛，康叔之後。本兄弟之國，而是時衰亂，政亦相似，故孔子嘆之。,공자(孔子)께서 말씀하셨다. “노(魯)나라와 위(衛)나라의 정사는 형제간이로구나!”,"노(魯)나라는 주공(周公)의 후예(後裔)요, 위(衛)나라는 강숙(康叔)의 후예(後裔)여서 본래 형제(兄弟)의 나라였는데, 이 당시 쇠하고 혼란하여 정사도 서로 비슷하였다. 그러므로 공자(孔子)께서 탄식하신 것이다."
子謂衛公子荊善居室始有曰苟合矣少有曰苟完矣富有曰苟美矣,公子荊衛大夫苟聊且粗略之意合聚也完備也言其循序而有節不以欲速盡美累其心,子謂衛公子荊，“善居室。始有，曰：‘苟合矣。’少有，曰：‘苟完矣。’富有，曰：‘苟美矣。’”,公子荊，衛大夫。苟，聊且粗略之意。合，聚也。完，備也。言其循序而有節，不以欲速盡美累其心。,"공자(孔子)께서 위(衛)나라의 공자(公子) 형(荊)을 두고 다음과 같이 논평하셨다. “그는 집에 거처하기를 잘하였다. 처음 <가재도구를> 소유했을 때에는 ‘그런대로 이만하면 모여졌다.’하였고, 다소 갖추어졌을 때에는 ‘그런대로 이만하면 갖추어졌다.’하였고, 많이 가지고 있을 때에는 ‘그런대로 이만하면 아름답다.’하였다.”","공자(公子) 형(荊)은 위(衛)나라 대부(大夫)이다. 구(苟)는 그런대로 대강이라〔聊且粗略〕는 뜻이다. 합(合)은 모음이요, 완(完)은 갖춤이다. 순서를 따르고 절도가 있어 빨리 하고자 하고 모두를 아름답게 하고자 함으로써 마음을 얽매지 않음을 말한 것이다."
,楊氏曰務爲全美則累物而驕吝之心生公子荊皆曰苟而已則不以外物爲心其欲易足故也,,楊氏曰：“務爲全美，則累物而驕吝之心生。公子荊皆曰苟而已，則不以外物爲心，其欲易足故也。”,,"양씨(楊氏)가 말하였다. “완전히 아름답게 하기를 힘쓰면 물욕에 마음이 얽매여 교만하고 인색한 마음이 생긴다. 공자(公子) 형(荊)은 모두를 ‘그런대로 이만하면’이라고 말할 따름이었으니, 이는 외물(外物)로 마음을 삼지 않아 그 욕망이 충족되기 쉬운 때문이었다.”"
子適衛冉有僕,僕御車也,子適衛，冉有僕。,僕，御車也。,공자(孔子)께서 위(衛)나라에 가실 때에 염유(冉有)가 수레를 몰았다.,복(僕)은 수레를 모는 것이다.
子曰庶矣哉,庶衆也,子曰：“庶矣哉！”,庶，衆也。,공자(孔子)께서 “백성들이 많기도 하구나.” 하셨다.,서(庶)는 많은 것이다.
冉有曰旣庶矣又何加焉曰富之,庶而不富則民生不遂故制田里薄賦斂以富之,冉有曰：“旣庶矣。又何加焉？”曰：“富之。”,庶而不富，則民生不遂，故制田里，薄賦斂以富之。,"염유(冉有)가 “이미 백성들이 많으면 또 무엇을 더하여야 합니까?” 하고 묻자, “부유(富裕)하게 해주어야 한다.” 하셨다.",백성들이 많기만 하고 부유(富裕)하지 못하면 백성들의 생활이 이루어지지 못한다. 그러므로 토지와 주택을 마련해 주고 세금을 가볍게 하여 부유(富裕)하게 해주는 것이다.
曰旣富矣又何加焉曰敎之,富而不敎則近於禽獸故必立學校明禮義以敎之,曰：“旣富矣，又何加焉？”曰：“敎之。”,富而不敎，則近於禽獸。故必立學校，明禮義以敎之。,"“이미 부유(富裕)해지면 또 무엇을 더하여야 합니까?” 하고 묻자, “가르쳐야 한다.” 하셨다.",부유(富裕)하기만 하고 가르치지 않으면 금수(禽獸)에 가까워진다. 그러므로 반드시 학교(學校)를 세워서 예의(禮義)를 밝혀 가르쳐야 하는 것이다.
