대문,주석,대문표점,주석표점,대문해석,주석해석
陳成子弑簡公,成子齊大夫名恒簡公齊君名壬事在春秋哀公十四年,陳成子弑簡公。,成子，齊大夫，名恒。簡公，齊君，名壬。事在春秋哀公十四年。,"진성자(陳成子)가 간공(簡公)을 시해하자,",성자(成子)는 제(齊)나라 대부(大夫)이니 이름은 항(恒)이다. 간공(簡公)은 제(齊)나라 군주(君主)이니 이름은 임(壬)이다. 사실이 《춘추(春秋)》애공(哀公) 14년조(年條)에 기록되어 있다.
孔子沐浴而朝告於哀公曰陳恒弑其君請討之,是時孔子致仕居魯沐浴齊戒以告君重其事而不敢忽也臣弑其君人倫之大變天理所不容人人得而誅之況隣國乎故夫子雖已告老而猶請哀公討之,孔子沐浴而朝，告於哀公曰：“陳恒弑其君，請討之。”,是時孔子致仕居魯，沐浴齊戒以告君，重其事而不敢忽也。臣弑其君，人倫之大變，天理所不容，人人得而誅之，況隣國乎？故夫子雖已告老，而猶請哀公討之。,"공자(孔子)께서 목욕하고 조회하시어 애공(哀公)에게 아뢰셨다. “진항(陳恒)이 그 군주(君主)를 시해하였으니, 토벌하소서.”","이때에 공자(孔子)는 치사(致仕)하고 노(魯)나라에 계셨다. 목욕 재계하고 임금에게 아뢴 것은 그 일을 중히 여겨 감히 소홀히 하지 못하신 것이다. 신하가 그 군주(君主)를 시해함은 인륜(人倫)의 큰 변고이니 천리(天理)에 용납될 수 없으므로 사람마다 모두 그를 주벌 할 수 있는 것인데, 하물며 이웃나라이겠는가? 그러므로 공자(孔子)께서 비록 이미 고로(告老)하고 계셨는데도 오히려 애공(哀公)에게 토벌하기를 청하신 것이다."
公曰告夫三子,三子三家也時政在三家哀公不得自專故使孔子告之,公曰：“告夫三子！”,三子，三家也。時政在三家，哀公不得自專，故使孔子告之。,애공(哀公)이 말하였다. “저 삼자(三子)에게 말하라.”,삼자(三子)는 삼가(三家)이다. 당시에 정권(政權)이 삼가(三家)에게 있어서 애공(哀公)이 마음대로 할 수 없었다. 그러므로 공자(孔子)로 하여금 말씀하게 한 것이다.
孔子曰以吾從大夫之後不敢不告也君曰告夫三子者,孔子出而自言如此意謂弑君之賊法所必討大夫謀國義所當告君乃不能自命三子而使我告之邪,孔子曰：“以吾從大夫之後，不敢不告也。君曰‘告夫三子’者。”,孔子出而自言如此。意謂弑君之賊，法所必討。大夫謀國，義所當告。君乃不能自命三子，而使我告之邪？,"공자(孔子)께서 말씀하셨다. “내가 대부(大夫)의 뒤〔末席〕를 따랐기 때문에 감히 아뢰지 않을 수 없었는데, 임금께서는 저 삼자(三子)에게 말하라 하시는구나.”","공자(孔子)께서 밖으로 나와 스스로 말씀하기를 이와 같이 하신 것이다. 공자(孔子)의 뜻은 군주(君主)를 시해한 역적(逆賊)은 법에 반드시 토벌해야 할 것이요, 대부(大夫)는 국사(國事)를 도모하니, 의리상 마땅히 아뢰어야 하는데, 임금께서는 마침내 스스로 삼가(三家)에게 명령하지 못하시고 나로 하여금 말하게 하시는가라고 한 것이다."
之三子告不可孔子曰以吾從大夫之後不敢不告也,以君命往告而三子魯之强臣素有無君之心實與陳氏聲勢相倚故沮其謀而夫子復以此應之其所以警之者深矣,之三子告，不可。孔子曰：“以吾從大夫之後，不敢不告也。”,以君命往告，而三子魯之强臣，素有無君之心，實與陳氏聲勢相倚，故沮其謀。而夫子復以此應之，其所以警之者深矣。,"삼자(三子)에게 가서 말씀하자, 불가(不可)하다 하니, 공자(孔子)께서 말씀하셨다. “내가 대부(大夫)의 뒤를 따랐기 때문에 감히 말하지 않을 수 없었다.”","임금의 명령으로 가서 말씀하였는데, 삼가(三家)는 노(魯)나라의 강성(强盛)한 신하로 본래 임금을 무시하는 마음이 있어서 실로 진씨(陳氏)와 성세(聲勢)가 서로 의지하였다. 그러므로 계획을 저지한 것인데, 부자(夫子)께서 다시 이 말씀으로 응하셨으니, 그 경계하심이 깊다."
,程子曰左氏記孔子之言曰陳恒弑其君民之不予者半以魯之衆加齊之半可克也此非孔子之言誠若此言是以力不以義也若孔子之志必將正名其罪上告天子下告方伯而率與國以討之至於所以勝齊者孔子之餘事也豈計魯人之衆寡哉當是時天下之亂極矣因是足以正之周室其復興乎魯之君臣終不從之可勝惜哉胡氏曰春秋之法弑君之賊人得而討之仲尼此擧先發後聞可也,,程子曰：“左氏記孔子之言曰：‘陳恒弑其君，民之不予者半。以魯之衆，加齊之半，可克也。’此非孔子之言。誠若此言，是以力不以義也。若孔子之志，必將正名其罪，上告天子，下告方伯，而率與國以討之。至於所以勝齊者，孔子之餘事也，豈計魯人之衆寡哉？當是時，天下之亂極矣，因是足以正之，周室其復興乎？魯之君臣，終不從之，可勝惜哉！”胡氏曰“春秋之法，弑君之賊，人得而討之。仲尼此擧，先發後聞可也。”,,"정자(程子)가 말씀하였다. “좌씨(左氏)가 공자(孔子)의 말씀을 기록하기를 ‘진항(陳恒)이 그 군주(君主)를 시해하니 제(齊)나라 국민(國民)중에 편들어주지 않는 자가 반이나 됩니다. 노(魯)나라의 많은 무리에다가 제(齊)나라의 반을 보태면 제(齊)나라를 토벌하여 이길 수 있습니다.’하였는데, 이는 공자(孔子)의 말씀이 아니다. 만일 이 말과 같다면 이것은 힘으로 한 것이지 의리(義理)로 한 것이 아니다. 공자(孔子)의 뜻으로 말하면, 반드시 장차 그 죄를 바로 지목하여 위로는 천자(天子)에게 아뢰고 아래로는 방백(方伯)[패권국(霸權國)]에게 말한 다음 여국(與國)[동맹국]을 거느리고 토벌하려 하셨을 것이니, 제(齊)나라를 이길 수 있는 것에 대해서는 공자(孔子)의 여사(餘事)에 해당된다. 어찌 노(魯)나라 사람이 많고 적음을 계산하겠는가? 이 때를 당하여 천하(天下)의 난리가 극에 달하였으니, 이로 인하여 바로잡았으면 주(周)나라 왕실(王室)이 다시 부흥(復興)할 수 있었을 것인데, 노(魯)나라의 군신(君臣)들이 끝내 따르지 않았으니, 애석함을 이루 말할 수 있겠는가?” 호씨(胡氏)가 말하였다. “《춘추(春秋)》의 법에 군주(君主)를 시해한 역적(逆賊)은 사람마다 모두 토벌할 수 있었으니, 공자(孔子)의 이 일은 먼저 토벌하고 뒤에 천자(天子)에게 아뢰더라도 괜찮다.”"
子路問事君子曰勿欺也而犯之,犯謂犯顔諫爭,子路問事君。子曰：“勿欺也，而犯之。”,犯，謂犯顔諫爭。,"자로(子路)가 임금 섬기는 것을 묻자, 공자(孔子)께서 대답하셨다. “속이지 말고 얼굴을 대놓고 간쟁해야 한다.”",범(犯)은 임금의 얼굴을 대놓고 간쟁하는 것이다.
,范氏曰犯非子路之所難也而以不欺爲難故夫子告以先勿欺而後犯也,,范氏曰：“犯非子路之所難也，而以不欺爲難。故夫子告以先勿欺而後犯也。”,,"범씨(范氏)가 말하였다. “얼굴을 대놓고 간쟁하는 것은 자로(子路)의 어려운 바가 아니요, 속이지 않는 것이 어려운 것이었다. 그러므로 부자(夫子)께서 속이지 말 것을 먼저 하고 간쟁하는 것을 뒤에 말씀해 주신 것이다.”"
子曰君子上達小人下達,君子循天理故日進乎高明小人徇人欲故日究乎汚下,子曰：“君子上達，小人下達。”,君子循天理，故日進乎高明；小人徇人欲，故日究乎汚下。,"공자(孔子)께서 말씀하셨다. “군자(君子)는 위로 통달하고, 소인(小人)은 아래로 통달한다.”","군자(君子)는 천리(天理)를 따른다. 그러므로 날로 고명(高明)함에 나아가고, 소인(小人)은 인욕(人慾)을 따른다. 그러므로 날로 오하(汚下)[비하(卑下)]함에 이르는 것이다."
子曰古之學者爲己今之學者爲人,程子曰爲己欲得之於己也爲人欲見知於人也,子曰：“古之學者爲己，今之學者爲人。”,程子曰：“爲己，欲得之於己也。爲人，欲見知於人也。”,"공자(孔子)께서 말씀하였다. “옛날에 배우는 자들은 자신을 위한 학문(學問)을 하였는데, 지금에 배우는 자들은 남을 위한 학문(學問)을 한다.”","정자(程子)가 말씀하였다. “위기(爲己)는 <도(道)를> 자기 몸에 얻으려고 하는 것이요, 위인(爲人)은 남에게 인정을 받고자 하는 것이다.”"
,程子曰古之學者爲己其終至於成物今之學者爲人其終至於喪己愚按聖賢論學者用心得失之際其說多矣然未有如此言之切而要者於此明辨而日省之則庶乎其不昧於所從矣,,程子曰：“古之學者爲己，其終至於成物。今之學者爲人，其終至於喪己。”愚按：聖賢論學者用心得失之際，其說多矣，然未有如此言之切而要者。於此明辨而日省之，則庶乎其不昧於所從矣。,,"정자(程子)가 말씀하였다. “옛날의 학자(學者)들은 자신을 위한 학문(學問)을 하여, 끝내는 남을 이루어 주는데 이르렀고, 지금의 학자(學者)들은 남을 위한 학문(學問)을 하여, 끝내는 자신을 상실(喪失)하는데 이른다.” 내가 상고해보니, 성현(聖賢)이 학자(學者)들의 용심(用心)에 대한 잘잘못〔得失〕의 사이를 논한 말씀이 많으나, 이 말과 같이 절실하고도 긴요한 것이 있지 않으니, 이에 대하여 밝게 분변하고 날마다 살피면, 거의 따르는 바에 어둡지 않게 될 것이다."
蘧伯玉使人於孔子,蘧伯玉衛大夫名瑗孔子居衛嘗主於其家旣而反魯故伯玉使人來也,蘧伯玉使人於孔子。,蘧伯玉，衛大夫，名瑗。孔子居衛，嘗主於其家。旣而反魯，故伯玉使人來也。,"거백옥(蘧伯玉)이 사람을 보내 공자(孔子)께 문안드리니,","거백옥(蘧伯玉)은 위(衛)나라 대부(大夫)이니, 이름은 원(瑗)이다. 공자(孔子)께서 위(衛)나라에 계실 적에 일찍이 그의 집에 머물러 그를 주인(主人)으로 삼았었는데, 이윽고 노(魯)나라로 돌아오셨으므로, 거백옥(蘧伯玉)이 사람을 보내온 것이다."
孔子與之坐而問焉曰夫子何爲對曰夫子欲寡其過而未能也使者出子曰使乎使乎,與之坐敬其主以及其使也夫子指伯玉也言其但欲寡過而猶未能則其省身克己常若不及之意可見矣使者之言愈自卑約而其主之賢益彰亦可謂深知君子之心而善於詞令者矣故夫子再言使乎以重美之按莊周稱伯玉行年五十而知四十九年之非又曰伯玉行年六十而六十化蓋其進德之功老而不倦是以踐履篤實光輝宣著不惟使者知之而夫子亦信之也,孔子與之坐而問焉，曰：“夫子何爲？”對曰：“夫子欲寡其過而未能也。”使者出。子曰：“使乎！使乎！”,與之坐，敬其主以及其使也。夫子，指伯玉也。言其但欲寡過而猶未能，則其省身克己，常若不及之意可見矣。使者之言愈自卑約，而其主之賢益彰，亦可謂深知君子之心，而善於詞令者矣。故夫子再言使乎以重美之。按莊周稱“伯玉行年五十而知四十九年之非”。又曰：“伯玉行年六十而六十化。”蓋其進德之功，老而不倦。是以踐履篤實，光輝宣著。不惟使者知之，而夫子亦信之也。,"공자(孔子)께서 그와 함께 앉고 물으시기를 “부자(夫子)[거백옥(蘧伯玉)]께서는 무엇을 하시는가?” 하시자, 대답하기를 “부자(夫子)께서는 허물을 적게 하려고 하시지만 아직 능치 못하십니다.” 하였다. 시자(使者)가 나가자, 공자(孔子)께서 말씀하셨다. “훌륭한 시자(使者)이구나! 훌륭한 시자(使者)이구나!”","그와 함께 앉은 것은 그 주인(主人)을 공경하여 그 시자(使者)에게까지 미친 것이다. 부자(夫子)는 거백옥(蘧伯玉)을 가리킨 것이다. 단지 허물을 적게 하려고 하지만 능치 못하다고 말하였으니, 그 몸을 성찰하고 사욕을 이겨, 항상 미치지 못할 듯이 여기는 뜻을 볼 수 있다 시자(使者)의 말이 더욱 스스로 비약(卑約)[겸손]하였지만, 그 주인(主人)의 훌륭함은 더욱 드러났으니, 또한 군자(君子)의 마음을 깊이 알고 사령(詞令)을 잘하는 자라고 할 만하다. 그러므로 공자(孔子)께서 두 번이나 시호(使乎)라고 말씀하시어 거듭 찬미(讚美)하신 것이다. 내가 상고해보니, 장주(莊周)가 이르기를 “거백옥(蘧伯玉)은 나이 50세(歲)에 49년 동안의 잘못을 알았다.” 하였고, 또 “나이 60세(歲)가 되어 60세에 변화하였다.” 하였으니, 그 덕(德)에 나아가는 공부(功夫)가 늙어서도 게으르지 않은 것이다. 이 때문에 천리(踐履)[실천]가 독실하고, 빛나는 덕(德)이 드러나서 오직 시자(使者)만이 그것을 알았을 뿐만 아니라, 부자(夫子)께서도 또한 믿으신 것이다."
子曰不在其位不謀其政,重出,子曰：“不在其位，不謀其政。”,重出。,공자(孔子)께서 말씀하셨다. “그 지위에 있지 않으면 그 정사를 도모하지 않는 것이다.”,다시 나왔다.
曾子曰君子思不出其位,此艮卦之象辭也曾子蓋嘗稱之記者因上章之語而類記之也,曾子曰：“君子思不出其位。”,此艮卦之象辭也。曾子蓋嘗稱之，記者因上章之語而類記之也。,증자(曾子)가 말씀하였다. “군자(君子)는 생각이 그 지위[위치]를 벗어나지 않는다.”,"이것은 <《주역(周易)》> 간괘(艮卦)의 상사(象辭)이다. 증자(曾子)가 일찍이 이 말을 일컬으셨는데, 기록하는 자가 위 장(章)의 말을 인하여 같은 유(類)끼리 기록한 것이다."
,范氏曰物各止其所而天下之理得矣故君子所思不出其位而君臣上下大小皆得其職也,,范氏曰：“物各止其所，而天下之理得矣。故君子所思不出其位，而君臣、上下、大小，皆得其職也。”,,"범씨(范氏)가 말하였다. “사물(事物)이 각자 제자리에 있으면 천하(天下)의 이치가 올바르게 된다. 그러므로 군자(君子)의 생각하는 바가 그 지위[위치]를 벗어나지 않으매, 군신(君臣)과 상하(上下)와 크고 작은 것들이 모두 그 직분을 얻게 되는 것이다.”"
子曰君子恥其言而過其行,恥者不敢盡之意過者欲有餘之辭,子曰：“君子恥其言而過其行。”,恥者，不敢盡之意。過者，欲有餘之辭。,공자(孔子)께서 말씀하셨다. “군자(君子)는 그 말을 조심하고 행실을 말보다 앞서게 한다.”,"치(恥)는 감히 다하지 못한다는 뜻이요, 과(過)는 유여(有餘)하고자 한다는 말이다."
子曰君子道者三我無能焉仁者不憂知者不惑勇者不懼,自責以勉人也,子曰：“君子道者三，我無能焉：仁者不憂，知者不惑，勇者不懼。”,自責以勉人也。,"공자(孔子)께서 말씀하셨다. “군자(君子)의 도(道)가 세 가지인데, 나는 능한 것이 없다. 인자(仁者)는 근심하지 않고, 지자(智者)는 의혹하지 않고, 용자(勇者)는 두려워하지 않는 것이다.”",자책하여 사람을 면려(勉勵)하신 것이다.
子貢曰夫子自道也,道言也自道猶云謙辭,子貢曰：“夫子自道也。”,道，言也。自道，猶云謙辭。,자공(子貢)이 말하였다. “부자(夫子)께서 스스로 하신 겸사이시다.”,"도(道)는 말함이니, 자도(自道)는 겸사(謙辭)란 말과 같다."
,尹氏曰成德以仁爲先進學以知爲先故夫子之言其序有不同者以此,,尹氏曰：“成德以仁爲先，進學以知爲先。故夫子之言，其序有不同者以此。”,,"윤씨(尹氏)가 말하였다. “덕(德)을 이룸에는 인(仁)을 우선으로 삼고, 학문(學問)에 나아감에는 지(智)를 우선으로 삼는다. 그러므로 공자(孔子)의 말씀에 차례가 같지 않음이 있는 것은 이 때문이다.”"
子貢方人子曰賜也賢乎哉夫我則不暇,方比也乎哉疑辭比方人物而較其短長雖亦窮理之事然專務爲此則心馳於外而所以自治者疎矣故褒之而疑其辭復自貶以深抑之,子貢方人。子曰：“賜也賢乎哉？夫我則不暇。”,方，比也。乎哉，疑辭。比方人物而較其短長，雖亦窮理之事。然專務爲此，則心馳於外，而所以自治者疎矣。故褒之而疑其辭，復自貶以深抑之。,"자공(子貢)이 사람[인물]을 비교하니, 공자(孔子)께서 말씀하셨다. “사(賜)[자공(子貢)]는 어진가보다. 나는 그럴 겨를이 없노라.”","방(方)은 비교하는 것이다. 호재(乎哉)는 의문사이다. 인물을 비교하여 그 장단을 따지는 것 또한 궁리(窮理)하는 일이다. 그러나 오로지 이것을 함에 힘쓰면 마음이 밖으로 달려서, 자신을 다스리는 것이 소홀해진다. 그러므로 자공(子貢)을 칭찬하면서 그 말씀을 의문사로 하셨고, 다시 자신을 폄하(貶下)하여 깊이 억제하신 것이다."
,謝氏曰聖人責人辭不迫切而意已獨至如此,,謝氏曰：“聖人責人，辭不迫切而意已獨至如此。”,,사씨(謝氏)가 말하였다. “성인(聖人)이 사람을 꾸짖음에 말씀은 박절하지 않으면서도 뜻만은 이미 지극함이 이와 같다.”
子曰不患人之不己知患其不能也,凡章指同而文不異者一言而重出也文小異者屢言而各出也此章凡四見而文皆有異則聖人於此一事蓋屢言之其丁寧之意亦可見矣,子曰：“不患人之不己知，患其不能也。”,凡章指同而文不異者，一言而重出也。文小異者，屢言而各出也。此章凡四見，而文皆有異。則聖人於此一事，蓋屢言之，其丁寧之意亦可見矣。,"공자(孔子)께서 말씀하셨다. “남이 나를 알아주지 못함을 걱정하지 말고, 자신의 능하지 못함을 걱정해야 한다.”","모든 장(章)에 뜻이 같고 문장도 다르지 않은 것은 한 번 말씀한 것이 다시 나온 것이요, 문장이 조금 다른 것은 여러 번 말씀하여 각각 나온 것이다. 이 장(章)은 네 번 나오는데 문장이 모두 다르다. 그렇다면 성인(聖人)이 이 한 가지 일에 대해 여러 번 말씀하신 것이니, 그 정녕(丁寧)[간곡]하신 뜻을 또한 볼 수 있다."
子曰不逆詐不億不信抑亦先覺者是賢乎,逆未至而迎之也億未見而意之也詐謂人欺己不信謂人疑己抑反語辭言雖不逆不億而於人之情僞自然先覺乃爲賢也,子曰：“不逆詐，不億不信。抑亦先覺者，是賢乎！”,逆，未至而迎之也。億，未見而意之也。詐，謂人欺己。不信，謂人疑己。抑，反語辭。言雖不逆不億，而於人之情僞，自然先覺，乃爲賢也。,"공자(孔子)께서 말씀하셨다. “남이 나를 속일까 역탐(逆探)[미리 짐작]하지 않고, 남이 나를 믿어주지 않을까 억측(臆測)하지 않는다. 그러나 또한 먼저 깨닫는 자가 어진 것이다.”","역(逆)은 <일이> 아직 이르지 않은 것을 미리 짐작하는 것이요, 억(億)은 아직 보이지 않는 것을 억측하는 것이다. 사(詐)는 남이 자신을 속이는 것을 말하고, 불신(不信)은 남이 자신을 의심하는 것을 말한다. 억(抑)은 반어사(反語辭)이다. 비록 역탐(逆探)하지 않고 억측(臆測)하지 않으나, 남의 정위(情僞)[실정과 허위]에 대하여 자연히 먼저 깨달아야 어짊이 된다고 말씀한 것이다."
,楊氏曰君子一於誠而已然未有誠而不明者故雖不逆詐不億不信而常先覺也若夫不逆不億而卒爲小人所罔焉斯亦不足觀也已,,楊氏曰：“君子一於誠而已，然未有誠而不明者。故雖不逆詐、不億不信，而常先覺也。若夫不逆不億而卒爲小人所罔焉，斯亦不足觀也已。”,,양씨(楊氏)가 말하였다. “군자(君子)는 성실(誠實)에만 한결같이 할뿐이다. 그러나 성실(誠實)하고도 밝지 않은 자는 있지 않다. 그러므로 비록 남이 나를 속일까 역탐(逆探)하지 않고 남이 나를 믿지 않을까 억측(臆測)하지 않더라도 항상 먼저 깨닫는 것이다. 만일 역탐(逆探)하지 않고 억측(臆測)하지 않다가 끝내 소인(小人)에게 속임을 당하면 이 또한 볼 것이 없는 것이다.”
微生畝謂孔子曰丘何爲是栖栖者與無乃爲佞乎,微生姓畝名也畝名呼夫子而辭甚倨蓋有齒德而隱者栖栖依依也爲佞言其務爲口給以悅人也,微生畝謂孔子曰：“丘何爲是栖栖者與？無乃爲佞乎？”,微生，姓，畝，名也。畝名呼夫子而辭甚倨，蓋有齒德而隱者。栖栖，依依也。爲佞，言其務爲口給以悅人也。,미생묘(微生畝)가 공자(孔子)께 말하였다. “구(丘)는 어찌하여 이리도 연연해 하는가. 말재주를 구사하는 것이 아닌가?”,"미생(微生)은 성(姓)이고 묘(畝)는 이름이다. 미생묘(微生畝)가 공자(孔子)의 이름을 부르면서 말이 매우 거만하니, 아마도 연치(年齒)와 덕(德)이 있으면서 은둔한 자인 듯하다. 서서(栖栖)는 의의(依依)하는 것이다. 위녕(爲佞)은 말을 잘해서 사람을 기쁘게 하기를 힘쓰는 것을 말한다."
孔子曰非敢爲佞也疾固也,疾惡也固執一而不通也聖人之於達尊禮恭而言直如此其警之亦深矣,孔子曰：“非敢爲佞也，疾固也。”,疾，惡也。固，執一而不通也。聖人之於達尊，禮恭而言直如此，其警之亦深矣。,"공자(孔子)께서 말씀하셨다. “내 감히 말재주를 구사하려는 것이 아니라, 고집불통(固執不通)을 미워하는 것입니다.”","질(疾)은 미워하는 것이요, 고(固)는 한 가지를 고집하여 변통하지 못하는 것이다. 성인(聖人)이 달존(達尊)에 대하여 예절이 공손하고 말씀이 곧음이 이와 같으셨으니, 그 경계한 것이 또한 깊다."
子曰驥不稱其力稱其德也,驥善馬之名德謂調良也,子曰：“驥不稱其力，稱其德也。”,驥，善馬之名。德，謂調良也。,"공자(孔子)께서 말씀하셨다. “기마(驥馬)는 그 힘을 칭찬하는 것이 아니라, 그 덕(德)을 칭찬하는 것이다.”",기(驥)는 좋은 말의 명칭이다. 덕(德)은 길이 잘들고 성질이 양순한 것을 이른다.
,尹氏曰驥雖有力其稱在德人有才而無德則亦奚足尙哉,,尹氏曰：“驥雖有力，其稱在德。人有才而無德，則亦奚足尙哉？”,,"윤씨(尹氏)가 말하였다. “기마(驥馬)는 비록 힘이 있으나 그 칭찬은 덕(德)에 있는 것이니, 사람이 재주만 있고 덕(德)이 없으면 어찌 족히 숭상할 만한 것이겠는가?”"
或曰以德報怨何如,或人所稱今見老子書德謂恩惠也,或曰：“以德報怨，何如？”,或人所稱，今見老子書。德，謂恩惠也。,혹자가 말하였다. “덕(德)[은덕(恩德)]로써 원망[원한]에 갚는 것이 어떻습니까?”,혹자가 말한 것은 지금 《노자(老子)》책에 보인다. 덕(德)은 은혜를 말한다.
子曰何以報德,言於其所怨旣以德報之矣則人之有德於我者又將何以報之乎,子曰：“何以報德？”,言於其所怨，旣以德報之矣；則人之有德於我者，又將何以報之乎？,공자(孔子)께서 말씀하셨다. “무엇으로써 덕(德)에 갚을 것인가?,원한으로 여기는 자에게 이미 덕(德)으로써 갚았다면 나에게 덕(德)이 있는 자에게는 또 장차 무엇으로써 갚을 것인가라고 말씀한 것이다.
以直報怨以德報德,於其所怨者愛憎取舍一以至公而無私所謂直也於其所德者則必以德報之不可忘也,以直報怨，以德報德。,於其所怨者，愛憎取舍，一以至公而無私，所謂直也。於其所德者，則必以德報之，不可忘也。,"정직함으로써 원한에 갚고, 덕(德)으로써 덕(德)에 갚아야 한다.”","원한으로 여기는 자에게 사랑과 미움, 취하고 버림을 한결같이 지극히 공평하고 사사로움이 없는 것으로써 하는 것이 이른바 정직인 것이다. 그 덕(德)으로 여기는 자에게는 반드시 덕(德)으로써 갚아 주고 잊지 않아야 한다."
