대문,주석,대문표점,주석표점,대문해석,주석해석
曰今之從政者何如子曰噫斗筲之人何足算也,今之從政者蓋如魯三家之屬噫心不平聲斗量名容十升筲竹器容斗二升斗筲之人言鄙細也算數也子貢之問每下故夫子以是警之,曰：“今之從政者何如？”子曰：“噫！斗筲之人，何足算也。”,今之從政者，蓋如魯三家之屬。噫，心不平聲。斗，量名，容十升。筲，竹器，容斗二升。斗筲之人，言鄙細也。算，數也。子貢之問每下，故夫子以是警之。,"“지금 정사에 종사하는 자들은 어떻습니까?” 하자, 공자(孔子)께서 말씀하셨다. “아! 한 말이나 한 말 두 되 들어갈 정도의 좁은 소견을 가진 사람들을 어찌 족히 따질 것이 있겠는가?”","지금 정사에 종사하는 자란 노(魯)나라 삼가(三家)와 같은 따위이다. 희(噫)는 마음이 편치 못하여 하는 소리이다. 두(斗)는 도량형(度量衡) 단위(單位)의 이름이니 10승(升)이 들어가고, 소(筲)는 대그릇이니 1두(斗) 2승(升)이 들어간다. 두소지인(斗筲之人)이란 비루하고 자질구레함을 말한다. 산(算)은 헤아리는 것이다. 자공(子貢)의 물음이 매번 내려갔기 때문에 부자(夫子)께서 이 말씀으로 경계하신 것이다."
,程子曰子貢之意蓋欲爲皎皎之行聞於人者夫子告之皆篤實自得之事,,程子曰：“子貢之意，蓋欲爲皎皎之行，聞於人者。夫子告之，皆篤實自得之事。”,,"정자(程子)가 말씀하였다. “자공(子貢)의 뜻은 남들이 알아주는 특별한 행동을 하여 남들에게 소문나려고 하는 것이었는데, 부자(夫子)께서 말씀하신 것은 모두 독실하여 스스로 만족해하는 일이었다.”"
子曰不得中行而與之必也狂狷乎狂者進取狷者有所不爲也,行道也狂者志極高而行不掩狷者知未及而守有餘蓋聖人本欲得中道之人而敎之然旣不可得而徒得謹厚之人則未必能自振拔而有爲也故不若得此狂狷之人猶可因其志節而激厲裁抑之以進於道非與其終於此而已也,子曰：“不得中行而與之，必也狂狷乎！狂者進取，狷者有所不爲也。”,行，道也。狂者，志極高而行不掩。狷者，知未及而守有餘。蓋聖人本欲得中道之人而敎之，然旣不可得，而徒得謹厚之人，則未必能自振拔而有爲也。故不若得此狂狷之人，猶可因其志節，而激厲裁抑之以進於道，非與其終於此而已也。,공자(孔子)께서 말씀하셨다. “중행(中行)[중도(中道)]의 선비를 얻어 더불 수 없다면 반드시 광자(狂者)나 견자(狷者)와 더불어 할 것이다. 광자(狂者)는 진취적이고 견자(狷者)는 하지 않는 바가 있다.”,"행(行)은 도(道)이다. 광자(狂者)는 뜻은 지극히 높으나 행동이 말을 가리우지 못하는 것이요, 견자(狷者)는 지식은 미치지 못하나 지킴[행동]은 유여(有餘)한 것이다. 성인(聖人)은 본래 중도(中道)를 행하는 사람을 얻어 가르치려고 하였으나 이미 얻을 수 없고, 한갓 근후(謹厚)하기 만한 사람을 얻는다면 반드시 능히 스스로 분발하여 일어나 훌륭한 일을 하지 못할 것이다. 그러므로 이 광자(狂者)나 견자(狷者)를 얻어 가르치는 것만 못하다. 이들은 그래도 지조와 절개를 인하여 격려하고 억제하여 도(道)에 나아가게 할 수 있기 때문이요, 끝내 여기에서 마칠 뿐임을 허여 한 것은 아니다."
,孟子曰孔子豈不欲中道哉不可必得故思其次也如琴張曾晳牧皮者孔子之所謂狂也其志嘐嘐然曰古之人古之人夷考其行而不掩焉者也狂者又不可得欲得不屑不潔之士而與之是狷也是又其次也,,孟子曰：“孔子豈不欲中道哉？不可必得，故思其次也。如琴張、曾晳、牧皮者，孔子之所謂狂也。其志嘐嘐然，曰：‘古之人！古之人！’夷考其行而不掩焉者也。狂者又不可得，欲得不屑不潔之士而與之，是狷也，是又其次也。”,,"맹자(孟子)가 말씀하였다. “공자(孔子)께서 어찌 중도(中道)를 행하는 사람을 구하려고 하지 않았겠는가마는, 반드시 얻을 수는 없는 까닭에 그 다음의 인물을 생각하신 것이다. 금장(琴張)·증석(曾晳)·목피(牧皮)와 같은 자가 공자(孔子)께서 말씀하신 광자(狂者)이다. 이들은 뜻이 커서 말하기를 ‘옛날 분들이여! 옛날 분들이여!’하고 말하지만, 평소에 그 행실을 살펴보면 행실이 말을 가리우지 못하는 자들이다. 광자(狂者)를 또 얻을 수 없다면 불결(不潔)함을 달갑게 여기지 않는 선비를 얻어 가르치려고 하셨으니, 이러한 사람이 견자(狷者)이다. 이것이 또 그 다음의 인물이다.”"
子曰南人有言曰人而無恒不可以作巫醫善夫,南人南國之人恒常久也巫所以交鬼神醫所以寄死生故雖賤役而尤不可以無常孔子稱其言而善之,子曰：“南人有言曰：‘人而無恒，不可以作巫醫。’善夫！”,南人，南國之人。恒，常久也。巫，所以交鬼神。醫，所以寄死生。故雖賤役，而尤不可以無常，孔子稱其言而善之。,"공자(孔子)께서 말씀하셨다. “남쪽 나라 사람들의 말에 ‘사람이 항심(恒心)이 없으면 무당이나 의원도 될 수 없다.’하니, 좋은 말이다.","남인(南人)은 남쪽 나라 사람이다. 항(恒)은 항상 하고 오래함이다. 무당은 귀신과 사귀는 것이요, 의원은 죽고 삶을 맡기는 바이다. 그러므로 비록 비천(卑賤)한 일을 하나 더욱 항심(恒心)이 없어서는 안 되는 것이다. 공자(孔子)게서 그 말을 듣고 칭송하시어 좋게 여기신 것이다."
不恒其德或承之羞,此易恒卦九三爻辭承進也,“不恒其德，或承之羞。”,此易恒卦九三爻辭。承，進也。,‘그 덕(德)을 항상 하지 않으면 혹자가 부끄러움을 올린다.’하였다.”,이는 《주역(周易)》 항괘(恒卦) 구삼효(九三爻)의 효사(爻辭)이다. 승(承)은 올림이다.
子曰不占而已矣,復加子曰以別易文也其義未詳楊氏曰君子於易苟玩其占則知無常之取羞矣其爲無常也蓋亦不占而已矣意亦略通,子曰：“不占而已矣。”,復加“子曰”，以別易文也，其義未詳。楊氏曰：“君子於易苟玩其占，則知無常之取羞矣。其爲無常也，蓋亦不占而已矣。”意亦略通。,공자(孔子)께서 말씀하셨다. “점괘〔占〕를 보지 않았기 때문일 뿐이다.”,"다시 자왈(子曰)을 가(加)한 것은 《주역(周易)》의 글과 구별하기 위해서이다. 이 글의 뜻은 자세하지 않다. 양씨(楊氏)는 “군자(君子)가 《주역(周易)》에 대하여 만일 그 점괘의 내용을 음미해 보면 항심(恒心)없는 것이 부끄러움을 취하게 됨을 알게 될 것이다. 항심(恒心)이 없는 짓을 하는 것은 이 점괘의 내용을 보지 않았기 때문일 것이다.” 하였으니, 뜻이 또한 대략 통한다."
子曰君子和而不同小人同而不和,和者無乖戾之心同者有阿比之意,子曰：“君子和而不同，小人同而不和。”,和者，無乖戾之心。同者，有阿比之意。,"공자(孔子)께서 말씀하셨다. “군자(君子)는 화(和)하고 동(同)하지 않으며, 소인(小人)은 동(同)하고 화(和)하지 않는다.”","화(和)는 거슬리고 비틀어진 마음이 없는 것이요, 동(同)은 아당(阿黨)하는 뜻이 있는 것이다."
,尹氏曰君子尙義故有不同小人尙利安得而和,,尹氏曰：“君子尙義，故有不同。小人尙利，安得而和？”,,"윤씨(尹氏)가 말하였다. “군자(君子)는 의리(義理)를 숭상한다. 그러므로 동(同)하지 않음이 있는 것이다. 소인(小人)은 이익(利益)을 숭상하니, 어떻게 화(和)할 수 있겠는가?”"
子貢問曰鄕人皆好之何如子曰未可也鄕人皆惡之何如子曰未可也不如鄕人之善者好之其不善者惡之,一鄕之人宜有公論矣然其間亦各以類自爲好惡也故善者好之而惡者不惡則必其有苟合之行惡者惡之而善者不好則必其無可好之實,子貢問曰：“鄕人皆好之，何如？”子曰：“未可也。”“鄕人皆惡之，何如？”子曰：“未可也。不如鄕人之善者好之，其不善者惡之。”,一鄕之人，宜有公論矣，然其間亦各以類自爲好惡也。故善者好之而惡者不惡，則必其有苟合之行。惡者惡之而善者不好，則必其無可好之實。,"자공(子貢)이 묻기를 “지방 사람들이 모두 좋아하면 어떻습니까?” 하자, 공자(孔子)께서 “가(可)하지 못하다.” 하셨다. “지방 사람들이 모두 미워하면 어떻습니까?” 하자, 공자(孔子)께서 대답하셨다. “가(可)하지 못하다. 지방 사람 중에 선(善)한 자가 좋아하고, 선(善)하지 못한 자가 미워하는 것만 못하다.”","한 지방의 사람들에게는 당연히 공정한 평론이 있을 것이다. 그러나 그 사이에는 또한 각기 부류에 따라 스스로 좋아하거나 미워한다. 이 때문에 선(善)한 자가 좋아하고 악(惡)한 자가 미워하지 않는다면 반드시 구차하게 영합(迎合)하는 행실이 있어서일 것이요, 악(惡)한 자가 미워하고 선(善)한 자가 좋아하지 않는다면 반드시 좋아할 만한 실상이 없어서일 것이다."
子曰君子易事而難說也說之不以道不說也及其使人也器之小人難事而易說也說之雖不以道說也及其使人也求備焉,器之謂隨其材器而使之也君子之心公而恕小人之心私而刻天理人欲之間每相反而已矣,子曰：“君子易事而難說也：說之不以道，不說也；及其使人也，器之。小人難事而易說也：說之雖不以道，說也；及其使人也，求備焉。”,器之，謂隨其材器而使之也。君子之心公而恕，小人之心私而刻。天理人欲之間，每相反而已矣。,"공자(孔子)께서 말씀하셨다. “군자(君子)는 섬기기는 쉬워도 기뻐하게 하기는 어렵다. 기뻐하게 하기를 도(道)로써 하지 않으면 기뻐하지 않으며, 사람을 부림에 있어서는 그릇에 따라 한다. 소인(小人)은 섬기기는 어려워도 기뻐하게 하기는 쉽다. 기뻐하게 하기를 비록 도(道)에 맞게 하지 않더라도 기뻐하며, 사람을 부림에 있어서는 구비하기를 요구한다.”","기지(器之)는 그의 재목과 그릇에 따라 부림을 이른다. 군자(君子)의 마음은 공정(公正)하면서 서(恕)하고, 소인(小人)의 마음은 사사로우면서 각박하니, 천리(天理)와 인욕(人欲)의 사이는 매양 서로 반대될 뿐이다."
子曰君子泰而不驕小人驕而不泰,君子循理故安舒而不矜肆小人逞欲故反是,子曰：“君子泰而不驕，小人驕而不泰。”,君子循理，故安舒而不矜肆。小人逞欲，故反是。,"공자(孔子)께서 말씀하셨다. “군자(君子)는 태연하되 교만하지 않고, 소인(小人)은 교만하되 태연하지 못하다.",군자(君子)는 천리(天理)를 따른다. 그러므로 편안하고 펴있으면서도 자랑하거나 방사(放肆)하지 않는다. 소인(小人)은 인욕(人慾)을 부린다. 그러므로 이와 반대인 것이다.
子曰剛毅木訥近仁,程子曰木者質樸訥者遲鈍四者質之近乎仁者也楊氏曰剛毅則不屈於物欲木訥則不至於外馳故近仁,子曰：“剛毅、木訥，近仁。”,程子曰：“木者，質樸。訥者，遲鈍。四者，質之近乎仁者也。”楊氏曰：“剛毅則不屈於物欲，木訥則不至於外馳，故近仁。”,"공자(孔子)께서 말씀하셨다. “강하고 굳세고, 질박하고 어눌(語訥)함이 인(仁)에 가깝다.”","정자(程子)가 말씀하였다. “목(木)은 질박함이요, 눌(訥)은 더디고 둔함이다. 이 네 가지는 자질이 인(仁)에 가까운 것이다.” 양씨(楊氏)가 말하였다. “강하고 굳세면 물욕(物慾)에 굽히지 않고, 질박하고 어눌하면 외물(外物)에 치달리지 않는다. 그러므로 인(仁)에 가까운 것이다.”"
子路問曰何如斯可謂之士矣子曰切切偲偲怡怡如也可謂士矣朋友切切偲偲兄弟怡怡,胡氏曰切切懇到也偲偲詳勉也怡怡和悅也皆子路所不足故告之又恐其混於所施則兄弟有賊恩之禍朋友有善柔之損故又別而言之,子路問曰：“何如斯可謂之士矣？”子曰：“切切、偲偲、怡怡如也，可謂士矣。朋友切切、偲偲，兄弟怡怡。”,胡氏曰：“切切，懇到也。偲偲，詳勉也。怡怡，和悅也。皆子路所不足，故告之。又恐其混於所施，則兄弟有賊恩之禍，朋友有善柔之損，故又別而言之。”,"자로(子路)가 “어떠하여야 이 선비라 이를 만합니까?” 하고 묻자, 공자(孔子)께서 대답하셨다. “간절하고 자상히 권면(勸勉)하며 화락(和樂)하면 선비라 이를 만하다. 붕우(朋友)간에는 간절하고 자상히 권면하며, 형제(兄弟)간에는 화락(和樂)하여야 한다.”","호씨(胡氏)가 말하였다. “절절(切切)은 간곡하고 지극한 것이요, 시시(偲偲)는 자상하게 권면(勸勉)하는 것이다. 이이(怡怡)는 화열(和悅)한 것이다. 이것은 모두 자로(子路)에게 부족한 점이다. 그러므로 말씀하신 것이다. 또 이것들을 시행함에 혼동하게 되면 형제간(兄弟間)에는 은혜를 해치는 화가 있고, 붕우간(朋友間)에는 유순하기를 잘하는 손해가 있을까 염려되므로 또 구별하여 말씀하신 것이다.”"
子曰善人敎民七年亦可以卽戎矣,敎民者敎之以孝弟忠信之行務農講武之法卽就也戎兵也民知親其上死其長故可以卽戎,子曰：“善人敎民七年，亦可以卽戎矣。”,敎民者，敎之以孝弟忠信之行，務農講武之法。卽，就也。戎，兵也。民知親其上，死其長，故可以卽戎。,공자(孔子)께서 말씀하셨다. “선인(善人)이 7년 동안 백성을 가르치면 또한 군대[싸움터]에 나아가게 할 수 있다.”,백성을 가르친다는 것은 효제충신(孝悌忠信)의 행실(行實)과 농사(農事)를 힘쓰고 무예(武藝)를 강마(講磨)하는 법을 가르치는 것이다. 즉(卽)은 나아감이다. 융(戎)은 병(兵)[전쟁]이다. <백성들을 가르치면> 백성들이 자기의 윗사람에게 친히 하고 자기의 관장(官長)을 위하여 죽을 줄 안다. 그러므로 싸움터에 나아갈 수 있는 것이다.
,程子曰七年云者聖人度其時可矣如云朞月三年百年一世大國五年小國七年之類皆當思其作爲如何乃有益,,程子曰：“七年云者，聖人度其時可矣。如云朞月、三年、百年、一世、大國五年、小國七年之類，皆當思其作爲如何乃有益。”,,"정자(程子)가 말씀하였다. “7년이라 말씀하신 것은 성인(聖人)이 그 정도의 시간이면 가(可)할 것이라고 헤아리신 것이다. 기월(朞月)이니, 3년이니, 백년이니, 한 세대이니, 큰 나라는 5년, 작은 나라는 7년이니 하는 따위들은 모두 마땅히 그 시행을 어떻게 할 것인가를 생각하여야 비로소 도움이 있을 것이다.”"
子曰以不敎民戰是謂棄之,以用也言用不敎之民以戰必有敗亡之禍是棄其民也,子曰：“以不敎民戰，是謂棄之。”,以，用也。言用不敎之民以戰，必有敗亡之禍，是棄其民也。,"공자(孔子)께서 말씀하셨다. “가르치지 않은 백성을 써서 전쟁하는 것, 이것을 일러 백성을 버리는 행위라 한다.”","이(以)는 쓰는 것이다. 가르치지 않은 백성을 써서 싸우게 하면 반드시 패망의 화가 있게 되니, 이는 그 백성을 버리는 것이란 말씀이다."
