대문,주석,대문표점,주석표점,대문해석,주석해석
憲問恥子曰邦有道穀邦無道穀恥也,憲原思名穀祿也邦有道不能有爲邦無道不能獨善而但知食祿皆可恥也憲之狷介其於邦無道穀之可恥固知之矣至於邦有道穀之可恥則未必知也故夫子因其問而幷言之以廣其志使知所以自勉而進於有爲也,憲問恥。子曰：“邦有道，穀；邦無道，穀，恥也。”,憲，原思名。穀，祿也。邦有道不能有爲，邦無道不能獨善，而但知食祿，皆可恥也。憲之狷介，其於邦無道穀之可恥，固知之矣；至於邦有道穀之可恥，則未必知也。故夫子因其問而幷言之，以廣其志，使知所以自勉，而進於有爲也。,"원헌(原憲)이 수치스러운 일을 물으니, 공자(孔子)께서 대답하셨다. “나라에 도(道)가 있을 때에 녹(祿)만 먹으며, 나라에 도(道)가 없을 때에 녹(祿)만 먹는 것이 수치스러운 일이다.”","헌(憲)은 원사(原思)의 이름이다. 곡(穀)은 녹(祿)이다. 나라에 도(道)가 있을 때에 훌륭한 일을 하지 못하고, 나라에 도(道)가 없을 때에 홀로 선(善)하게 하지 못하면서, 다만 녹(祿)을 먹을 줄만 아는 것은 모두 수치스러울 만한 일이다. 원헌(原憲)의 견개(狷介)〔志操〕는 나라에 도(道)가 없을 때에 녹(祿)을 먹는 것이 수치스러운 일이라는 것에 대해서는 진실로 알고 있었으나, 나라에 도(道)가 있을 때에 녹(祿)만 먹는 것이 수치스러운 일이라는 것에 대해서는 반드시 알지 못하였을 것이다. 그러므로 공자(孔子)께서 그의 질문을 인하여 이것까지 아울러 말씀하여, 그의 뜻을 넓혀서 스스로 힘쓸 바를 알게 하고 훌륭한 일을 할 수 있는 데 나아가게 하신 것이다."
克伐怨欲不行焉可以爲仁矣,此亦原憲以其所能而問也克好勝伐自矜怨忿恨欲貪欲,“克、伐、怨、欲不行焉，可以爲仁矣？”,此亦原憲以其所能而問也。克，好勝。伐，自矜。怨，忿恨。欲，貪欲。,"“이기기를 좋아하고 자기의 공로를 자랑하며, 원망하고 탐욕 함을 행해지지 않게 한다면 인(仁)이라고 말할 수 있습니까?”","이 또한 원헌(原憲)이 자신의 능한 것을 가지고 질문한 것이다. 극(克)은 이기기를 좋아하는 것이며, 벌(伐)은 스스로 자랑하는 것이며, 원(怨)은 분하게 여기고 원망하는 것이며, 욕(欲)은 탐욕이다."
子曰可以爲難矣仁則吾不知也,有是四者而能制之使不得行可謂難矣仁則天理渾然自無四者之累不行不足以言之也,子曰：“可以爲難矣，仁則吾不知也。”,有是四者而能制之，使不得行，可謂難矣。仁則天理渾然，自無四者之累，不行不足以言之也。,"공자(孔子)께서 말씀하셨다. “어렵다고 할 수는 있으나, 인(仁)인지는 내 알지 못하겠다.”","이 네 가지가 마음속에 있는데도 능히 제어하여 행해지지 못하게 한다면 어렵다고 할 수 있다. 인(仁)은 천리(天理)가 완전하여 저절로 네 가지의 누(累)가 없으니, 행해지지 못하게 하는 것은 굳이 말할 것이 못된다."
,程子曰人而無克伐怨欲惟仁者能之有之而能制其情使不行斯亦難能也謂之仁則未也此聖人開示之深惜乎憲之不能再問也或曰四者不行固不得爲仁矣然亦豈非所謂克己之事求仁之方乎曰克去己私以復乎禮則私欲不留而天理之本然者得矣若但制而不行則是未有拔去病根之意而容其潛藏隱伏於胸中也豈克己求仁之謂哉學者察於二者之間則其所以求仁之功益親切而無滲漏矣,,程子曰：“人而無克、伐、怨、欲，惟仁者能之。有之而能制其情使不行，斯亦難能也。謂之仁則未也。此聖人開示之深，惜乎憲之不能再問也。”或曰：“四者不行，固不得爲仁矣。然亦豈非所謂克己之事，求仁之方乎？”曰：“克去己私以復乎禮，則私欲不留，而天理之本然者得矣。若但制而不行，則是未有拔去病根之意，而容其潛藏隱伏於胸中也。豈克己求仁之謂哉？學者察於二者之間，則其所以求仁之功，益親切而無滲漏矣。”,,"정자(程子)가 말씀하였다. “사람으로서 이기기를 좋아하고 자신의 공로를 자랑하고, 원망하고 탐욕 하는 일이 없는 것은 오직 인자(仁者)만이 능할 수 있다. 이러한 것들이 마음속에 있는데도 그 정(情)을 제어하여 행해지지 못하게 한다면 이 또한 능하기 어려운 것이다. 그러나 인(仁)이라고 하기에는 부족하다. 이는 성인(聖人)이 열어 보여주기를 깊이 하신 것인데, 애석하게도 은헌(原憲)이 다시 묻지 못하였다. 혹자는 말하기를 ‘네 가지가 행해지지 못하게 하는 것은 진실로 인(仁)이라고는 할 수 없다. 그러나 이 또한 어찌 이른바 극기(克己)하는 일과 인(仁)을 구하는 방법이란 것이 아니겠는가?’하였다. 나는 다음과 같이 대답하였다. ‘자신의 사사로움을 이겨 버려서 예(禮)로 돌아간다면 사욕(私慾)이 남아있지 않아서 천리(天理)의 본연(本然)을 얻게 될 것이다. 그러나 만일 단지 제어하여 행해지지 못하게 할뿐이라면, 이는 병의 뿌리를 뽑아버리려는 뜻이 있지 아니하여 가슴속에 잠복시키는 것을 용납하는 행위이니, 어찌 극기(克己)와 구인(求仁)하는 것이라고 말할 수 있겠는가? 학자(學者)들이 이 두 가지 사이를 살펴본다면 그 인(仁)을 구하는 공부가 더욱 가깝고 절실하여 빠짐이 없게 될 것이다.’”"
子曰士而懷居不足以爲士矣,居謂意所便安處也,子曰：“士而懷居，不足以爲士矣。”,居，謂意所便安處也。,공자(孔子)께서 말씀하셨다. “선비로서 편안하기를 생각하면 선비라 할 수 없다.”,거(居)는 마음에 편안하게 여기는 것을 말한다.
子曰邦有道危言危行邦無道危行言孫,危高峻也孫卑順也尹氏曰君子之持身不可變也至於言則有時而不敢盡以避禍也然則爲國者使士言孫豈不殆哉,子曰：“邦有道，危言危行；邦無道，危行言孫。”,危，高峻也。孫，卑順也。尹氏曰：“君子之持身不可變也，至於言則有時而不敢盡，以避禍也。然則爲國者使士言孫，豈不殆哉？”,"공자(孔子)께서 말씀하셨다. “나라에 도(道)가 있을 때에는 말을 높게 하고 행실을 높게 하며, 나라에 도(道)가 없을 때에는 행실은 높게 하되 말은 공손하게 하여야 한다.”","위(危)는 높은 것이요, 손(孫)은 낮추고 순한 것이다. 윤씨(尹氏)가 말하였다. “군자(君子)의 몸가짐은 변할 수 없거니와 말에 이르러서는 때로는 감히 다하지 못하여 화(禍)를 피하여야 하는 경우가 있는 것이다. 그렇다면 나라를 다스리는 자가 선비로 하여금 말을 공손하게 하는 것이 어찌 위태롭지 않겠는가?”"
子曰有德者必有言有言者不必有德仁者必有勇勇者不必有仁,有德者和順積中英華發外能言者或便佞口給而已仁者心無私累見義必爲勇者或血氣之强而已,子曰：“有德者必有言，有言者不必有德；仁者必有勇，勇者不必有仁。”,有德者，和順積中，英華發外。能言者，或便佞口給而已。仁者，心無私累，見義必爲。勇者，或血氣之强而已。,"공자(孔子)께서 말씀하셨다. “덕(德)이 있는 자는 반드시 훌륭한 말을 하거니와, 훌륭한 말을 하는 자는 반드시 덕(德)이 있지는 못하다. 인자(仁者)는 반드시 용기가 있거니와, 용기가 있는 자는 반드시 인(仁)이 있지는 못하다.”","덕(德)이 있는 자는 화순(和順)이 심중(心中)에 쌓여서 아름다운 영화(榮華)가 밖으로 나타나거니와, 말을 잘하는 자는 간혹 입으로 말만 잘할 뿐일 수 있다. 인자(仁者)는 마음에 시루(私累)가 없어서 의(義)를 보면 반드시 행하거니와, 용기가 있는 자는 간혹 혈기(血氣)의 강함뿐일 수 있다."
,尹氏曰有德者必有言徒能言者未必有德也仁者志必勇徒能勇者未必有仁也,,尹氏曰：“有德者必有言，徒能言者未必有德也。仁者志必勇，徒能勇者未必有仁也。”,,"윤씨(尹氏)가 말하였다. “덕(德)이 있는 자는 반드시 훌륭한 말을 하지만, 한갓 말만 잘하는 자는 반드시 덕(德)이 있지는 못하며, 인자(仁者)는 뜻이 반드시 용감하지만, 한갓 용맹스럽기만 한 자는 반드시 인(仁)이 있지는 못하다.”"
南宮适問於孔子曰羿善射奡盪舟俱不得其死然禹稷躬稼而有天下夫子不答南宮适出子曰君子哉若人尙德哉若人,南宮适卽南容也羿有窮之君善射滅夏后相而簒其位其臣寒浞又殺羿而代之奡春秋傳作澆浞之子也力能陸地行舟後爲夏后少康所誅禹平水土曁稷播種身親稼穡之事禹受舜禪而有天下稷之後至周武王亦有天下适之意蓋以羿奡比當世之有權力者而以禹稷比孔子也故孔子不答然适之言如此可謂君子之人而有尙德之心矣不可以不與故俟其出而贊美之,南宮适問於孔子曰：“羿善射，奡盪舟，俱不得其死然；禹稷躬稼，而有天下。”夫子不答，南宮适出。子曰：“君子哉若人！尙德哉若人！”,南宮适，卽南容也。羿，有窮之君，善射，滅夏后相而簒其位。其臣寒浞又殺羿而代之。奡，春秋傳作“澆”，浞之子也，力能陸地行舟，後爲夏后少康所誅。禹平水土曁稷播種，身親稼穡之事。禹受舜禪而有天下，稷之後至周武王亦有天下。适之意蓋以羿奡比當世之有權力者，而以禹稷比孔子也。故孔子不答。然适之言如此，可謂君子之人，而有尙德之心矣，不可以不與。故俟其出而贊美之。,"남궁괄(南宮适)이 공자(孔子)께 묻기를 “예(羿)는 활을 잘 쏘았고, 오(奡)는 힘이 세어 육지에서 배를 끌고 다녔지만, 모두 제대로 죽지 못하였습니다. 그러나 우왕(禹王)과 직(稷)은 몸소 농사를 지었는데도 천하(天下)를 소유하셨습니다.” 하니, 공자(孔子)께서 대답하지 않으셨다. 남궁괄(南宮适)이 밖으로 나가자, 공자(孔子)께서 말씀하셨다. “군자(君子)로구나, 이 사람이여! 덕(德)을 숭상하는구나. 이 사람이여!”","남궁괄(南宮适)은 곧 남용(南容)이다. 예(羿)는 유궁(有窮)의 임금이니, 활을 잘 쏘았다. 하후(夏后) 상(相)을 멸망하고 왕위(王位)를 찬탈(簒奪)하였었는데, 그 신하 한착(寒浞)이 또 예(羿)를 죽이고 대신하였다. 오(奡)는 《춘추전(春秋傳)》에 요(澆)로 되어 있는데, 한착(寒浞)의 아들인데, 힘이 세어 능히 육지에서 배를 끌고 다녔으나, 뒤에 하후(夏后) 소강(小康)에게 죽임을 당하였다. 우왕(禹王)은 수토(水土)를 다스리고 직(稷)과 함께 씨앗을 뿌려 몸소 농사짓는 일을 하였는데, 우왕(禹王)은 순제(舜帝)의 선위(禪位)를 받아 천하(天下)를 소유하였고, 직(稷)의 후손도 주(周)나라 무왕(武王)에 이르러 또한 천하(天下)를 소유하였다. 남궁괄(南宮适)의 뜻은 예(羿)와 오(奡)를 당시의 권력가에게 비유하고, 우왕(禹王)과 직(稷)을 공자(孔子)에 비유하였다. 그러므로 공자(孔子)께서 대답하지 않으신 것이다. 그러나 남궁괄(南宮适)의 말이 이와 같으니, 군자(君子)다운 사람이어서 덕(德)을 숭상하는 마음이 있다고 할 만하니, 이것을 허여(許與)[인정]하지 않을 수 없다. 그러므로 그가 밖으로 나가기를 기다려 찬미(贊美)하신 것이다."
子曰君子而不仁者有矣夫未有小人而仁者也,謝氏曰君子志於仁矣然毫忽之間心不在焉則未免爲不仁也,子曰：“君子而不仁者有矣夫，未有小人而仁者也。”,謝氏曰：“君子志於仁矣，然毫忽之間，心不在焉，則未免爲不仁也。”,공자(孔子)께서 말씀하셨다. “군자(君子)로서 인(仁)하지 못한 자는 있어도 소인(小人)으로서 인(仁)한 자는 있지 않다.”,사씨(謝氏)가 말하였다. “군자(君子)는 인(仁)에 뜻을 둔다. 그러나 잠깐 사이라도 마음이 인(仁)에 있지 않으면 불인(不仁)을 면치 못하게 된다.”
子曰愛之能勿勞乎忠焉能勿誨乎,蘇氏曰愛而勿勞禽犢之愛也忠而勿誨婦寺之忠也愛而知勞之則其爲愛也深矣忠而知誨之則其爲忠也大矣,子曰：“愛之，能勿勞乎？忠焉，能勿誨乎？”,蘇氏曰：“愛而勿勞，禽犢之愛也；忠而勿誨，婦寺之忠也。愛而知勞之，則其爲愛也深矣；忠而知誨之，則其爲忠也大矣。”,공자(孔子)께서 말씀하였다. “사랑한다면 수고롭게 하지 않을 수 있겠는가? 충성한다면 깨우쳐주지 않을 수 있겠는가?”,"소씨(蘇氏)가 말하였다. “사랑하기만 하고 수고롭게 하지 않는 것은 짐승들의 사랑이요, 충성하기만 하고 깨우쳐 주지 않는 것은 부인(婦人)과 내시(內寺)들의 충성이니, 사랑하면서도 수고롭게 할 줄 안다면 그 사랑함이 깊은 것이요, 충성하면서도 깨우쳐줄 줄 안다면 그 충성이 큰 것이다.”"
子曰爲命裨諶草創之世叔討論之行人子羽修飾之東里子産潤色之,裨諶以下四人皆鄭大夫草略也創造也謂造爲草藁也世叔游吉也春秋傳作子大叔討尋究也論講議也行人掌使之官子羽公孫揮也修飾謂增損之東里地名子産所居也潤色謂加以文采也鄭國之爲辭命必更此四賢之手而成詳審精密各盡所長是以應對諸侯鮮有敗事孔子言此蓋善之也,子曰：“爲命：裨諶草創之，世叔討論之，行人子羽修飾之，東里子産潤色之。”,裨諶以下四人，皆鄭大夫。草，略也。創，造也，謂造爲草藁也。世叔，游吉也，春秋傳作子大叔。討，尋究也。論，講議也。行人，掌使之官。子羽，公孫揮也。修飾，謂增損之。東里地名，子産所居也。潤色，謂加以文采也。鄭國之爲辭命，必更此四賢之手而成，詳審精密，各盡所長。是以應對諸侯，鮮有敗事。孔子言此，蓋善之也。,"공자(孔子)께서 말씀하셨다. “<정(鄭)나라에서는> 사명(辭命)[외교문서]을 만들 때에 비침(裨諶)이 초고를 만들고, 세숙(世叔)이 토론하고, 행인(行人)인 자우(子羽)가 수식(修飾)을 하고 동리(東里)의 자산(子産)이 윤색(潤色)을 하였다.”","비침(裨諶)이하 네 사람은 모두 정(鄭)나라 대부(大夫)이다. 초(草)는 대략이요, 창(創)은 처음 만드는 것이니, 처음으로 초고(草稿)를 만드는 것을 말한다. 세숙(世叔)은 유길(游吉)인데, 《춘추전(春秋傳)》에는 자태숙(子大叔)으로 되어있다. 토(討)는 연구하는 것이요, 논(論)은 강론하는 것이다. 행인(行人)은 사신(使臣)의 임무를 맡은 벼슬이고 자우(子羽)는 공손휘(公孫揮)이다. 수식(修飾)은 보충하고 삭제하는 것이다. 동리(東里)는 자산(子産)이 거주하던 곳이다. 윤색(潤色)은 문채를 더하는 것을 말한다. 정(鄭)나라에서는 사명(辭命)을 만들 때에 반드시 이 네 현자(賢者)의 손을 거쳐 이루어져서 자세하고 정밀하여 각기 소장(所長)을 다하였다. 이러므로 제후(諸侯)들과 응대할 때에 실패하는 일이 적었다. 공자(孔子)께서 이것을 말씀한 것은 그것을 좋게 여기신 것이다."
或問子産子曰惠人也,子産之政不專於寬然其心則一以愛人爲主故孔子以爲惠人蓋擧其重而言也,或問子産。子曰：“惠人也。”,子産之政，不專於寬，然其心則一以愛人爲主。故孔子以爲惠人，蓋擧其重而言也。,"혹자가 자산(子産)의 인품을 물으니, 공자(孔子)께서 대답하셨다. “은혜로운 사람이다.”","자산(子産)의 정사는 오로지 관혜(寬惠)하지만은 않았으나, 그의 마음은 한결같이 사람을 사랑하는 것을 위주로 하였다. 그러므로 공자(孔子)께서 은혜로운 사람이라고 하신 것이니, 그의 중한 것을 들어 말씀하신 것이다."
問子西曰彼哉彼哉,子西楚公子申能遜楚國立昭王而改紀其政亦賢大夫也然不能革其僭王之號昭王欲用孔子又沮止之其後卒召白公以致禍亂則其爲人可知矣彼哉者外之之詞,問子西。曰：“彼哉！彼哉！”,子西，楚公子申，能遜楚國，立昭王，而改紀其政，亦賢大夫也。然不能革其僭王之號。昭王欲用孔子，又沮止之。其後卒召白公以致禍亂，則其爲人可知矣。彼哉者，外之之詞。,"자서(子西)의 인품을 물으니, 대답하셨다. “저 그 사람이여! 저 그 사람이여!”","자서(子西)는 초(楚)나라 공자(公子)인 신(申)이니, 초(楚)나라를 사양하고 소왕(昭王)을 세워서 정치를 개혁하고 기강을 세웠으니, 역시 어진 대부(大夫)이다. 그러나 왕(王)을 참칭(僭稱)하는 칭호를 고치지 못하였고, 또 소왕(昭王)이 공자(孔子)를 등용하려 하자, 이를 저지하였으며, 그후 마침내 백공(白公)을 불러들여 화란(禍亂)을 초래하였다. 그렇다면 그의 사람됨을 알 수 있다. 피재(彼哉)란 그를 외면하는 말씀이다."
問管仲曰人也奪伯氏騈邑三百飯疏食沒齒無怨言,人也猶言此人也伯氏齊大夫騈邑地名齒年也蓋桓公奪伯氏之邑以與管仲伯氏自知己罪而心服管仲之功故窮約以終身而無怨言荀卿所謂與之書社三百而富人莫之敢拒者卽此事也,問管仲。曰：“人也。奪伯氏騈邑三百，飯疏食，沒齒無怨言。”,人也，猶言此人也。伯氏，齊大夫。騈邑，地名。齒，年也。蓋桓公奪伯氏之邑以與管仲，伯氏自知己罪，而心服管仲之功，故窮約以終身而無怨言。荀卿所謂“與之書社三百，而富人莫之敢拒”者，卽此事也。,"관중(管仲)의 인품을 물으니, 대답하셨다. “이 사람은 백씨(伯氏)의 병읍(騈邑) 삼백호(三百戶)를 빼앗았는데, 백씨(伯氏)는 거친 밥을 먹으며 평생을 마치면서도 원망하는 말이 없었다.”","인야(人也)는 이 사람이란 말과 같다. 백씨(伯氏)는 제(齊)나라의 대부(大夫)이다. 병읍(騈邑)은 지명(地名)이며 치(齒)는 나이이다. 환공(桓公)이 백씨(伯氏)의 병읍(騈邑)을 빼앗아 관중(管仲)에게 주었는데, 백씨(伯氏)는 스스로 자신의 죄를 알고 관중(管仲)의 공(功)에 심복 하였으므로 곤궁하게 몸을 마치면서도 원망하는 말이 없었으니, 순경(荀卿)이 이른바 “그에게 서사(書社) 삼백호(三百戶)를 주는데도, 부자들이 감히 막는 이가 없었다.”는 것이 바로 이 일이다."
,或問管仲子産孰優曰管仲之德不勝其才子産之才不勝其德然於聖人之學則槪乎其未有聞也,,或問：“管仲子産孰優？”曰：“管仲之德，不勝其才。子産之才，不勝其德。然於聖人之學，則槪乎其未有聞也。”,,"혹자가 “관중(管仲)과 자산(子産)은 누가 더 나은가?” 하고 묻자, 내가 말하였다. “관중(管仲)의 덕(德)은 그 재주를 이기지 못하였고, 자산(子産)의 재주는 그 덕(德)을 이기지 못하였다. 그러나 성인(聖人)의 학문(學問)에 대해서는 한결같이 들은 것이 없었다.”"
子曰貧而無怨難富而無驕易,處貧難處富易人之常情然人當勉其難而不可忽其易也,子曰：“貧而無怨難，富而無驕易。”,處貧難，處富易，人之常情。然人當勉其難，而不可忽其易也。,"공자(孔子)께서 말씀하셨다. “가난하면서 원망이 없기는 어렵고, 부자이면서 교만이 없기는 쉽다.”","가난에 처하기는 어렵고 부(富)에 처하기는 쉬우니, 이는 사람들의 떳떳한 정(情)이다. 그러나 사람들은 마땅히 그 어려운 것을 힘써야 하며, 그 쉬운 것도 소홀히 해서는 안 되는 것이다."
子曰孟公綽爲趙魏老則優不可以爲滕薛大夫,公綽魯大夫趙魏晉卿之家老家臣之長大家勢重而無諸侯之事家老望尊而無官守之責優有餘也滕薛二國名大夫任國政者滕薛國小政繁大夫位高責重然則公綽蓋廉靜寡欲而短於才者也,子曰：“孟公綽爲趙魏老則優，不可以爲滕薛大夫。”,公綽，魯大夫。趙魏，晉卿之家。老，家臣之長。大家勢重，而無諸侯之事；家老望尊，而無官守之責。優，有餘也。滕薛，二國名。大夫，任國政者。滕薛國小政繁，大夫位高責重。然則公綽蓋廉靜寡欲，而短於才者也。,공자(孔子)께서 말씀하셨다. “맹공작(孟公綽)은 조씨(趙氏)와 위씨(魏氏)의 가로(家老)가 되는 것은 충분하지만 등(滕)나라와 설(薛)나라의 대부(大夫)가 되어서는 안 된다.”,"공작(公綽)은 노(魯)나라 대부(大夫)이다. 조씨(趙氏)와 위씨(魏氏)는 진(晉)나라 경(卿)의 집안이다. 노(老)는 가신(家臣)의 우두머리이다. 대가(大家)는 세력은 중하나 제후(諸侯)의 일이 없고, 가로(家老)는 명망이 높지만 관직을 맡은 책임이 없다. 우(優)는 유여(有餘)한 것이다. 등(滕)과 설(薛)은 두 나라의 이름이다. 대부(大夫)는 국정(國政)을 맡은 자이다. 등(滕)과 설(薛)은 나라가 작으나 정사가 번거로우며, 대부(大夫)는 지위가 높고 책임이 중하다. 그렇다면 공작(公綽)은 아마도 청렴하고 욕심이 적으나, 재능이 부족한 자인 듯하다."
,楊氏曰知之弗豫枉其才而用之則爲棄人矣此君子所以患不知人也言此則孔子之用人可知矣,,楊氏曰：“知之弗豫，枉其才而用之，則爲棄人矣。此君子所以患不知人也。言此，則孔子之用人可知矣。”,,"양씨(楊氏)가 말하였다. “<사람의 재능을> 미리 알지 못하여 그 재능을 잘못 사용하면 인재를 버리는 것이 된다. 이는 군자(君子)가 남을 알지 못함을 걱정하는 이유이다. 이렇게 말씀하였으니, 공자(孔子)의 사람 쓰는 것을 알 수 있다.”"
子路問成人子曰若臧武仲之知公綽之不欲卞莊子之勇冉求之藝文之以禮樂亦可以爲成人矣,成人猶言全人武仲魯大夫名紇莊子魯卞邑大夫言兼此四子之長則知足以窮理廉足以養心勇足以力行藝足以泛應而又節之以禮和之以樂使德成於內而文見乎外則材全德備渾然不見一善成名之迹中正和樂粹然無復偏倚駁雜之蔽而其爲人也亦成矣然亦之爲言非其至者蓋就子路之所可及而語之也若論其至則非聖人之盡人道不足以語此,子路問成人。子曰：“若臧武仲之知，公綽之不欲，卞莊子之勇，冉求之藝，文之以禮樂，亦可以爲成人矣。”,成人，猶言全人。武仲，魯大夫，名紇。莊子，魯卞邑大夫。言兼此四子之長，則知足以窮理，廉足以養心，勇足以力行，藝足以泛應，而又節之以禮，和之以樂，使德成於內，而文見乎外。則材全德備，渾然不見一善成名之迹；中正和樂，粹然無復偏倚駁雜之蔽，而其爲人也亦成矣。然亦之爲言，非其至者，蓋就子路之所可及而語之也。若論其至，則非聖人之盡人道，不足以語此。,"자로(子路)가 완성된 사람〔成人〕을 물으니, 공자(孔子)께서 대답하셨다. “만일 장무중(臧武仲)의 지혜와 공작(公綽)의 탐욕하지 않음과 변장자(卞莊子)의 용기와 염구(冉求)의 재예(才藝)에 예악(禮樂)으로 문채(文采)를 내면 이 역시 성인(成人)이 될 수 있을 것이다.”","성인(成人)은 전인(全人)이라는 말과 같다. 장무중(臧武仲)은 노(魯)나라 대부(大夫)이니, 이름은 흘(紇)이다. 변장자(卞莊子)는 노(魯)나라 변읍(卞邑)의 대부(大夫)이다. 이 네 사람의 장점을 겸하면 지혜는 이치를 연구할 수 있고 청렴은 마음을 수양할 수 있고 용기는 힘써 행할 수 있고 재예(才藝)는 두루 응용할 수 있으며 또 예(禮)로써 절제하고 악(樂)로써 화(和)하여 덕(德)이 안에 이루어지고 문(文)이 밖에 나타나게 한다면, 재주가 완전하고 덕(德)이 갖추어져서 혼연(渾然)[완전]하여 한 가지 선(善)으로 이름을 이룬 자취를 볼 수 없으며, 중정(中正)하고 화락(和樂)해서 순수하여 다시는 편벽 되고 잡박(雜駁)한 가리움이 없어져 그 사람됨이 또한 이루어질 수 있음을 말씀한 것이다. 그러나 역시[역(亦)]라는 말은 지극한 것이 아니니, 아마도 자로(子路)가 미칠 수 있는 것을 가지고 말씀하신 듯하다. 만일 그 지극한 것을 논한다면 인도(人道)를 다한 성인(聖人)이 아니면 성인(成人)이라고 말할 수 없는 것이다."
