대문,주석,대문표점,주석표점,대문해석,주석해석
孟子曰君子深造之以道欲其自得之也自得之則居之安居之安則資之深資之深則取之左右逢其原故君子欲其自得之也,造詣也深造之者進而不已之意道則其進爲之方也資猶藉也左右身之兩旁言至近而非一處也逢猶値也原本也水之來處也言君子務於深造而必以其道者欲其有所持循以俟夫默識心通自然而得之於己也自得於己則所以處之者安固而不搖處之安固則所藉者深遠而無盡所藉者深則日用之間取之至近無所往而不値其所資之本也,孟子曰：“君子深造之以道，欲其自得之也。自得之，則居之安；居之安，則資之深；資之深，則取之左右逢其原，故君子欲其自得之也。”,造，詣也。深造之者，進而不已之意。道，則其進爲之方也。資，猶藉也。左右，身之兩旁，言至近而非一處也。逢，猶値也。原，本也，水之來處也。言君子務於深造而必以其道者，欲其有所持循，以俟夫默識心通，自然而得之於己也。自得於己，則所以處之者安固而不搖；處之安固，則所藉者深遠而無盡；所藉者深，則日用之間取之至近，無所往而不値其所資之本也。,"맹자(孟子)께서 말씀하였다. “군자(君子)가 깊이 나아가기를 도(道)[방법]로써 함은 그 자득(自得)하고자 해서이니, 자득(自得)하면 거(居)함에 편안하고, 거(居)함에 편안하면 이용함이 깊고, 이용함이 깊으면 좌우에서 취하여 씀에 그 근원을 만나게 된다. 그러므로 군자(君子)는 자득(自得)하고자 하는 것이다.”","조(造)는 나아감이니, 깊이 나아간다는 것은 나아가고 그치지 않는다는 뜻이다. 도(道)는 그 나아가는 방법이다. 자(資)는 자(藉)[이용함]와 같다. 좌우(左右)는 몸의 두 곁이니, 지극히 가까우면서도 한 곳이 아님을 말한 것이다. 봉(逢)은 치(値)[만남]와 같다. 원(原)은 근본이니, 물이 오는 곳이다. 군자(君子)가 깊이 나아가기를 힘쓰되 반드시 그 도(道)로써 하는 것은, 믿고 따르는 바가 있어서, 묵묵히 알고 마음속으로 통달하여 자연히 자기 몸에 얻어지기를 기다리고자 해서이다. 자기 몸에 자득(自得)해지면 처(處)하는 것이 편안하고 견고하여 흔들리지 아니하고, 처(處)하는 것이 편안하고 견고하면 이용하는 것이 심원(深遠)하여 다함이 없고, 이용하는 것이 심원(深遠)하면 날로 쓰는 사이에 지극히 가까운 곳에서 취해 써서, 가는 곳마다 그 이용하는 바의 근본을 만나지 않음이 없을 것이다."
,程子曰學不言而自得者乃自得也有安排布置者皆非自得也然必潛心積慮優游厭飫於其間然後可以有得若急迫求之則是私己而已終不足以得之也,,程子曰：“學不言而自得者，乃自得也。有安排布置者，皆非自得也。然必潛心積慮，優游厭飫於其間，然後可以有得。若急迫求之，則是私己而已，終不足以得之也。”,,"정자(程子)가 말씀하였다. “학문은 말하지 않고 자득(自得)하는 것이 바로 자득(自得)이니, 안배(安排)하고 포치(布置)함이 있는 것은 모두 자득(自得)이 아니다. 그러나 반드시 마음을 잠그고 생각을 쌓아서 그 사이에 오랫동안 우유(優游)하고 염어(厭飫)한 뒤에야 자득(自得)함이 있을 수 있으니, 만일 급박하게 구한다면 이는 사기(私己)일 뿐이다. 끝내 얻지 못할 것이다.”"
孟子曰博學而詳說之將以反說約也,言所以博學於文而詳說其理者非欲以誇多而鬪靡也欲其融會貫通有以反而說到至約之地耳蓋承上章之意而言學非欲其徒博而亦不可以徑約也,孟子曰：“博學而詳說之，將以反說約也。”,言所以博學於文，而詳說其理者，非欲以誇多而鬪靡也；欲其融會貫通，有以反而說到至約之地耳。蓋承上章之意而言，學非欲其徒博，而亦不可以徑約也。,맹자(孟子)께서 말씀하였다. “널리 배우고 상세히 말함은 장차 돌이켜서 요약함을 말하고자 해서이다.”,"글을 널리 배우고 그 이치를 상세히 말하는 까닭은 많은 지식을 자랑하고 화려함을 다투고자 해서가 아니요, 융회(融會)하고 관통(貫通)하여 돌이켜서 지극히 요약한 것을 설명하고자 해서임을 말씀한 것이다. 이는 위 장(章)의 뜻을 이어 말씀하였으니, 학문은 다만 박학(博學)하고자 할 것이 아니요, 또한 곧바로 요약(要約)만을 해서도 안 되는 것이다."
孟子曰以善服人者未有能服人者也以善養人然後能服天下天下不心服而王者未之有也,服人者欲以取勝於人養人者欲其同歸於善蓋心之公私小異而人之嚮背頓殊學者於此不可以不審也,孟子曰：“以善服人者，未有能服人者也；以善養人，然後能服天下。天下不心服而王者，未之有也。”,服人者，欲以取勝於人；養人者，欲其同歸於善。蓋心之公私小異。而人之嚮背頓殊，學者於此不可以不審也。,"맹자(孟子)께서 말씀하였다. “선(善)으로써 남을 복종시키려 하는 자는 남을 복종시키는 자가 있지 않으니, 선(善)으로써 남을 길러준 뒤에야 천하를 복종시킬 수 있는 것이다. 천하가 마음으로 복종하지 않고서 왕노릇한 자는 있지 않다.”","복인(服人)은 남에게 이김을 취하고자 하는 것이요, 양인(養人)은 함께 선(善)에 돌아가고자 하는 것이니, 마음의 공(公)과 사(私)가 조금 다름에 사람의 향(向)·배(背)가 크게 다르니, 배우는 자가 이에 대하여 살피지 않으면 안 된다."
孟子曰言無實不祥不祥之實蔽賢者當之,或曰天下之言無有實不祥者惟蔽賢爲不祥之實或曰言而無實者不祥故蔽賢爲不祥之實二說不同未知孰是疑或有闕文焉,孟子曰：“言無實不祥。不祥之實，蔽賢者當之。”,或曰：“天下之言無有實不祥者，惟蔽賢爲不祥之實。”或曰：“言而無實者不祥，故蔽賢爲不祥之實。”二說不同，未知孰是，疑或有闕文焉。,"맹자(孟子)께서 말씀하였다. “말에 실상이 없는 것이 길하지 못한 것이니, 길하지 못함의 실제는 어진이를 은폐하는 것이 이에 해당된다.”","혹자(或者)는 이르기를 “천하의 말에 실제로 불상(不祥)한 것은 없으니, 오직 어진이를 은폐하는 것이 불상(不祥)의 실제가 된다.” 하고, 혹자(或者)는 이르기를 “말에 실상이 없는 것이 불상(不祥)함이다. 그러므로 어진이를 은폐함이 불상(不祥)의 실제가 된다.” 하니, 두 말이 같지 아니하여, 누가 옳은지 알지 못하겠다. 아마도 빠진 글자가 있는 듯하다."
徐子曰仲尼亟稱於水曰水哉水哉何取於水也,亟數也水哉水哉歎美之辭,徐子曰：“仲尼亟稱於水，曰：‘水哉，水哉！’何取於水也？”,亟，數也。水哉水哉，歎美之辭。,"서자(徐子)가 물었다. “중니(仲尼)께서 자주 물을 칭찬하시어 ‘물이여! 물이여!’ 하셨으니, 어찌하여 물을 취하셨습니까?”",기(亟)는 자주이다. 수재수재(水哉水哉)는 찬미한 말씀이다.
孟子曰原泉混混不舍晝夜盈科而後進放乎四海有本者如是是之取爾,原泉有原之水也混混湧出之貌不舍晝夜言常出不竭也盈滿也科坎也言其進以漸也放至也言水有原本不已而漸進以至于海如人有實行則亦不已而漸進以至于極也,孟子曰：“原泉混混，不舍晝夜。盈科而後進，放乎四海，有本者如是，是之取爾。”,原泉，有原之水也。混混，湧出之貌。不舍晝夜，言常出不竭也。盈，滿也。科，坎也。言其進以漸也。放，至也。言水有原本，不已而漸進以至于海；如人有實行，則亦不已而漸進以至于極也。,"맹자(孟子)께서 대답하였다. “근원이 좋은 물이 혼혼(混混)히 흘러서 밤낮을 그치지 아니하여 구덩이가 가득 찬 뒤에 전진하여 사해(四海)에 이르나니, 학문에 근본이 있는 자가 이와 같다. 이 때문에 취하신 것이다.”","원천(原泉)은 근원이 있는 물이다. 혼혼(混混)은 용솟음쳐 나오는 모양이다. 밤낮을 그치지 않는다는 것은 항상 나와 다하지 않음을 말한다. 영(盈)은 가득 참이요, 과(科)는 구덩이이니, 그 나아가기를 점진적으로 함을 말씀한 것이다. 방(放)은 이르름이다. 물은 근원이 있어서 그치지 않고 점진(漸進)하여 바다에 이르니, 사람이 실제 행실이 있으면 또한 그치지 않고 점진하여 지극한 경지에 이르름과 같음을 말씀한 것이다."
苟爲無本七八月之間雨集溝澮皆盈其涸也可立而待也故聲聞過情君子恥之,集聚也澮田間水道也涸乾也如人無實行而暴得虛譽不能長久也聲聞名譽也情實也恥者恥其無實而將不繼也林氏曰徐子之爲人必有躐等干譽之病故孟子以是答之,苟爲無本，七八月之間雨集，溝澮皆盈；其涸也，可立而待也。故聲聞過情，君子恥之。,集，聚也。澮，田間水道也。涸，乾也。如人無實行，而暴得虛譽，不能長久也。聲聞，名譽也。情，實也。恥者，恥其無實而將不繼也。林氏曰：“徐子之爲人，必有躐等干譽之病，故孟子以是答之。”,"만일 근본이 없다면 7, 8월 사이에 빗물이 모여서 도랑이 모두 가득하나, 그 마르는 것은 서서도 기다릴 수 있다. 그러므로 명성이 실제보다 지나침을 군자(君子)는 부끄러워한다.”",집(集)은 모임이다. 회(澮)는 밭 사이의 물길이다. 학(涸)은 마름이다. 사람이 실제 행실이 없이 갑자기 빈 명예를 얻으면 장구(長久)하지 못함과 같은 것이다. 성문(聲聞)은 명예(名譽)이다. 정(情)을 실제이다. 부끄러워하는 것은 실제가 없어서 장차 이어지지 못함을 부끄러워하는 것이다. 임씨(林氏)가 말하였다. “서자(徐子)의 사람됨이 반드시 등급을 건너뛰고 명예를 요구하는 병통이 있었을 것이다. 그러므로 맹자(孟子)께서 이 말씀으로 대답하신 것이다.”
,鄒氏曰孔子之稱水其旨微矣孟子獨取此者自徐子之所急者言之也孔子嘗以聞達告子張矣達者有本之謂也聞則無本之謂也然則學者其可以不務本乎,,鄒氏曰：“孔子之稱水，其旨微矣。孟子獨取此者，自徐子之所急者言之也。孔子嘗以聞達告子張矣，達者有本之謂也。聞則無本之謂也。然則學者其可以不務本乎？”,,"추씨(鄒氏)가 말하였다. “공자(孔子)께서 물을 칭찬하심은 그 뜻이 은미한데, 맹자(孟子)께서 유독 이 점만을 취하신 것은 서자(徐子)의 시급한 바로써 말씀하신 것이다. 공자(孔子)께서 일찍이 문(聞)과 달(達)을 가지고 자장(子張)에게 말씀해 주셨으니, 달(達)은 근본[덕행(德行)]이 있음을 말함이요, 문(聞)은 근본이 없음을 말한다. 그렇다면 배우는 자가 근본을 힘쓰지 않을 수 있겠는가.”"
孟子曰人之所以異於禽獸者幾希庶民去之君子存之,幾希少也庶衆也人物之生同得天地之理以爲性同得天地之氣以爲形其不同者獨人於其間得形氣之正而能有以全其性爲少異耳雖曰少異然人物之所以分實在於此衆人不知此而去之則名雖爲人而實無以異於禽獸君子知此而存之是以戰兢惕厲而卒能有以全其所受之正也,孟子曰：“人之所以異於禽獸者幾希，庶民去之，君子存之。”,幾希，少也。庶，衆也。人物之生，同得天地之理以爲性，同得天地之氣以爲形；其不同者，獨人於其間得形氣之正，而能有以全其性，爲少異耳。雖曰少異，然人物之所以分，實在於此。衆人不知此而去之，則名雖爲人，而實無以異於禽獸。君子知此而存之，是以戰兢惕厲，而卒能有以全其所受之正也。,"맹자(孟子)께서 말씀하였다. “사람이 금수(禽獸)와 다른 것이 얼마 안되니, 서민(庶民)[중인(衆人)]들은 이것을 버리고, 군자(君子)는 이것을 보존한다.”","기희(幾希)는 적음, 서(庶)는 많음이다. 사람과 동물이 태어날 때에 똑같이 천지(天地)의 이(理)를 얻어 성(性)을 삼았고, 똑같이 천지(天地)의 기(氣)를 얻어 형체를 삼았으니, 그 같지 않은 점은, 오직 사람은 그 사이에 형기(形氣)의 올바름을 얻어 본성(本性)을 온전히 보존할 수 있는 것, 이것이 조금 다를 뿐이다. 비록 조금 다르다고 말하나, 사람과 동물의 구분되는 바는 실로 여기에 있는 것이다. 중인(衆人)들은 이를 알지 못하여 버리니, 이름은 비록 사람이라 하나 실제는 금수(禽獸)와 다를 것이 없고, 군자(君子)는 이를 알아 보존한다. 이 때문에 전전긍긍하며 두려워하고 조심하여 마침내 그 받은 바의 올바름을 온전히 보존함이 있는 것이다."
舜明於庶物察於人倫由仁義行非行仁義也,物事物也明則有以識其理也人倫說見前篇察則有以盡其理之詳也物理固非度外而人倫尤切於身故其知之有詳略之異在舜則皆生而知之也由仁義行非行仁義則仁義已根於心而所行皆從此出非以仁義爲美而後勉强行之所謂安而行之也此則聖人之事不待存之而無不存矣,舜明於庶物，察於人倫，由仁義行，非行仁義也。,物，事物也。明，則有以識其理也。人倫，說見前篇。察，則有以盡其理之詳也。物理固非度外，而人倫尤切於身，故其知之有詳略之異。在舜則皆生而知之也。由仁義行，非行仁義，則仁義已根於心，而所行皆從此出。非以仁義爲美，而後勉强行之，所謂安而行之也。此則聖人之事，不待存之，而無不存矣。,"순(舜)임금은 여러 사물의 이치에 밝으시며 인륜(人倫)에 특히 살피셨으니, 인의(仁義)를 따라 행하신 것이요. 인의(仁義)를 행하려고 하신 것은 아니었다.”","물(物)은 사물(事物)이요, 명(明)은 그 이치를 앎이 있는 것이다. 인륜(人倫)은 해설이 전편(前篇)[등문공상(滕文公上)]에 보인다. 찰(察)은 그 이치의 상세함을 다함이 있는 것이다. 사물의 이치는 진실로 도외(度外)가 아니나, 인륜(人倫)이 특히 사람의 몸에 간절하다. 그러므로 그 앎에 상세하고 간략한 차이가 있는 것이니, 순(舜)임금에 있어서는 모두 생이지지(生而知之)이다. 인의(仁義)를 따라 행함이요 인의(仁義)를 행하려 함이 아니라는 것은, 인의(仁義)가 이미 마음속에 뿌리 하여 행하는 바가 모두 이로부터 나온 것이요, 인의(仁義)를 아름답게 여긴 뒤에 억지로 힘써 행한 것이 아니니, 이른바 안이행지(安而行之)라는 것이다. 이는 성인(聖人)의 일이니, 보존하려 하기를 기다리지 않아도 보존되지 않음이 없는 것이다."
,尹氏曰存之者君子也存者聖人也君子所存存天理也由仁義行存者能之,,尹氏曰：“存之者，君子也；存者，聖人也。君子所存，存天理也。由仁義行，存者能之。”,,"윤씨(尹氏)가 말하였다. ‘보존하려 하는 것은 군자(君子)요, 저절로 보존하는 것은 성인(聖人)이다. 군자(君子)가 보존하는 것은 천리(天理)를 보존함이니, 인의(仁義)를 따라 행함은 존자(存者)[성인(聖人)]만이 능하다.”"
孟子曰禹惡旨酒而好善言,戰國策曰儀狄作酒禹飮而甘之曰後世必有以酒亡其國者遂疏儀狄而絶旨酒書曰禹拜昌言,孟子曰：“禹惡旨酒而好善言。”,戰國策曰：“儀狄作酒，禹飮而甘之，曰‘後世必有以酒亡其國者’，遂疏儀狄而絶旨酒。”書曰：“禹拜昌言。”,"맹자(孟子)께서 말씀하였다. “우왕(禹王)은 맛있는 술을 싫어하고, 선언(善言)을 좋아하셨다.”","《전국책(戰國策)》에 이르기를, “의적(儀狄)이 술을 만들자, 우왕(禹王)은 그 술을 마셔보고 맛있게 여기며 말씀하시기를 ‘후세(後世)에 반드시 술로써 나라를 망칠 자가 있을 것이다.’ 하시고는, 마침내 의적(儀狄)을 소원히 하고 맛있는 술을 입에 끊었다.” 하였다. 《서경(書經)》에 이르기를 “우왕(禹王)은 창언(昌言)[선언(善言)]에 절하였다.” 하였다."
湯執中立賢無方,執謂守而不失中者無過不及之名方猶類也立賢無方惟賢則立之於位不問其類也,湯執中，立賢無方。,執，謂守而不失。中者，無過不及之名。方，猶類也。立賢無方，惟賢則立之於位，不問其類也。,"탕왕(湯王)은 중도(中道)를 잡으시며, 어진이를 세우되 일정한 방소(方所)가 없이 하셨다.","집(執)은 지키고 잃지 않음을 이른다. 중(中)은 과(過)와 불급(不及)이 없는 것의 명칭이다. 방(方)은 유(類)와 같으니, 어진이를 세우되 방소(方所)가 없이 했다는 것은 오직 어진 자이면 그를 지위에 세우고, 그 부류를 따지지 않은 것이다."
文王視民如傷望道而未之見,民已安矣而視之猶若有傷道已至矣而望之猶若未見聖人之愛民深而求道切如此不自滿足終日乾乾之心也,文王視民如傷，望道而未之見。,民已安矣，而視之猶若有傷；道已至矣，而望之猶若未見。聖人之愛民深，而求道切如此。不自滿足，終日乾乾之心也。,"문왕(文王)은 백성을 보기를 다칠 듯이 여기셨으며, 도(道)를 바라보시고도 보지 못한 듯이 여기셨다.","백성이 이미 편안하되, 보기를 오히려 다침이 있을까 여기셨고, 도(道)가 이미 지극하되, 바라보기를 오히려 보지 못한 듯이 여기셨으니, 성인(聖人)이 백성 사랑하기를 깊이 하고, 도(道)를 구하기를 간절히 함이 이와 같았다. 이는 스스로 만족히 여기지 않아 종일토록 부지런히 부지런히 힘쓰시는 마음이다."
武王不泄邇不忘遠,泄狎也邇者人所易狎而不泄遠者人所易忘而不忘德之盛仁之至也,武王不泄邇，不忘遠。,泄，狎也。邇者人所易狎而不泄，遠者人所易忘而不忘，德之盛，仁之至也。,"무왕(武王)은 가까운 자를 친압하지 않으셨으며, 먼 자를 잊지 않으셨다.","설(泄)은 친압함[함부로 대함]이다. 가까운 자는 사람이 친압하기 쉬운 바인데도 친압하지 않으셨고, 먼 자는 사람이 잊기 쉬운 바인데도 잊지 않으셨으니, 덕(德)이 성하고 인(仁)이 지극하시다."
周公思兼三王以施四事其有不合者仰而思之夜以繼日幸而得之坐以待旦,三王禹也湯也文武也四事上四條之事也時異勢殊故其事或有所不合思而得之則其理初不異矣坐以待旦急於行也,周公思兼三王，以施四事；其有不合者，仰而思之，夜以繼日；幸而得之，坐以待旦。,三王：禹也，湯也，文武也。四事，上四條之事也。時異勢殊，故其事或有所不合，思而得之，則其理初不異矣。坐以待旦，急於行也。,"주공(周公)은 세 왕(王)을 겸하시어 네 가지 일을 시행할 것을 생각하시되, 부합하지 않는 것이 있으면, 우러러 생각하여 밤으로써 날을 이어서, 다행히 터득하시면 그대로 앉아 날이 새기를 기다리셨다.","삼왕(三王)은 우왕(禹王), 탕왕(湯王), 문왕(文王)·무왕(武王)이요, 사사(四事)는 위 네 가지 조항의 일이다. 때가 다르고 세(勢)가 다르기 때문에 그 일에 혹 부합되지 않는 바가 있으나, 생각하여 터득하면 그 이치가 애당초 다르지 않다. 앉아서 날이 새기를 기다린다는 것은 실행하기를 급히 여긴 것이다."
,此承上章言舜因歷敍群聖以繼之而各擧其一事以見其憂勤惕厲之意蓋天理之所以常存而人心之所以不死也程子曰孟子所稱各因其一事而言非謂武王不能執中立賢湯却泄邇忘遠也人謂各擧其盛亦非也聖人亦無不盛,,此承上章言舜，因歷敍群聖以繼之；而各擧其一事，以見其憂勤惕厲之意。蓋天理之所以常存，而人心之所以不死也。程子曰：“孟子所稱，各因其一事而言，非謂武王不能執中立賢，湯却泄邇忘遠也。人謂各擧其盛，亦非也，聖人亦無不盛。”,,"이는 위 장(章)에 순(舜)임금을 말씀한 것을 이어서, 인하여 여러 성인(聖人)을 차례로 서술하여 뒤를 이으면서, 각기 그 한 가지 일을 들어서 그 걱정하고 부지런히 힘쓰며 두려워한 뜻을 나타낸 것이니, 천리(天理)가 이 때문에 항상 보존되는 것이요, 인심(人心)이 이 때문에 죽지 않는 것이다. 정자(程子)가 말씀하였다. “맹자(孟子)께서 칭한 바는 각기 그 한 가지 일을 인하여 말씀한 것이니, 무왕(武王)은 중(中)을 잡지 못하고, 어진 자를 세움에 방소(方所)가 없이 하지 못하며, 탕왕(湯王)은 가까운 자를 친압하고, 먼 자를 잊었다고 말씀한 것은 아니다. 사람들은 이르기를 ‘각기 그 성(盛)한 점을 들었다.’ 하나, 이 또한 틀린 말이다. 성인(聖人)은 또한 성(盛)하지 않음이 없으시다.”"
孟子曰王者之跡熄而詩亡詩亡然後春秋作,王者之跡熄謂平王東遷而政敎號令不及於天下也詩亡謂黍離降爲國風而雅亡也春秋魯史記之名孔子因而筆削之始於魯隱公之元年實平王之四十九年也,孟子曰：“王者之跡熄而詩亡，詩亡然後春秋作。”,王者之跡熄，謂平王東遷，而政敎號令不及於天下也。詩亡，謂黍離降爲國風而雅亡也。春秋，魯史記之名。孔子因而筆削之。始於魯隱公之元年，實平王之四十九年也。,"맹자(孟子)께서 말씀하였다. “왕자(王者)의 자취가 종식됨에 시(詩)가 없어졌으니, 시(詩)가 없어진 뒤에 《춘추(春秋)》가 나왔다.”","왕자(王者)의 자취가 종식되었다는 것은 평왕(平王)이 동쪽으로 천도(遷都)함에 정교(政敎)와 호령(號令)이 천하에 미치지 못함을 이른다. 시망(詩亡)은 〈서리편(黍離篇)〉이 강등되어 국풍(國風)이 됨에 아(雅)가 없어짐을 이른다. 《춘추(春秋)》는 노(魯)나라 사기(史記)의 이름이니, 공자(孔子)께서 그대로 인습하여 <일을> 기록하고 삭제하시되, 노(魯)나라 은공(隱公) 원년(元年)에 시작하니, 실로 평왕(平王) <즉위(卽位)> 49년이었다."
晉之乘楚之檮杌魯之春秋一也,乘義未詳趙氏以爲興於田賦乘馬之事或曰取記載當時行事而名之也檮杌惡獸名古者因以爲凶人之號取記惡垂戒之義也春秋者記事者必表年以首事年有四時故錯擧以爲所記之名也古者列國皆有史官掌記時事此三者皆其所記冊書之名也,晉之乘，楚之檮杌，魯之春秋，一也。,乘義未詳。趙氏以爲興於田賦乘馬之事。或曰：“取記載當時行事而名之也。”檮杌，惡獸名，古者因以爲凶人之號，取記惡垂戒之義也。春秋者，記事者必表年以首事。年有四時，故錯擧以爲所記之名也。古者列國皆有史官，掌記時事。此三者皆其所記冊書之名也。,진(晉)나라의 《승(乘)》과 초(楚)나라의 《도올(檮杌)》과 노(魯)나라의 《춘추(春秋)》가 똑같은 것이다.,"‘승(乘)’은 뜻이 상세하지 않다. 조씨(趙氏)는 이르기를 “전부(田賦) 승마(乘馬)의 일에서 나왔다.” 하고, 혹자는 이르기를 “당시 행사(行事)를 기재함을 취하여 이름하였다.” 한다. ‘도올(檮杌)’은 나쁜 짐승의 이름이다. 옛적에 인하여 흉인(凶人)의 이름으로 삼았으니, 악한 일을 기록하여 경계를 드리운 뜻을 취한 것이다. ‘춘추(春秋)’는 일을 기록하는 자가 반드시 연도(年度)를 표시하여 사건의 앞에 놓으니, 년(年)에는 사시(四時)가 있기 때문에 번갈아 들어서 기록한 바의 책명으로 삼은 것이다. 옛적에 열국(列國)이 모두 사관(史官)이 있어서 당시의 일을 관장하여 기록하였으니, 이 세 가지는 모두 그 기록한 바 책의 이름이다."
