대문,주석,대문표점,주석표점,대문해석,주석해석
孟子曰舜生於諸馮遷於負夏卒於鳴條東夷之人也,諸馮負夏鳴條皆地名在東方夷服之地,孟子曰：“舜生於諸馮，遷於負夏，卒於鳴條，東夷之人也。”,諸馮、負夏、鳴條，皆地名，在東方夷服之地。,"맹자(孟子)께서 말씀하였다. “순(舜)임금은 제풍(諸馮)에서 태어나 부하(負夏)로 옮기셨다가 명조(鳴條)에서 별세하셨으니, 동이(東夷)의 사람이시다.”","제풍(諸馮)·부하(負夏)·명조(鳴條)는 모두 지명(地名)이니, 동방(東方) 이복(夷服)의 땅에 있었다."
文王生於岐周卒於畢郢西夷之人也,岐周岐山下周舊邑近畎夷畢郢近豊鎬今有文王墓,文王生於岐周，卒於畢郢，西夷之人也。,岐周，岐山下周舊邑，近畎夷。畢郢，近豊鎬，今有文王墓。,"문왕(文王)은 기주(岐周)에서 태어나 필영(畢郢)에서 별세하셨으니, 서이(西夷)의 사람이시다.","기주(岐周)는 기산(岐山) 아래에 있는 주(周)나라의 옛 도읍이니, 견이(畎夷)와 가깝다. 필영(畢郢)은 풍(豊)·호(鎬)에 가까우니, 지금 문왕(文王)의 묘(墓)가 있다."
地之相去也千有餘里世之相後也千有餘歲得志行乎中國若合符節,得志行乎中國謂舜爲天子文王爲方伯得行其道於天下也符節以玉爲之篆刻文字而中分之彼此各藏其半有故則左右相合以爲信也若合符節言其同也,地之相去也，千有餘里；世之相後也，千有餘歲。得志行乎中國，若合符節。,得志行乎中國，謂舜爲天子，文王爲方伯，得行其道於天下也。符節，以玉爲之，篆刻文字而中分之，彼此各藏其半，有故則左右相合以爲信也。若合符節，言其同也。,"지역의 거리가 천여 리가 되며, 세대(世代)의 서로 뒤떨어짐이 천여 년이 되지만, 뜻을 얻어 <도(道)를> 중국(中國)에 행함에 있어서는 부절(符節)을 합한 듯이 똑같았다.","뜻을 얻어 중국(中國)에 행한다는 것은, 순(舜)임금은 천자(天子)가 되시고 문왕(文王)은 방백(方伯)이 되시어, 그 도(道)를 천하에 행함을 이른다. 부절(符節)은 옥(玉)으로 만들었으니, 문자(文字)를 전각(篆刻)하고 반으로 나누어 피차(彼此)가 각기 반씩을 보관하고 있다가, 연고가 있으면 좌우(左右)의 것을 서로 합하여 신표(信標)로 삼는다. 약합부절(若合符節)은 그 같음을 말한다."
先聖後聖其揆一也,揆度也其揆一者言度之而其道無不同也,先聖後聖，其揆一也。,揆，度也。其揆一者，言度之而其道無不同也。,앞의 성인(聖人)과 뒤의 성인(聖人)의 그 헤아려봄에 똑같다.”,"규(揆)는 헤아림이니, 헤아려봄에 같다는 것은 헤아려봄에 도(道)가 같지 않음이 없음을 말씀한 것이다."
,范氏曰言聖人之生雖有先後遠近之不同然其道則一也,,范氏曰：“言聖人之生，雖有先後遠近之不同，然其道則一也。”,,"범씨(范氏)가 말하였다. “성인(聖人)의 태어남은 비록 선후(先後)와 원근(遠近)의 차이가 있으나, 이 도(道)는 똑같음을 말씀한 것이다.”"
子産聽鄭國之政以其乘輿濟人於溱洧,子産鄭大夫公孫僑也溱洧二水名也子産見人有徒涉此水者以其所乘之車載而渡之,子産聽鄭國之政，以其乘輿濟人於溱洧。,子産，鄭大夫公孫僑也。溱洧，二水名也。子産見人有徒涉此水者，以其所乘之車載而渡之。,"자산(子産)이 정(鄭)나라의 정사를 다스릴 적에, 자기가 타는 수레를 가지고 진수(溱水)와 유수(洧水)에서 사람들을 건네주었다.",자산(子産)은 정(鄭)나라 대부(大夫)인 공손교(公孫僑)이다. 진(溱)과 유(洧)는 두 물의 이름이다. 자산(子産)은 사람들이 이 물을 도섭(徒涉)하는 자가 있음을 보고는 자기가 타는 수레를 가지고 태워서 건네준 것이다.
孟子曰惠而不知爲政,惠謂私恩小利政則有公平正大之體綱紀法度之施焉,孟子曰：“惠而不知爲政。”,惠，謂私恩小利。政，則有公平正大之體，綱紀法度之施焉。,맹자(孟子)께서 말씀하였다. “은혜로우나 정치를 하는 법을 알지 못하였도다.”,"혜(惠)는 사사로운 은혜와 작은 이(利)를 이르고, 정(政)은 공평(公平)·정대(正大)한 체통과 기강(紀綱)·법도(法度)의 시행(施行)이 있는 것이다."
歲十一月徒杠成十二月輿梁成民未病涉也,杠方橋也徒杠可通徒行者梁亦橋也輿梁可通車輿者周十一月夏九月也周十二月夏十月也夏令曰十月成梁蓋農功已畢可用民力又時將寒沍水有橋梁則民不患於徒涉亦王政之一事也,歲十一月徒杠成，十二月輿梁成，民未病涉也。,杠，方橋也。徒杠，可通徒行者。梁，亦橋也。輿梁，可通車輿者。周十一月，夏九月也。周十二月，夏十月也。夏令曰：“十月成梁。”蓋農功已畢，可用民力，又時將寒沍，水有橋梁，則民不患於徒涉，亦王政之一事也。,"11월에 도강(徒杠)이 이루어지며 12월에 여량(輿梁)이 이루어지면, 백성들이 물 건너는 것을 괴롭게 여기지 않는다.","강(杠)은 판자로 만든 다리이니, 도강(徒杠)은 도보(徒步)로 다니는 자를 통행하게 하는 것이다. 양(梁)도 다리이니, 여량(輿梁)은 수레를 통행하게 하는 것이다. 주(周)나라의 11월은 하(夏)나라의 9월이요, 주(周)나라의 12월은 하(夏)나라의 10월이다. 하령(夏令)에 이르기를 ‘10월에 다리를 이룬다.’ 하였으니, 농사일이 이미 끝나서 백성의 노동력을 쓸 수 있고, 또 때가 장차 추워져서 물이 얼 것이니, 물에 교량(橋梁)이 있으면 백성들이 도보(徒步)로 건너는 것을 염려하지 않을 수 있으니, 이 또한 왕정(王政)의 한 가지 일이다."
君子平其政行辟人可也焉得人人而濟之,辟辟除也如周禮閽人爲之辟之辟言能平其政則出行之際辟除行人使之避己亦不爲過況國中之水當涉者衆豈能悉以乘輿濟之哉,君子平其政，行辟人可也。焉得人人而濟之？,辟，辟除也，如周禮閽人爲之辟之辟。言能平其政，則出行之際，辟除行人，使之避己，亦不爲過。況國中之水，當涉者衆，豈能悉以乘輿濟之哉？,"군자(君子)가 정사(政事)를 공평히 한다면 출행(出行)할 때에 사람들을 벽제(辟除)하는 것도 가하니, 어찌 사람마다 모두 건네줄 수 있겠는가.","벽(辟)은 벽제(辟除)함이니, 《주례(周禮)》에 ‘혼인(閽人)이 위하여 벽제(辟除)한다.’는 벽(辟)과 같다. ‘능히 정사(政事)를 공평히 한다면, 출행(出行)하는 즈음에 행인들을 벽제(辟除)하여 자기를 피하게 하는 것도 지나침이 되지 않는다. 더구나 국중(國中)의 물에 마땅히 건너야 할 곳이 많으니, 어찌 다 타고 있는 수레로 그들을 건네줄 수 있겠는가.’라고 말씀한 것이다."
故爲政者每人而悅之日亦不足矣,言每人皆欲致私恩以悅其意則人多日少亦不足於用矣諸葛武侯嘗言治世以大德不以小惠得孟子之意矣,故爲政者，每人而悅之，日亦不足矣。,言每人皆欲致私恩以悅其意，則人多日少，亦不足於用矣。諸葛武侯嘗言，“治世以大德，不以小惠”，得孟子之意矣。,그러므로 위정자(爲政者)가 매양 사람마다 마음을 기쁘게 해주려 한다면 날마다 하여도 또한 부족할 것이다.”,"사람마다 모두 사사로운 은혜를 이루어 그 뜻을 기쁘게 하고자 한다면 사람은 많고 날짜는 적어서 또한 씀에 부족함을 말씀한 것이다. 제갈무후(諸葛武侯)가 일찍이 말하기를 “세상을 다스림은 대덕(大德)으로써 해야 하고, 작은 은혜로써 하지 않는다.” 하였으니, 맹자(孟子)의 뜻을 얻었다."
孟子告齊宣王曰君之視臣如手足則臣視君如腹心君之視臣如犬馬則臣視君如國人君之視臣如土芥則臣視君如寇讎,孔氏曰宣王之遇臣下恩禮衰薄至於昔者所進今日不知其亡則其於群臣可謂邈然無敬矣故孟子告之以此手足腹心相待一體恩義之至也如犬馬則輕賤之然猶有豢養之恩焉國人猶言路人言無怨無德也土芥則踐踏之而已矣斬艾之而已矣其賤惡之又甚矣寇讎之報不亦宜乎,孟子告齊宣王曰：“君之視臣如手足；則臣視君如腹心；君之視臣如犬馬，則臣視君如國人；君之視臣如土芥，則臣視君如寇讎。”,孔氏曰：“宣王之遇臣下，恩禮衰薄，至於昔者所進，今日不知其亡；則其於群臣，可謂邈然無敬矣。故孟子告之以此。手足腹心，相待一體，恩義之至也。如犬馬則輕賤之，然猶有豢養之恩焉。國人，猶言路人，言無怨無德也。土芥，則踐踏之而已矣，斬艾之而已矣，其賤惡之又甚矣。寇讎之報，不亦宜乎？”,"맹자(孟子)께서 제선왕(齊宣王)에게 아뢰시기를 “군주(君主)가 신하(臣下) 보기를 수족(手足)과 같이 하면 신하(臣下)가 군주(君主)보기를 복심(腹心)[배와 심장]과 같이 여기고, 군주(君主)가 신하(臣下) 보기를 개와 말처럼 하면 신하(臣下)가 군주(君主) 보기를 국인(國人)[노인(路人)]과 같이 여기고, 군주(君主)가 신하(臣下) 보기를 토개(土芥)와 같이 하면 신하(臣下)가 군주(君主) 보기를 원수와 같이 하는 것입니다.”","공자(孔子)가 말하였다. “선왕(宣王)은 신하를 대우함에 은혜와 예(禮)가 쇠하고 박하여, 전일(前日)에 등용한 자가 오늘에 도망한 것을 모르는 지경에 이르렀으니, 군신(群臣)들에 대하여 막연(邈然)하여 공경함이 없다고 이를 만하다. 그러므로 맹자(孟子)께서 이 말씀을 아뢴 것이다.” 수족(手足)과 복심(腹心)은 서로 대하기를 일체(一體)로 하는 것이니, 은혜와 의(義)가 지극한 것이요, 개와 말처럼 한다면 가벼이 하고 천하게 하는 것이나, 오히려 길러주는 은혜가 있다. 국인(國人)은 노인(路人)이란 말과 같으니, 원망함도 없고 은덕도 없음을 말한다. 흙과 풀처럼 한다면 밟을 뿐이요, 벨뿐이니, 천히 여기고 미워함이 더욱 심하다. 원수로 보답함이 당연하지 않겠는가."
王曰禮爲舊君有服何如斯可爲服矣,儀禮曰以道去君而未絶者服齊衰三月王疑孟子之言太甚故以此禮爲問,王曰：“禮，爲舊君有服，何如斯可爲服矣？”,儀禮曰：“以道去君而未絶者，服齊衰三月。”王疑孟子之言太甚，故以此禮爲問。,"왕(王)이 말씀하였다. “예(禮)에 옛 군주를 위하여 복(服)이 있으니, 어떠하여야 이 복(服)을 입을 수 있습니까?”","《의례(儀禮)》에 이르기를 ‘도(道)로써 군주를 <버리고> 떠났으되, 아직 끊지 않은 자는 자최(齊衰) 삼월(三月)을 입는다.’ 하였으니, 왕(王)은 맹자(孟子)의 말씀이 너무 심하다고 의심하였다. 그러므로 이 예(禮)를 가지고 질문한 것이다."
曰諫行言聽膏澤下於民有故而去則君使人導之出疆又先於其所往去三年不反然後收其田里此之謂三有禮焉如此則爲之服矣,導之出疆防剽掠也先於其所往稱道其賢欲其收用之也三年而後收其田祿里居前此猶望其歸也,曰：“諫行言聽，膏澤下於民；有故而去，則君使人導之出疆，又先於其所往；去三年不反，然後收其田里。此之謂三有禮焉。如此，則爲之服矣。”,導之出疆，防剽掠也。先於其所往，稱道其賢，欲其收用之也。三年而後收其田祿里居，前此猶望其歸也。,"맹자(孟子)께서 말씀하였다. “간언(諫言)이 행해지고 말이 받아들여져 은택이 백성들에게 내려지고, 연고가 있어 떠나면, 군주가 사람으로 하여금 인도하여 국경을 나가게 하고, 또 그가 가는 곳에 먼저 기별하며, 떠난 지 3년이 되어도 돌아오지 않은 뒤에야 그의 전리(田里)[토지와 주택]를 환수하니, 이것을 세 번 예(禮)가 있다 이르나니, 이와 같이 하면 그를 위하여 복(服)을 입어주는 것입니다.”","도지출강(導之出疆)은 도적의 노략질을 막는 것이다. 그가 가는 곳에 먼저 기별한다는 것은 그의 어짊을 칭찬하여, 그를 거두어 쓰기를 바라는 것이다. 3년이 된 뒤에야 그의 전록(田祿)과 거주하는 집을 환수하니, 이전에는 오히려 그가 돌아오기를 바라는 것이다."
今也爲臣諫則不行言則不聽膏澤不下於民有故而去則君搏執之又極之於其所往去之日遂收其田里此之謂寇讎寇讎何服之有,極窮也窮之於其所往之國如晉錮欒盈也,今也爲臣。諫則不行，言則不聽；膏澤不下於民；有故而去，則君搏執之，又極之於其所往；去之日，遂收其田里。此之謂寇讎。寇讎何服之有？,極，窮也。窮之於其所往之國，如晉錮欒盈也。,"지금엔 신하가 되어 간(諫)하면 행하지 않으며, 말하면 들어주지 아니하여, 은택이 백성들에게 내려지지 못하고, 연고가 있어 떠나면, 군주가 그를 속박하며, 또 그가 가는 곳에 궁하게 하고, 떠나는 날에 마침내 그의 전리(田里)를 환수하니, 이것을 원수라 이르나니, 원수에게 무슨 복(服)입는 것이 있겠습니까?”","극(極)은 곤궁하게 하는 것이니, 그가 가는 바의 나라에 곤궁하게 하는 것이니, 예를들면, 진(晉)나라가 난영(欒盈)을 금고한 것과 같은 것이다."
,潘興嗣曰孟子告齊王之言猶孔子對定公之意也而其言有迹不若孔子之渾然也蓋聖賢之別如此楊氏曰君臣以義合者也故孟子爲齊王深言報施之道使知爲君者不可不以禮遇其臣耳若君子之自處則豈處其薄乎孟子曰王庶幾改之予日望之君子之言蓋如此,,潘興嗣曰：“孟子告齊王之言，猶孔子對定公之意也；而其言有迹，不若孔子之渾然也。蓋聖賢之別如此。”楊氏曰：“君臣以義合者也。故孟子爲齊王深言報施之道，使知爲君者不可不以禮遇其臣耳。若君子之自處，則豈處其薄乎？孟子曰‘王庶幾改之，予日望之’，君子之言蓋如此。”,,"반흥사(潘興嗣)가 말하였다. “맹자(孟子)께서 제선왕(齊宣王)에게 아뢴 말씀을 공자(孔子)께서 정공(定公)에게 대답한 뜻과 같으나, 그 말씀이 자취가 있어서 공자(孔子)의 혼연(渾然)함과 같지 않으니, 성(聖)·현(賢)의 분별이 이와 같다.” 양씨(楊氏)가 말하였다. “군신(君臣)은 의(義)로써 합한 자이다. 그러므로 맹자(孟子)께서 제왕(齊王)을 위하여 보시(報施)의 도(道)를 깊이 말씀하여, 군주가 된 자는 예(禮)로써 그 신하를 대우하지 않으면 안 된다는 것을 알게 하셨을 뿐이다. 군자(君子)의 자처(自處)로 말하면 어찌 그 박(薄)함에 처하겠는가. 맹자(孟子)께서 말씀하시기를 ‘왕(王)이 행여 고치시기를 나는 날마다 바란다.’ 하셨으니, 군자(君子)의 말씀은 이와 같은 것이다.”"
孟子曰無罪而殺士則大夫可以去無罪而戮民則士可以徙,言君子當見幾而作禍已迫則不能去矣,孟子曰：“無罪而殺士，則大夫可以去；無罪而戮民，則士可以徙。”,言君子當見幾而作，禍已迫，則不能去矣。,"맹자(孟子)께서 말씀하였다. “죄 없이 사(士)를 죽이면 대부(大夫)가 그 나라를 떠나야 하고, 죄 없이 백성을 죽이면 사(士)가 옮겨야 한다.”","군자(君子)는 마땅히 기미(幾微)를 보고 떠나야 하니, 화(禍)가 이미 임박하면 떠날 수 없음을 말씀한 것이다."
孟子曰君仁莫不仁君義莫不義,張氏曰此章重出然上篇主言人臣當以正君爲急此章直戒人君義亦小異耳,孟子曰：“君仁莫不仁，君義莫不義。”,張氏曰：“此章重出。然上篇主言人臣當以正君爲急，此章直戒人君，義亦小異耳。”,"맹자(孟子)께서 말씀하였다. “군주가 인(仁)하면 인(仁)하지 않음이 없고, 군주가 의로우면 의롭지 않음이 없다.”","장씨(張氏)가 말하였다. “이 장(章)은 거듭 나왔으나, 상편(上篇)에서는 신하가 마땅히 군주를 바로잡는 것을 급하게 여겨야 함을 주장하여 말씀하였고, 이 장(章)은 다만 인군(人君)을 경계하였으니, 뜻이 또한 조금 다르다.”"
孟子曰非禮之禮非義之義大人弗爲,察理不精故有二者之蔽大人則隨事而順理因時而處宜豈爲是哉,孟子曰：“非禮之禮，非義之義，大人弗爲。”,察理不精，故有二者之蔽。大人則隨事而順理，因時而處宜，豈爲是哉？,맹자(孟子)께서 말씀하였다. “예(禮)가 아닌 예(禮)와 의(義)가 아닌 의(義)를 대인(大人)은 하지 않는다.”,"이치를 살핌이 정(精)하지 못하기 때문에 두 가지의 가리움이 있는 것이다. 대인(大人)은 일에 따라 이(理)를 순(順)히 하고, 때에 따라 마땅하게 처리하니, 어찌 이런 짓을 하겠는가."
孟子曰中也養不中才也養不才故人樂有賢父兄也如中也棄不中才也棄不才則賢不肖之相去其間不能以寸,無過不及之謂中足以有爲之謂才養謂涵育薰陶俟其自化也賢謂中而才者也樂有賢父兄者樂其終能成己也爲父兄者若以子弟之不賢遂遽絶之而不能敎則吾亦過中而不才矣其相去之間能幾何哉,孟子曰：“中也養不中，才也養不才，故人樂有賢父兄也。如中也棄不中，才也棄不才，則賢不肖之相去，其間不能以寸。”,無過不及之謂中，足以有爲之謂才。養，謂涵育薰陶，俟其自化也。賢，謂中而才者也。樂有賢父兄者，樂其終能成己也。爲父兄者，若以子弟之不賢，遂遽絶之而不能敎，則吾亦過中而不才矣。其相去之間，能幾何哉？,"맹자(孟子)께서 말씀하였다. “<도(道)에> 맞는 자가 <도(道)에> 맞지 않는 자를 길러주며, 재주 있는 자가 재주 없는 자를 길러준다. 그러므로 사람들은 어진 부형(父兄)이 있는 것을 좋아하는 것이다. 만일 <도(道)에> 맞는 자가 <도(道)에> 맞지 않는 자를 버리며, 재주 있는 자가 재주 없는 자를 버린다면, 현자(賢者)와 불초(不肖)한 자의 거리는 그 사이가 한 치도 못되는 것이다.”","과(過)와 불급(不及)이 없는 것을 중(中)이라 이르고, 족히 훌륭한 일을 할 수 있는 것을 재(才)라 이른다. 양(養)은 함육(涵育)하고 훈도(薰陶)하여 스스로 변화하기를 기다림을 이른다. 현(賢)은 도(道)에 맞고 재주가 있는 자를 이른다. 어진 부형(父兄)이 있음을 좋아하는 것은 그 마침내 자기를 이루어 줄 수 있음을 좋아하는 것이다. 부형(父兄)된 자가 만일 자제(子弟)들이 어질지 못하다 하여, 마침내 대번에 끊어버리고 가르칠 수 없다고 여긴다면, 자신도 또한 중(中)에서 지나쳐 재주가 없는 것이 되니, 그 거리의 간격이 얼마나 되겠는가."
孟子曰人有不爲也而後可以有爲,程子曰有不爲知所擇也惟能有不爲是以可以有爲無所不爲者安能有所爲耶,孟子曰：“人有不爲也，而後可以有爲。”,程子曰：“有不爲，知所擇也。惟能有不爲，是以可以有爲。無所不爲者，安能有所爲耶？”,맹자(孟子)께서 말씀하였다. “사람은 하지 않는 것[지조]이 있은 뒤에야 훌륭한 일을 할 수 있는 것이다.”,"정자(程子)께서 말씀하였다. “하지 않음이 있는 것은 가릴 바를 아는 것이다. 능히 하지 않는 바가 있기 때문에 훌륭한 일을 할 수 있는 것이니, 하지 않는 바가 없는 자가 어찌 훌륭한 일을 할 수 있겠는가.”"
孟子曰言人之不善當如後患何,此亦有爲而言,孟子曰：“言人之不善，當如後患何？”,此亦有爲而言。,맹자(孟子)께서 말씀하였다. “남의 불선(不善)함을 말하다가 후환(後患)을 어찌하려는가.”,이 또한 이유가 이있어서 하신 말씀이다.
孟子曰仲尼不爲已甚者,已猶太也楊氏曰言聖人所爲本分之外不加毫末非孟子眞知孔子不能以是稱之,孟子曰：“仲尼不爲已甚者。”,已，猶太也。楊氏曰：“言聖人所爲，本分之外，不加毫末。非孟子眞知孔子，不能以是稱之。”,맹자(孟子)께서 말씀하였다. “중니(仲尼)께서는 너무 심한 것을 하지 않으셨다.”,"이(已)는 태(太)[너무]와 같다. 양씨(楊氏)가 말하였다. “성인(聖人)의 하시는 바는 본분(本分) 밖에 털끝만큼도 더하지 않음을 말씀한 것이니, 참으로 공자(孔子)를 아신 맹자(孟子)가 아니라면 이 말로써 칭할 수 없다.”"
孟子曰大人者言不必信行不必果惟義所在,必猶期也大人言行不先期於信果但義之所在則必從之卒亦未嘗不信果也,孟子曰：“大人者，言不必信，行不必果，惟義所在。”,必，猶期也。大人言行，不先期於信果，但義之所在，則必從之，卒亦未嘗不信果也。,"맹자(孟子)께서 말씀하였다. “대인(大人)이란 자는 말은 믿게 하기를 기필 하지 않으며, 행실은 과단성 있게 하기를 기필 하지 않고, 오직 의(義)가 있는 데로 하는 것이다.”","필(必)은 기(期)[기필함]와 같다. 대인(大人)은 언행(言行)이 먼저 믿게 하고 과단성 있게 하기를 기필 하지 아니하고, 다만 의(義)가 있는 곳에는 반드시 따르니, 마침내 또한 일찍이 신과(信果)하지 않은 것이 아니다."
,尹氏曰主於義則信果在其中矣主於信果則未必合義王勉曰若不合於義而不信不果則妄人爾,,尹氏曰：“主於義，則信果在其中矣；主於信果，則未必合義。”王勉曰：“若不合於義而不信不果，則妄人爾。”,,"윤씨(尹氏)가 말하였다. “의(義)를 주장하면 신(信)·과(果)가 그 가운데 있고, 신(信)·과(果)를 주장하면 반드시 의(義)에 합하지는 못한다.” 왕면(王勉)이 말하였다. “만일 의(義)에 합하지도 못하면서 신(信)하지도 못하고 과단성도 없다면 망령된 사람일뿐이다.”"
孟子曰大人者不失其赤子之心者也,大人之心通達萬變赤子之心則純一無僞而已然大人之所以爲大人正以其不爲物誘而有以全其純一無僞之本然是以擴而充之則無所不知無所不能而極其大也,孟子曰：“大人者，不失其赤子之心者也。”,大人之心，通達萬變；赤子之心，則純一無僞而已。然大人之所以爲大人，正以其不爲物誘，而有以全其純一無僞之本然。是以擴而充之，則無所不知，無所不能，而極其大也。,맹자(孟子)께서 말씀하였다. “대인(大人)이란 적자(赤子)의 마음을 잃지 않은 자이다.”,"대인(大人)의 마음은 온갖 변화를 통달하고, 적자(赤子)의 마음은 순일(純一)하여 거짓이 없을 뿐이다. 그러나 대인(大人)이 대인(大人)이 될 수 있는 까닭은 바로 물욕(物慾)에 유인을 당하지 아니하여 순일무위(純一無僞)의 본연(本然)한 마음을 온전히 함이 있기 때문이다. 그러므로 이것을 확충하면, 모르는 바가 없고 능하지 못한 바가 없어 그 큼을 다할 수 있는 것이다."
孟子曰養生者不足以當大事惟送死可以當大事,事生固當愛敬然亦人道之常耳至於送死則人道之大變孝子之事親舍是無以用其力矣故尤以爲大事而必誠必信不使少有後日之悔也,孟子曰：“養生者不足以當大事，惟送死可以當大事。”,事生固當愛敬，然亦人道之常耳；至於送死，則人道之大變。孝子之事親，舍是無以用其力矣。故尤以爲大事，而必誠必信，不使少有後日之悔也。,"맹자(孟子)께서 말씀하였다. “산 자[부모]를 봉양하는 것은 대사(大事)에 해당될 수 없고, 오직 죽은 자를 장송(葬送)하는 것이라야 대사(大事)에 해당될 수 있다.”","산 자를 섬김은 진실로 마땅히 사랑하고 공경하여야 할 것이다. 그러나 이는 또한 인도(人道)의 떳떳함일 뿐이요, 죽은 자를 장송(葬送)함으로 말하면 인도(人道)가 큰 변고이니, 효자(孝子)가 어버이를 섬김에 이를 버린다면 그 힘을 쓸데가 없다. 그러므로 더욱 이 것을 큰 일로 여겨서 반드시 성실히 하여 조금이라도 후일(後日)의 후회가 있지 않게 하는 것이다."
