대문,주석,대문표점,주석표점,대문해석,주석해석
其事則齊桓晉文其文則史孔子曰其義則丘竊取之矣,春秋之時五霸迭興而桓文爲盛史史官也竊取者謙辭也公羊傳作其辭則丘有罪焉爾意亦如此蓋言斷之在己所謂筆則筆削則削游夏不能贊一辭者也尹氏曰言孔子作春秋亦以史之文載當時之事也而其義則定天下之邪正爲百王之大法,其事則齊桓、晉文，其文則史。孔子曰：‘其義則丘竊取之矣。’,春秋之時，五霸迭興，而桓文爲盛。史，史官也。竊取者，謙辭也。公羊傳作“其辭則丘有罪焉爾”，意亦如此。蓋言斷之在己，所謂筆則筆、削則削，游夏不能贊一辭者也。尹氏曰：“言孔子作春秋，亦以史之文載當時之事也，而其義則定天下之邪正，爲百王之大法。”,"그 일은 제환공(齊桓公)·진문공(晉文公)의 일이요, 그 문체(文體)는 사관(史官)의 문체(文體)이다. 공자(孔子)께서 말씀하시기를 ‘그 의(義)는 내가 저으기 취했다.’ 하셨다.”","춘추(春秋)시대에 오패(五霸)가 차례로 일어났는데, 환공(桓公)과 문공(文公)이 가장 성하였다. 사(史)는 사관(史官)이다. 절취(竊取)는 겸사(謙辭)이다. 《공양전(公羊傳)》에는 “그 말인즉 내가 책임이 있다.”라고 되어 있으니, 그 뜻도 이와 같다. 결단하기를 자기 마음대로 하심을 말씀한 것이니, <《사기(史記)》에> 이른바 “기록할 것은 기록하고, 삭제할 것은 삭제하여, 자유(子游)·자하(子夏)가 한 마디 말도 돕지 못했다.”는 것이다. 윤씨(尹氏)가 말하였다. “공자(孔子)께서 《춘추(春秋)》를 지으실 적에 또한 사관(史官)의 문체로써 당시의 일을 기재하였는데, 그 의(義)는 천하(天下)의 사정(邪正)을 결정하여 백왕(百王)의 대법(大法)이 되었음을 말씀한 것이다.”"
,此又承上章歷敍群聖因以孔子之事繼之而孔子之事莫大於春秋故特言之,,此又承上章歷敍群聖，因以孔子之事繼之；而孔子之事莫大於春秋，故特言之。,,"이는 또 위 장(章)에 여러 성인(聖人)을 차례로 서술함을 이어서, 인하여 공자(孔子)의 일로써 뒤를 이었는데, 공자(孔子)의 일은 《춘추(春秋)》보다 더 큰 것이 없다. 그러므로 특별히 말씀하신 것이다."
孟子曰君子之澤五世而斬小人之澤五世而斬,澤猶言流風餘韻也父子相繼爲一世三十年亦爲一世斬絶也大約君子小人之澤五世而絶也楊氏曰四世而緦服之窮也五世袒免殺同姓也六世親屬竭矣服窮則遺澤寖微故五世而斬,孟子曰：“君子之澤五世而斬，小人之澤五世而斬。”,澤，猶言流風餘韻也。父子相繼爲一世，三十年亦爲一世。斬，絶也。大約君子小人之澤，五世而絶也。楊氏曰：“四世而緦，服之窮也；五世袒免，殺同姓也；六世親屬竭矣。服窮則遺澤寖微，故五世而斬。”,"맹자(孟子)께서 말씀하였다. “군자(君子)의 유택(遺澤)도 오세(五世)면 끊기고, 소인(小人)의 유택(遺澤)도 오세(五世)면 끊긴다.”","택(澤)은 유풍(流風) 여운(餘韻)이란 말과 같다. 부자(父子)가 서로 계승하는 것을 일세(一世)라 하며, 30년을 또한 일세(一世)라 한다. 참(斬)은 끊김이니, 대략 군자(君子)와 소인(小人)의 유택(遺澤)이 오세(五世)면 끊긴다. 양씨(楊氏)가 말하였다. “사세(四世)엔 시마복(緦麻服)을 입으니, 복(服)이 다한 것이요, 오세(五世)엔 단문(袒免)을 하니, 동성(同姓)으로 강등된 것이며, 육세(六世)엔 친속(親屬)이 다한다. 복(服)이 다하면 유택(遺澤)이 점점 미미해지기 때문에 오세(五世)면 끊기는 것이다.”"
予未得爲孔子徒也予私淑諸人也,私猶竊也淑善也李氏以爲方言是也人謂子思之徒也自孔子卒至孟子遊梁時方百四十餘年而孟子已老然則孟子之生去孔子未百年也故孟子言予雖未得親受業於孔子之門然聖人之澤尙存猶有能傳其學者故我得聞孔子之道於人而私竊以善其身蓋推尊孔子而自謙之辭也,予未得爲孔子徒也，予私淑諸人也。,私，猶竊也。淑，善也。李氏以爲方言是也。人，謂子思之徒也。自孔子卒至孟子遊梁時，方百四十餘年，而孟子已老。然則孟子之生，去孔子未百年也。故孟子言予雖未得親受業於孔子之門，然聖人之澤尙存，猶有能傳其學者。故我得聞孔子之道於人，而私竊以善其身，蓋推尊孔子而自謙之辭也。,"나는 공자(孔子)의 문도(門徒)가 되지는 못하였으나, 나는 남에게서 사사로이 선(善)하게 하였노라.”","사(私)는 절(竊)과 같고, 숙(淑)은 선(善)함이다. 이씨(李氏)가 이르기를 “방언(方言)이다.” 하였으니, 그 말이 옳다. 인(人)은 자사(子思)의 무리를 이른다. 공자(孔子)께서 별세한 뒤로부터 맹자(孟子)가 양(梁)땅에 계실 때에 이르기까지 140여 년이었는데, 맹자(孟子)께서 이미 늙으셨으니, 그렇다면 맹자(孟子)의 출생은 공자(孔子)와 거리가 백 년이 못되는 것이다. 그러므로 맹자(孟子)께서 말씀하시기를 “내 비록 공자(孔子)의 문하에서 친히 수업(受業)하지는 못하였으나, 성인(聖人)의 유택이 아직 남아 있어서 오히려 그 학문을 전수한 자가 있었다. 그러므로 내가 공자(孔子)의 도(道)를 남에게서 얻어들어 사사로이 그 몸을 선(善)하게 할 수 있었다.”고 하신 것이니, 공자(孔子)를 추존(推尊)하고 스스로 겸사 하신 말씀이다."
,此又承上三章歷敍舜禹至於周孔而以是終之其辭雖謙然其所以自任之重亦有不得而辭者矣,,此又承上三章，歷敍舜禹，至於周孔，而以是終之。其辭雖謙，然其所以自任之重，亦有不得而辭者矣。,,"이는 또 위 세 장(章)에서 순(舜)임금과 우왕(禹王)을 차례로 서술하고 주공(周公)·공자(孔子)에 이른 것을 이어서, 이것으로써 끝을 마치셨으니, 그 말씀은 비록 겸사(謙辭)이나, 그 스스로 책임지신 바의 중(重)함을 또한 사양할 수 없는 점이 있으시다."
孟子曰可以取可以無取取傷廉可以與可以無與與傷惠可以死可以無死死傷勇,先言可以者略見而自許之辭也後言可以無者深察而自疑之辭也過取固害於廉然過與亦反害其惠過死亦反害其勇蓋過猶不及之意也林氏曰公西華受五秉之粟是傷廉也冉子與之是傷惠也子路之死於衛是傷勇也,孟子曰：“可以取，可以無取，取傷廉；可以與，可以無與，與傷惠；可以死，可以無死，死傷勇。”,先言可以者，略見而自許之辭也，後言可以無者，深察而自疑之辭也。過取固害於廉，然過與亦反害其惠，過死亦反害其勇，蓋過猶不及之意也。林氏曰：“公西華受五秉之粟，是傷廉也；冉子與之，是傷惠也；子路之死於衛，是傷勇也。”,"맹자(孟子)께서 말씀하였다. “얼핏 보면 취할 만하고, 자세히 보면 취하지 말아야 할 경우에 취하면 청렴을 상하며, 얼핏 보면 줄 만하고, 자세히 보면 주지 말아야 할 경우에 주면 은혜를 상하며, 얼핏 보면 죽을 만하고, 자세히 보면 죽지 말아야 할 경우에 죽으면 용맹을 상한다.”","먼저 가이(可以)라고 말한 것은 대략 보고서 스스로 허여한 말이요, 뒤에 가이무(可以無)라고 말한 것은 깊이 살펴보고 스스로 의심한 말이다. 지나치게 취함은 진실로 청렴에 손상되나. 지나치게 주는 것도 또한 도리어 은혜를 손상하고, 지나치게 죽음도 또한 도리어 용맹을 손상하는 것이니 과(過)함이 불급(不及)함과 같다는 뜻이다. 임씨(林氏)가 말하였다. “공서화(公西華)가 오병(五秉)의 곡식을 받은 것은 이는 청렴을 손상한 것이요, 염자(冉子)가 준 것은 이는 은혜를 손상한 것이요, 자로(子路)가 위(衛)나라에서 죽은 것은 이는 용맹을 손상한 것이다.”"
逄蒙學射於羿盡羿之道思天下惟羿爲愈己於是殺羿孟子曰是亦羿有罪焉公明儀曰宜若無罪焉曰薄乎云爾惡得無罪,羿有窮后羿也逄蒙羿之家衆也羿善射簒夏自立後爲家衆所殺愈猶勝也薄言其罪差薄耳,逄蒙學射於羿，盡羿之道，思天下惟羿爲愈己，於是殺羿。孟子曰：“是亦羿有罪焉。”公明儀曰：“宜若無罪焉。”曰：“薄乎云爾，惡得無罪？“,羿，有窮后羿也。逄蒙，羿之家衆也。羿善射，簒夏自立，後爲家衆所殺。愈，猶勝也。薄，言其罪差薄耳。,"방몽(逄蒙)이 활쏘기를 예(羿)에게서 배워, 예(羿)의 기술을 다 배우고 생각하기를 ‘천하에 오직 예(羿)만이 자기보다 낫다.’ 하여, 예(羿)를 죽였다. 맹자(孟子)께서 이를 평하시기를 “이 또한 예(羿)에게도 책임이 있는 것이다. 공명의(公明儀)는 ‘마땅히 죄가 없을 듯하다.’ 하였으나, 박(薄)할지언정 어찌 죄가 없다 하겠는가.”","예(羿)는 유궁(有窮)나라의 군주인 예(羿)이다. 방몽(逄蒙)은 예(羿)의 가중(家衆)이다. 예(羿)는 활쏘기를 잘하여 하(夏)나라를 찬탈하고 스스로 즉위했었는데, 뒤에 가중(家衆)에게 살해당하였다. 유(愈)는 승(勝)[나음]과 같다. 박(薄)은 그 죄가 조금 박함을 말한 것이다."
鄭人使子濯孺子侵衛衛使庾公之斯追之子濯孺子曰今日我疾作不可以執弓吾死矣夫問其僕曰追我者誰也其僕曰庾公之斯也曰吾生矣其僕曰庾公之斯衛之善射者也夫子曰吾生何謂也曰庾公之斯學射於尹公之他尹公之他學射於我夫尹公之他端人也其取友必端矣庾公之斯至曰夫子何爲不執弓曰今日我疾作不可以執弓曰小人學射於尹公之他尹公之他學射於夫子我不忍以夫子之道反害夫子雖然今日之事君事也我不敢廢抽矢扣輪去其金發乘矢而後反,之語助也僕御也尹公他亦衛人也端正也孺子以尹公正人知其取友必正故度庾公必不害己小人庾公自稱也金鏃也扣輪出鏃令不害人乃以射也乘矢四矢也孟子言使羿如子濯孺子得尹公他而敎之則必無逄蒙之禍然夷羿簒弑之賊蒙乃逆儔庾斯雖全私恩亦廢公義其事皆無足論者孟子蓋特以取友而言耳,鄭人使子濯孺子侵衛，衛使庾公之斯追之。子濯孺子曰：‘今日我疾作，不可以執弓，吾死矣夫！’問其僕曰：‘追我者誰也？’其僕曰：‘庾公之斯也。’曰：‘吾生矣。’其僕曰：‘庾公之斯，衛之善射者也，夫子曰“吾生”，何謂也？’曰：‘庾公之斯學射於尹公之他，尹公之他學射於我。夫尹公之他，端人也，其取友必端矣。’庾公之斯至，曰：‘夫子何爲不執弓？’曰：‘今日我疾作，不可以執弓。’曰：‘小人學射於尹公之他，尹公之他學射於夫子。我不忍以夫子之道反害夫子。雖然，今日之事，君事也，我不敢廢。’抽矢扣輪，去其金，發乘矢而後反。,之，語助也。僕，御也。尹公他亦衛人也。端，正也。孺子以尹公正人；知其取友必正；故度庾公必不害己。小人，庾公自稱也。金，鏃也。扣輪出鏃，令不害人，乃以射也。乘矢，四矢也。孟子言使羿如子濯孺子得尹公他而敎之，則必無逄蒙之禍。然夷羿簒弑之賊，蒙乃逆儔；庾斯雖全私恩，亦廢公義。其事皆無足論者，孟子蓋特以取友而言耳。,"정(鄭)나라 사람이 자탁유자(子濯孺子)로 하여금 위(衛)나라를 침략하게 하자, 위(衛)나라에서는 유공(庾公) 사(斯)로 하여금 그를 추격하게 하였다. 자탁유자(子濯孺子)가 말하기를 ‘오늘에 나는 병이 나서 활을 잡을 수 없으니, 나는 죽었구나!’ 하고, 그 마부에게 묻기를 ‘나를 추격해오는 자는 누구인가?’ 하자, 그 마부는 ‘유공(庾公) 사(斯)입니다.’ 하고 대답하였다. 자탁유자(子濯孺子)가 말하기를 ‘나는 살았구나!’하니, 그 마부가 말하기를 ‘유공(庾公) 사(斯)는 위(衛)나라의 활쏘기를 잘하는 자인데, 부자(夫子)께서 「내 살았다」 하심은 무슨 말씀입니까?’ 하자, 그는 대답하기를 ‘유공(庾公) 사(斯)는 활쏘기를 윤공(尹公) 타(他)에게서 배웠고, 윤공(尹公) 타(他)는 활쏘기를 나에게서 배웠으니, 윤공(尹公) 타(他)는 단정한 사람이라, 벗을 취함에 반드시 단정할 것이다.’ 하였다. 유공(庾公) 사(斯)가 도착하여 이르기를 ‘부자(夫子)께서 어찌하여 활을 잡지 않습니까?’ 하고, 묻자, 자탁유자(子濯孺子)는 ‘오늘에 나는 병이 나서 활을 잡을 수가 없네.’라고 대답하였다. 유공(庾公) 사(斯)가 말하기를 ‘소인(小人)은 활쏘기를 윤공(尹公) 타(他)에게서 배웠고, 윤공(尹公) 타(他)는 활쏘기를 부자(夫子)에게서 배웠으니, 나는 차마 부자(夫子)의 도(道)[기술]로써 도리어 부자(夫子)를 해칠 수 없습니다. 그러나 오늘의 일은 국가의 일이니, 제가 감히 그만둘 수 없습니다.’ 하고는, 화살을 뽑아 수레바퀴에 두들겨 살촉을 빼버리고, 네 개의 화살을 발사한 뒤에 돌아갔었다.”","<유공지사(庾公之斯)와 윤공지타(尹公之他)의> 지(之)는 어조사이다. 복(僕)은 말을 모는 것이다. 윤공(尹公) 타(他)는 또한 위(衛)나라 사람이다. 단(端)은 단정함이다. 유자(孺子)는 윤공(尹公)이 단정한 사람이었으므로 그가 벗을 취함에 반드시 단정할 줄을 알았다. 그러므로 유공(庾公)이 반드시 자기를 해치지 않을 것을 헤아렸던 것이다. 소인(小人)은 유공(庾公)이 자신을 칭한 것이다. 금(金)은 촉(鏃)이다. 수레바퀴에 두들겨 화살촉을 빼내어 사람을 상하지 않게 하고, 그제야 활을 쏜 것이다. 승시(乘矢)는 네 개의 화살이다. 맹자(孟子)께서 말씀하시기를 “가령 예(羿)가 자탁유자(子濯孺子)가 윤공(尹公) 타(他)를 얻어서 가르친 것과 같이 하였더라면 반드시 방몽(逄蒙)의 화(禍)가 없었을 것이다.”라고 하신 것이다. 그러나 이예(夷羿)는 군주를 시해하고 찬탈한 역적이요, 방몽(逄蒙)은 바로 역적의 무리이며, 유공(庾公) 사(斯)는 비록 사사로운 은혜를 온전히 하였으나, 또한 공의(公義)를 폐하였으니, 그 일이 모두 논할 만한 것이 못된다. 맹자(孟子)께서는 다만 벗을 취함을 가지고 말씀하셨을 뿐이다."
孟子曰西子蒙不潔則人皆掩鼻而過之,西子美婦人蒙猶冒也不潔汚穢之物也掩鼻惡其臭也,孟子曰：“西子蒙不潔，則人皆掩鼻而過之。“,西子，美婦人。蒙，猶冒也。不潔，汚穢之物也。掩鼻，惡其臭也。,"맹자(孟子)께서 말씀하였다. “서자(西子)가 불결한 것을 뒤집어쓰고 있으면, 사람들이 모두 코를 막고 지나간다.”",서자(西子)는 아름다운 부인이다. 몽(蒙)은 모(冒)[뒤집어씀]와 같다. 불결(不潔)은 더러운 물건이다. 엄비(掩鼻)는 그 악취를 싫어하는 것이다.
雖有惡人齊戒沐浴則可以祀上帝,惡人醜貌者也,雖有惡人，齊戒沐浴，則可以祀上帝。,惡人，醜貌者也。,비록 추악한 사람이 있을지라도 목욕재계를 하면 상제(上帝)에게 제사지낼 수 있다.”,악인(惡人)은 모양이 추악한 자이다.
,尹氏曰此章戒人之喪善而勉人以自新也,,尹氏曰：“此章戒人之喪善，而勉人以自新也。”,,"윤씨(尹氏)가 말하였다. “이 장(章)은 사람들이 선(善)을 잃는 것을 경계하고, 사람들에게 스스로 새로워지기를 권면하신 것이다.”"
孟子曰天下之言性也則故而已矣故者以利爲本,性者人物所得以生之理也故者其已然之跡若所謂天下之故者也利猶順也語其自然之勢也言事物之理雖若無形而難知然其發見之已然則必有跡而易見故天下之言性者但言其故而理自明猶所謂善言天者必有驗於人也然其所謂故者又必本其自然之勢如人之善水之下非有所矯揉造作而然者也若人之爲惡水之在山則非自然之故矣,孟子曰：“天下之言性也，則故而已矣。故者以利爲本。”,性者，人物所得以生之理也。故者，其已然之跡，若所謂天下之故者也。利，猶順也，語其自然之勢也。言事物之理，雖若無形而難知；然其發見之已然，則必有跡而易見。故天下之言性者，但言其故而理自明，猶所謂善言天者必有驗於人也。然其所謂故者，又必本其自然之勢；如人之善、水之下，非有所矯揉造作而然者也。若人之爲惡、水之在山，則非自然之故矣。,"맹자(孟子)께서 말씀하였다. “천하에 성(性)을 말함은 고(故)일 뿐이니, 고(故)라는 것은 순리(順利)를 근본으로 삼는다.”","성(性)은 사람과 물건이 얻어서 태어난 바의 이(理)이다. 고(故)는 그 이미 그러한 자취이니, <《주역(周易)》〈계사전(繫辭傳)〉에> 이른바 ‘천하(天下)의 고(故)’라는 것과 같은 것이다. 이(利)는 순(順)과 같으니, 자연(自然)의 세(勢)를 말한다. 사물의 이치는 비록 형체가 없어서 알기 어려운 듯하나, 그 발현(發見)되어 이미 그러함은 반드시 자취가 있어서 보기 쉽다. 그러므로 천하에 성(性)을 말하는 자들은 단지 그 고(故)를 말하면 이(理)가 자명해지니, <《순자(荀子)》에> 이른바 ‘하늘을 잘 말하는 자는 반드시 사람에게 징험 함이 있다.’는 것과 같은 것이다. 그러나 이른바 고(故)라는 것은 또 반드시 자연의 세(勢)에 근본 하니, 사람의 마음이 선(善)함과 물이 아래로 흐르는 것과 같아서, 억지로 교유(矯揉)하고 조작(造作)한 바가 있어 그러한 것이 아니다. 사람이 악행(惡行)을 하는 것과 물이 산에 있는 것으로 말하면 자연(自然)의 고(故)가 아니다."
所惡於智者爲其鑿也如智者若禹之行水也則無惡於智矣禹之行水也行其所無事也如智者亦行其所無事則智亦大矣,天下之理本皆利順小智之人務爲穿鑿所以失之禹之行水則因其自然之勢而導之未嘗以私智穿鑿而有所事是以水得其潤下之性而不爲害也,所惡於智者，爲其鑿也。如智者若禹之行水也，則無惡於智矣。禹之行水也，行其所無事也。如智者亦行其所無事，則智亦大矣。,天下之理，本皆利順，小智之人，務爲穿鑿，所以失之。禹之行水，則因其自然之勢而導之，未嘗以私智穿鑿而有所事，是以水得其潤下之性而不爲害也。,"지혜로움을 미워하는 까닭은 그 천착(穿鑿)하기 때문이니, 만일 지혜로운 자가 우왕(禹王)이 물을 흘러가게 하듯이 한다면 지혜를 미워할 까닭이 없을 것이다. 우왕(禹王)이 물을 흘러가게 하신 것은 그 무사(無事)한 바를 행하신 것이니, 만일 지혜로운 자가 또한 무사(無事)한 바를 행한다면 지혜가 또한 클 것이다.","천하의 이(理)는 본래 다 이순(利順)한데, 작은 지혜를 가진 사람들은 천착(穿鑿)하기를 힘쓰니, 이 때문에 잃는 것이다. 우왕(禹王)이 물을 흘러가게 하심은 자연의 세(勢)를 인하여 인도하였고, 일찍이 사사로운 지혜로써 천착(穿鑿)하여 일삼은 바가 있지 않으셨다. 이 때문에 물이 그 윤하(潤下)의 성질을 얻어 해(害)가 되지 않은 것이다."
天之高也星辰之遠也苟求其故千歲之日至可坐而致也,天雖高星辰雖遠然求其已然之跡則其運有常雖千歲之久其日至之度可坐而得況於事物之近若因其故而求之豈有不得其理者而何以穿鑿爲哉必言日至者造歷者以上古十一月甲子朔夜半冬至爲歷元也,天之高也，星辰之遠也，苟求其故，千歲之日至，可坐而致也。,天雖高，星辰雖遠，然求其已然之跡，則其運有常。雖千歲之久，其日至之度，可坐而得。況於事物之近，若因其故而求之，豈有不得其理者，而何以穿鑿爲哉？必言日至者，造歷者以上古十一月甲子朔夜半冬至爲歷元也。,"하늘이 높이 있으며 성신(星辰)이 멀리 있으나, 만일 그 이미 지난 고(故)를 찾는다면 천세(千歲)의 일지(日至)[동지(冬至)]를 가만히 앉아서도 알 수 있는 것이다.”","하늘이 비록 높고, 성신(星辰)이 비록 멀리 있으나, 그 이미 그러한 자취를 살펴보면 그 운행함에 일정함이 있어서, 비록 천 년의 오랜 세월이라 하더라도 그 일지(日至)의 도수(度數)를 가만히 앉아서 알 수 있으니, 하물며 가까이 있는 사물로서 만일 그 고(故)를 인하여 찾는다면, 어찌 그 이치를 알지 못함이 있어서 천착을 하겠는가. 반드시 일지(日至)라고 말한 것은 책력을 만든 자가 상고시대의 11월 갑자삭(甲子朔) 야반(夜半)에 동지(冬至)가 든 날을 책력의 기원으로 삼았기 때문이다."
,程子曰此章專爲智而發愚謂事物之理莫非自然順而循之則爲大智若用小智而鑿以自私則害於性而反爲不智程子之言可謂深得此章之旨矣,,程子曰：“此章專爲智而發。”愚謂事物之理，莫非自然。順而循之，則爲大智。若用小智而鑿以自私，則害於性而反爲不智。程子之言，可謂深得此章之旨矣。,,"정자(程子)가 말씀하였다. “이 장(章)은 오로지 지혜를 위하여 말씀하신 것이다.” 내가 생각건대, 사물(事物)의 이치는 자연(自然)이 아님이 없으니, 이를 순히 하여 따르면 큰 지혜가 되고, 만일 작은 지혜를 사용하여 천착(穿鑿)해서 스스로 사사롭게 한다면, 본성을 해쳐 도리어 지혜롭지 못함이 되는 것이다. 정자(程子)의 말씀은 깊이 이 장(章)의 뜻을 알았다고 이를 만하다."
公行子有子之喪右師往弔入門有進而與右師言者有就右師之位而與右師言者,公行子齊大夫右師王驩也,公行子有子之喪，右師往弔，入門，有進而與右師言者，有就右師之位而與右師言者。,公行子，齊大夫。右師，王驩也。,"공행자(公行子)가 아들의 상(喪)이 있자, 우사(右師)가 가서 조문할 적에, 우사(右師)가 문에 들어오자, 그 앞으로 나오게 하여 우사(右師)와 더불어 말하는 자가 있었으며, <우사(右師)가 자리에 나아가자> 우사(右師)의 자리로 나아가서 우사(右師)와 더불어 말하는 자가 있었다.",공행자(公行子)는 제(齊)나라의 대부(大夫)이다. 우사(右師)는 왕환(王驩)이다.
孟子不與右師言右師不悅曰諸君子皆與驩言孟子獨不與驩言是簡驩也,簡略也,孟子不與右師言，右師不悅曰：“諸君子皆與驩言，孟子獨不與驩言，是簡驩也。”,簡，略也。,"맹자(孟子)께서 우사(右師)와 말씀하시지 않자, 우사(右師)가 기뻐하지 않으며 말하였다. “여러 군자(君子)들은 모두 나와 말씀하는데, 맹자(孟子)만이 홀로 나와 말씀하지 않으니, 이는 나를 소홀히 하는 것이다.”",간(簡)은 간략[소홀]히 하는 것이다.
