대문,주석,대문표점,주석표점,대문해석,주석해석
孟子聞之曰禮朝廷不歷位而相與言不踰階而相揖也我欲行禮子敖以我爲簡不亦異乎,是時齊卿大夫以君命弔各有位次若周禮凡有爵者之喪禮則職喪涖其禁令序其事故云朝廷也歷更涉也位他人之位也右師未就位而進與之言則右師歷己之位矣右師已就位而就與之言則己歷右師之位矣孟子右師之位又不同階孟子不敢失此禮故不與右師言也,孟子聞之，曰：“禮，朝廷不歷位而相與言，不踰階而相揖也。我欲行禮，子敖以我爲簡，不亦異乎？”,是時齊卿大夫以君命弔，各有位次。若周禮，凡有爵者之喪禮，則職喪涖其禁令，序其事，故云朝廷也。歷，更涉也。位，他人之位也。右師未就位而進與之言，則右師歷己之位矣；右師已就位而就與之言，則己歷右師之位矣。孟子右師之位又不同階，孟子不敢失此禮，故不與右師言也。,"맹자(孟子)께서 이 말씀을 들으시고 말씀하였다. “예(禮)에 조정에서는 남의 자리를 지나 남과 더불어 말하지 아니하며, 계급을 지나가서 서로 읍(揖)하지 않는다. 나는 이 예(禮)를 행하고자 하였는데, 자오(子敖)[왕환(王驩)의 자(字)]는 나더러 소홀히 한다고 말하니, 이상하지 아니한가.”","이 때에 제(齊)나라 경대부(卿大夫)들이 인군(人君)의 명에 따라 조문 가서 각기 위차(位次)가 있었으니, 《주례(周禮)》에 모든 관작(官爵)이 있는 자의 상례(喪禮)에는 직상(職喪)이 그 자리에 가서 금령(禁令)을 맡아 그 일을 서열 하는 것과 같이 하였다. 그러므로 조정(朝廷)이라고 말한 것이다. 역(歷)은 지나가는 것이다. 위(位)는 타인(他人)의 자리이다. 우사(右師)가 아직 자리에 나아가지 않았는데, 나아가 그와 더불어 말한다면 이는 우사(右師)가 자기 자리를 지나간 것이 되고, 우사(右師)가 이미 자기 자리로 나아갔는데, 찾아가서 그와 더불어 말한다면 자기가 우사(右師)의 자리를 지나간 것이 된다. 맹자(孟子)와 우사(右師)의 지위는 또 계급이 같지 않았으니, 맹자(孟子)께서는 감히 이 예(禮)를 잃을 수 없었으므로 우사(右師)와 더불어 말씀하시지 않은 것이다."
孟子曰君子所以異於人者以其存心也君子以仁存心以禮存心,以仁禮存心言以是存於心而不忘也,孟子曰：“君子所以異於人者，以其存心也。君子以仁存心，以禮存心。”,以仁禮存心，言以是存於心而不忘也。,"맹자(孟子)께서 말씀하였다. “군자(君子)가 일반인과 다른 것은 그 마음을 두기 때문이니, 군자(君子)는 인(仁)을 마음에 두며, 예(禮)를 마음에 둔다.”",인(仁)과 예(禮)를 마음에 둔다는 것은 이것을 마음속에 두어 잊지 않음을 말한다.
仁者愛人有禮者敬人,此仁禮之施,仁者愛人，有禮者敬人。,此仁禮之施。,"인(仁)한 자는 남을 사랑하고, 예(禮)가 있는 자는 남을 공경한다.",이는 인(仁)과 예(禮)를 베풂이다.
愛人者人恒愛之敬人者人恒敬之,此仁禮之驗,愛人者人恒愛之，敬人者人恒敬之。,此仁禮之驗。,"남을 사랑하는 자는 남이 항상 사랑해 주고, 남을 공경하는 자는 남이 항상 공경해 준다.",이는 인(仁)과 예(禮)를 베푼 효험이다.
有人於此其待我以橫逆則君子必自反也我必不仁也必無禮也此物奚宜至哉,橫逆謂强暴不順理也物事也,有人於此，其待我以橫逆，則君子必自反也：我必不仁也，必無禮也，此物奚宜至哉？,橫逆，謂强暴不順理也。物，事也。,"여기에 어떤 사람이 있는데, 자신을 대하기를 횡역(橫逆)으로써 하면, 군자(君子)는 반드시 스스로 돌이켜서, 내 반드시 인(仁)하지 못하며 내 반드시 예(禮)가 없는가보다. 이러한 일이 어찌 이를 수 있겠는가 한다.",횡역(橫逆)은 강포(强暴)하여 이치를 순종하지 않음을 이른다. 물(物)은 일이다.
其自反而仁矣自反而有禮矣其橫逆由是也君子必自反也我必不忠,忠者盡己之謂我必不忠恐所以愛敬人者有所不盡其心也,其自反而仁矣，自反而有禮矣，其橫逆由是也，君子必自反也：我必不忠。,忠者，盡己之謂。我必不忠，恐所以愛敬人者，有所不盡其心也。,"그 스스로 돌이켜 인(仁)하였으며, 스스로 돌이켜 예(禮)가 있었는데도, 그 횡역(橫逆)이 전과 같으면 군자(君子)는 반드시 스스로 돌이켜, 내 반드시 충(忠)[성실]하지 못한가보다 한다.",충(忠)은 자기 마음을 다함을 이른다. 내 반드시 성실하지 못하다는 것은 남을 사랑하고 공경하는 것이 그 마음을 다하지 못한 바가 있을까 두려워하는 것이다.
自反而忠矣其橫逆由是也君子曰此亦妄人也已矣如此則與禽獸奚擇哉於禽獸又何難焉,奚擇何異也又何難焉言不足與之校也,自反而忠矣，其橫逆由是也，君子曰：‘此亦妄人也已矣。如此則與禽獸奚擇哉？於禽獸又何難焉？’,奚擇，何異也。又何難焉，言不足與之校也。,"스스로 돌이켜 성실하였으되, 그 횡역(橫逆)이 전과 같으면, 군자(君子)는 말하기를 ‘이 또한 망인(妄人)일 뿐이다.’ 하나니, 이와 같다면 금수(禽獸)와 어찌 구별되겠는가. 금수(禽獸)에게 또 무엇을 꾸짖을 것이 있겠는가.",해택(奚擇)은 어찌 다름이다. 또 무엇을 꾸짖을 것이 있겠는가는 그와 더불어 따질 것이 못됨을 말한다.
是故君子有終身之憂無一朝之患也乃若所憂則有之舜人也我亦人也舜爲法於天下可傳於後世我由未免爲鄕人也是則可憂也憂之如何如舜而已矣若夫君子所患則亡矣非仁無爲也非禮無行也如有一朝之患則君子不患矣,鄕人鄕里之常人也君子存心不苟故無後憂,是故君子有終身之憂，無一朝之患也。乃若所憂則有之：舜人也，我亦人也。舜爲法於天下，可傳於後世，我由未免爲鄕人也，是則可憂也。憂之如何？如舜而已矣。若夫君子所患則亡矣。非仁無爲也，非禮無行也。如有一朝之患，則君子不患矣。,鄕人，鄕里之常人也。君子存心不苟，故無後憂。,"이렇기 때문에 군자(君子)는 종신(終身)토록 하는 근심은 있어도, 하루 아침의 걱정은 없는 것이다. 근심하는 바로 말하면 있으니, 순(舜)임금도 사람이며 나도 또한 사람인데, 순(舜)임금은 천하에 모범이 되어서 후세(後世)에 전할 만하시거늘, 나는 아직도 향인(鄕人)이 됨을 면치 못하였으니, 이는 근심할 만한 일이다. 근심하면 어찌하겠는가. 순(舜)임금과 같이 할 뿐이다. 군자(君子)의 걱정하는 바는 없으니, 인(仁)이 아니면 하지 않으며, 예(禮)가 아니면 행하지 않는다. 만일 하루 아침의 걱정이 있다 하더라도 군자(君子)는 걱정하지 않는다.”",향인(鄕人)은 향리(鄕里)의 보통 사람이다. 군자(君子)는 마음을 두기를 구차히 하지 않는다. 그러므로 뒤에 근심이 없는 것이다.
禹稷當平世三過其門而不入孔子賢之,事見前篇,禹、稷當平世，三過其門而不入，孔子賢之。,事見前篇。,"우왕(禹王)과 후직(后稷)이 평세(平世)를 당하여 세 번 그 문 앞을 지나면서도 들어가지 못하시자, 공자(孔子)께서 그들을 어질게 여기셨다.",일이 전편(前篇)[등문공상(滕文公上)]에 보인다.
顔子當亂世居於陋巷一簞食一瓢飮人不堪其憂顔子不改其樂孔子賢之,,顔子當亂世，居於陋巷。一簞食，一瓢飮。人不堪其憂，顔子不改其樂，孔子賢之。,(주석없음),"안자(顔子)[안회(顔回)]가 난세(亂世)를 당하여 누추한 골목에서 거처하며 한 그릇의 밥과 한 그릇의 음료로 사는 것을 다른 사람들은 그 근심을 감당하지 못하는데, 안자(顔子)는 그 낙(樂)을 변치 않자, 공자(孔子)께서 그를 어질게 여기셨다.",(주석해석없음)
孟子曰禹稷顔回同道,聖賢之道進則救民退則修己其心一而已矣,孟子曰：“禹、稷、顔回同道。”,聖賢之道，進則救民，退則修己，其心一而已矣。,맹자(孟子)께서 말씀하였다. “우왕(禹王)과 후직(后稷)과 안회(顔回)는 도(道)가 같다.”,"성현(聖賢)의 도(道)는 나아가면 백성을 구제하고, 물러가면 몸을 닦으니, 그 마음은 하나일 뿐이다."
禹思天下有溺者由己溺之也稷思天下有飢者由己飢之也是以如是其急也,禹稷身任其職故以爲己責而救之急也,禹思天下有溺者，由己溺之也；稷思天下有飢者，由己飢之也，是以如是其急也。,禹稷身任其職，故以爲己責而救之急也。,"우왕(禹王)은 생각하시기를, 천하에 물이 빠진 자가 있으면 마치 자신이 그를 빠뜨린 것과 같이 여기시며, 후직(后稷)은 생각하기를, 천하에 굶주리는 자가 있으면 마치 자신이 그를 굶주리게 한 것처럼 여겼으니, 이 때문에 이와 같이 급하게 하신 것이다.",우왕(禹王)과 후직(后稷)은 자신이 그 직책을 맡았기 때문에 자기의 책임으로 삼아 구제하기를 급하게 한 것이다.
禹稷顔子易地則皆然,聖賢之心無所偏倚隨感而應各盡其道故使禹稷居顔子之地則亦能樂顔子之樂使顔子居禹稷之任亦能憂禹稷之憂也,禹、稷、顔子易地則皆然。,聖賢之心無所偏倚，隨感而應，各盡其道。故使禹稷居顔子之地，則亦能樂顔子之樂；使顔子居禹稷之任，亦能憂禹稷之憂也。,우왕(禹王)과 후직(后稷)과 안자(顔子)가 처지를 바꾸면 다 그러하셨을 것이다.,"성현(聖賢)의 마음은 편벽 되고 치우친 바가 없어서 감동함에 따라 응하여 각기 도(道)를 다한다. 그러므로 가령 우왕(禹王)과 후직(后稷)이 안자(顔子)의 처지에 처했다면 또한 능히 안자(顔子)의 낙(樂)을 즐거워했을 것이요, 가령 안자(顔子)가 우왕(禹王)과 후직(后稷)의 책임을 맡았다면 또한 우왕(禹王)과 후직(后稷)의 근심을 걱정했을 것이다."
今有同室之人鬪者救之雖被髮纓冠而救之可也,不暇束髮而結纓往救言急也以喩禹稷,今有同室之人鬪者，救之，雖被髮纓冠而救之，可也。,不暇束髮，而結纓往救，言急也。以喩禹稷。,"이제 한 방에 같이 있는 사람이 싸우는 자가 있으면 이를 말리되, 비록 머리를 그대로 풀어 흩뜨리고 각끈만 매고 가서 말리더라도 가(可)한 것이다.","머리를 묶을 겨를이 없어 갓끈만 매고 가서 말리는 것이니, 급함을 말한다. 이는 우왕(禹王)과 후직(后稷)을 비유한 것이다."
鄕隣有鬪者被髮纓冠而往救之則惑也雖閉戶可也,喩顔子也,鄕隣有鬪者，被髮纓冠而往救之，則惑也，雖閉戶可也。,喩顔子也。,"향리(鄕里)와 이웃에 싸우는 자가 있으면 머리를 풀어 흩뜨리고 갓끈만 매고 가서 말린다면 혹(惑)한 것이니, 비록 문을 닫더라도 가(可)한 것이다.”",안자(顔子)를 비유한 것이다.
,此章言聖賢心無不同事則所遭或異然處之各當其理是乃所以爲同也尹氏曰當其可之謂時前聖後聖其心一也故所遇皆盡善,,此章言聖賢心無不同，事則所遭或異；然處之各當其理，是乃所以爲同也。尹氏曰：“當其可之謂時，前聖後聖，其心一也，故所遇皆盡善。”,,"이 장(章)은 성현(聖賢)은 마음은 같지 않음이 없고, 일은 만나는 바가 혹 다르다. 그러나 대처함에 각기 그 이치에 맞게 하니, 이것이 바로 같음이 되는 것임을 말씀한 것이다. 윤씨(尹氏)가 말하였다. “그 가(可)함에 맞게 함을 때라고 이르니, 앞 성인(聖人)과 뒤 성인(聖人)이 마음이 똑같다. 그러므로 만나는 바에 모두 극진히 선(善)하게 한 것이다.”"
公都子曰匡章通國皆稱不孝焉夫子與之遊又從而禮貌之敢問何也,匡章齊人通國盡一國之人也禮貌敬之也,公都子曰：“匡章，通國皆稱不孝焉。夫子與之遊，又從而禮貌之，敢問何也？”,匡章，齊人。通國，盡一國之人也。禮貌，敬之也。,"공도자(公都子)가 말하였다. “광장(匡章)을 온 나라 사람들이 모두 ‘불효(不孝)한다.’ 칭하거늘 부자(夫子)께서 그와 더불어 교유하시고 또 따라서 예우하시니, 감히 묻겠습니다. 어째서입니까?”",광장(匡章)은 제(齊)나라 사람이다. 통국(通國)은 온 나라 사람을 다하는 것이다. 예모(禮貌)는 그를 존경하는 것이다.
孟子曰世俗所謂不孝者五惰其四肢不顧父母之養一不孝也博奕好飮酒不顧父母之養二不孝也好貨財私妻子不顧父母之養三不孝也從耳目之欲以爲父母戮四不孝也好勇鬪狠以危父母五不孝也章子有一於是乎,戮羞辱也狠忿戾也,孟子曰：“世俗所謂不孝者五：惰其四肢，不顧父母之養，一不孝也；博奕好飮酒，不顧父母之養，二不孝也；好貨財，私妻子，不顧父母之養，三不孝也；從耳目之欲，以爲父母戮，四不孝也；好勇鬪狠，以危父母，五不孝也。章子有一於是乎？”,戮，羞辱也。狠，忿戾也。,"맹자(孟子)께서 말씀하였다. “세속에서 이른바 불효(不孝)라는 것이 다섯 가지이니, 그 사지(四肢)를 게을리 하여 부모(父母)의 봉양을 돌보지 않음이 첫 번째 불효(不孝)요, 장기 두고 바둑 두며 술 마시기를 좋아하여 부모(父母)의 봉양을 돌보지 않음이 두 번째 불효(不孝)요, 재물을 좋아하며 처자(妻子)를 사사로이 하여 부모(父母)의 봉양을 돌보지 않음이 세 번째 불효(不孝)요, 귀와 눈의 하고자 함을 따라 부모(父母)를 욕되게 함이 네 번째 불효(不孝)요, 용맹을 좋아하고 싸우며 사나워서 부모(父母)를 위태롭게 함이 다섯 번째 불효(不孝)이니, 장자(章子)가 이중에 한 가지라도 있는가.”",육(戮)은 부끄럽고 욕됨이다. 한(悍)은 분하고 어그러짐이다.
夫章子子父責善而不相遇也,遇合也相責以善而不相合故爲父所逐也,夫章子，子父責善而不相遇也。,遇，合也。相責以善而不相合，故爲父所逐也。,저 장자(章子)는 부자(父子)간에 선(善)을 책(責)하다가 뜻이 서로 맞지 못한 것이다.,우(遇)는 합함이다. 서로 선(善)을 책(責)하다가 뜻이 합하지 못하였다. 그러므로 아버지에게 축출을 당한 것이다.
責善朋友之道也父子責善賊恩之大者,賊害也朋友當相責以善父子行之則害天性之恩也,責善，朋友之道也；父子責善，賊恩之大者。,賊，害也。朋友當相責以善。父子行之，則害天性之恩也。,"책선(責善)은 붕우(朋友)의 도(道)이니, 부자(父子)간에 책선(責善)함은 은혜를 해침이 큰 것이다.","적(賊)은 해침이다. 붕우(朋友)는 마땅히 서로 선(善)을 책(責)해야 하지만, 부자(父子)간에 이를 행하면 천성(天性)의 은혜를 해치게 된다."
夫章子豈不欲有夫妻子母之屬哉爲得罪於父不得近出妻屛子終身不養焉其設心以爲不若是是則罪之大者是則章子已矣,言章子非不欲身有夫妻之配子有子母之屬但爲身不得近於父故不敢受妻子之養以自責罰其心以爲不如此則其罪益大也,夫章子，豈不欲有夫妻子母之屬哉？爲得罪於父，不得近。出妻屛子，終身不養焉。其設心以爲不若是，是則罪之大者，是則章子已矣。,言章子非不欲身有夫妻之配、子有子母之屬，但爲身不得近於父，故不敢受妻子之養，以自責罰。其心以爲不如此，則其罪益大也。,"저 장자(章子)는 어찌 부처(夫妻)와 자모(子母)의 가속(家屬)이 있기를 원하지 않겠는가마는, 아버지에게 죄를 얻어 가까이 할 수 없었다. 이 때문에 아내를 내보내고 자식들을 물리쳐서 종신(終身)토록 <처자(妻子)의> 봉양을 받지 않았으니, 그 마음에 생각하기를, ‘이와 같이 하지 않는다면 이는 죄가 크다.’고 여겼으니, 이것이 바로 장자(章子)이다.”","장자(章子)는 자신이 부처(夫妻)의 배필이 있으며, 자식이 자모(子母)의 등속이 있기를 원하지 않은 것이 아니었으나, 다만 자신이 아버지를 가까이 할 수 없었기 때문에 처자(妻子)들의 봉양을 받지 아니하여 스스로 꾸짖고 벌하였으니, 그 마음에 생각하기를, ‘이와 같이 하지 않으면 그 죄가 더욱 크다.’고 여긴 것이다."
,此章之旨於衆所惡而必察焉可以見聖賢至公至仁之心矣楊氏曰章子之行孟子非取之也特哀其志而不與之絶耳,,此章之旨，於衆所惡而必察焉，可以見聖賢至公至仁之心矣。楊氏曰：“章子之行，孟子非取之也，特哀其志而不與之絶耳。”,,"이 장(章)의 뜻은 여러 사람들이 미워하는 바에 대해서도 반드시 살펴야 하니, 성현(聖賢)의 지공(至公), 지인(至仁)하신 마음을 볼 수 있다. 양씨(楊氏)가 말하였다. “장자(章子)의 행실을 맹자(孟子)께서 취한 것이 아니요, 다만 그의 뜻을 가엽게 여겨 그와 더불어 절교하지 않으셨을 뿐이다.”"
曾子居武城有越寇或曰寇至盍去諸曰無寓人於我室毁傷其薪木寇退則曰修我牆屋我將反寇退曾子反左右曰待先生如此其忠且敬也寇至則先去以爲民望寇退則反殆於不可沈猶行曰是非汝所知也昔沈猶有負芻之禍從先生者七十人未有與焉,武城魯邑名盍何不也左右曾子之門人也忠敬言武城之大夫事曾子忠誠恭敬也爲民望言使民望而效之沈猶行弟子姓名也言曾子嘗舍於沈猶氏時有負芻者作亂來攻沈猶氏曾子率其弟子去之不與其難言師賓不與臣同,曾子居武城，有越寇。或曰：“寇至，盍去諸？”曰：“無寓人於我室，毁傷其薪木。”寇退，則曰：“修我牆屋，我將反。”寇退，曾子反。左右曰：“待先生，如此其忠且敬也。寇至則先去以爲民望，寇退則反，殆於不可。”沈猶行曰：“是非汝所知也。昔沈猶有負芻之禍，從先生者七十人，未有與焉。”,武城，魯邑名。盍，何不也。左右，曾子之門人也。忠敬，言武城之大夫事曾子，忠誠恭敬也。爲民望，言使民望而效之。沈猶行，弟子姓名也。言曾子嘗舍於沈猶氏，時有負芻者作亂，來攻沈猶氏，曾子率其弟子去之，不與其難。言師賓不與臣同。,"증자(曾子)께서 무성(武城)에 거처하실 적에 월(越)나라의 침략이 있자, 혹자가 말하기를 “침략군이 도착하니, 어찌 떠나가지 않습니까?” 하였다. 증자(曾子)께서 말씀하시기를 “내 방에 사람을 붙여두어 섶과 나무를 훼상(毁傷)하지 말도록 하라.”하고 적이 물러갔다고 하자 “나의 담장과 지붕을 수선하라. 내 장차 돌아갈 것이다.” 하셨다. 그 후 적이 물러간 다음 증자(曾子)께서 돌아오시니, 좌우에 있는 자들이 말하기를 “<무성(武城)의 대부(大夫)가> 선생(先生)을 대하기를 이렇게 충성스럽게 하고 또 공경하거늘, 적이 이르자 먼저 떠나가시어 백성들이 바라보고 본받게 하시고, 적이 물러가자 돌아오시니, 불가(不可)할 듯합니다.” 하자, 심유행(沈猶行)이 말하였다. “이는 너희들이 알 바가 아니다. 옛적에 우리 심유씨(沈猶氏)에게 부추(負芻)의 화(禍)가 있었는데, 선생을 따르는 자 70명이 한 사람도 이에 참여한 자가 있지 않았다.” 하였다.","무성(武城)은 노(魯)나라 고을 이름이다. 합(盍)은 어찌 아니이다. 좌우(左右)는 증자(曾子)의 문인(門人)이다. 충경(忠敬)은 무성(武城)의 대부(大夫)가 증자(曾子)를 섬기기를 충성스럽게 하고 공경스럽게 함을 말한다. 위민망(爲民望)은 백성들로 하여금 바라보고 본받게 함을 말한다. 심유행(沈猶行)은 제자(弟子)의 성명(姓名)이다. 증자(曾子)께서 일찍이 심유씨(沈猶氏) 집에 머물렀었는데, 이때 부추(負芻)라는 자가 난(亂)을 일으켜 와서 심유씨(沈猶氏)를 공격하자, 증자(曾子)께서는 그 제자(弟子)들을 거느리고 떠나가시어 난(亂)에 참여하지 않았음을 말한 것이니, 스승과 손님은 신하와 똑같지 않음을 말씀한 것이다."
子思居於衛有齊寇或曰寇至盍去諸子思曰如伋去君誰與守,言所以不去之意如此,子思居於衛，有齊寇。或曰：“寇至，盍去諸？”子思曰：“如伋去，君誰與守？”,言所以不去之意如此。,"자사(子思)께서 위(衛)나라에 계실 적에 제(齊)나라의 침략이 있자, 혹자가 말하였다. “적이 침략해 오니, 어찌 떠나가지 않습니까?” 하니, 자사(子思)께서 대답하시기를 “만일 내[급(伋)]가 떠나가면 임금이 누구와 더불어 지키시겠는가.” 하셨다.",떠나가지 않는 바의 뜻을 말씀하기를 이와 같이 하신 것이다.
孟子曰曾子子思同道曾子師也父兄也子思臣也微也曾子子思易地則皆然,微猶賤也尹氏曰或遠害或死難其事不同者所處之地不同也君子之心不繫於利害惟其是而已故易地則皆能爲之,孟子曰：“曾子、子思同道。曾子，師也，父兄也；子思，臣也，微也。曾子、子思易地則皆然。”,微，猶賤也。尹氏曰：“或遠害，或死難，其事不同者，所處之地不同也。君子之心，不繫於利害，惟其是而已，故易地則皆能爲之。”,"맹자(孟子)께서 말씀하였다. “증자(曾子)와 자사(子思)는 도(道)가 같으니, 증자(曾子)는 스승이며 부형(父兄)이었고, 자사(子思)는 신하이며 미천하였으니, 증자(曾子)와 자사(子思)께서 처지를 바꾼다면 다 그러하셨을 것이다.”","미(微)는 천(賤)과 같다. 윤씨(尹氏)가 말하였다. “혹은 해(害)를 멀리 피하고 혹은 난(亂)에 죽을 각오를 하여, 그 일이 똑같지 않은 것은 만나 바의 처지가 같지 않기 때문이다. 군자(君子)의 마음은 이해(利害)에 관계하지 않고, 오직 그 옳은 것을 할뿐이다. 그러므로 처지를 바꾸면 모두 능히 할 수 있는 것이다.”"
,孔氏曰古之聖賢言行不同事業亦異而其道未始不同也學者知此則因所遇而應之若權衡之稱物低昻屢變而不害其爲同也,,孔氏曰：“古之聖賢，言行不同，事業亦異，而其道未始不同也。學者知此，則因所遇而應之；若權衡之稱物，低昻屢變，而不害其爲同也。”,,"공씨(孔氏)가 말하였다. “옛 성현(聖賢)들이 언행(言行)이 똑같지 않고 사업(事業)도 또한 달랐으나, 그 도(道)는 일찍이 같지 않은 것이 아니었다. 배우는 자들이 이것을 안다면 만나는 바의 환경에 따라 대응하기를, 저울로 물건을 다는 것과 같이 하여 오르내림이 여러 번 변하지만 그 같음이 됨에 해되지 않는 것이다.”"
儲子曰王使人瞷夫子果有以異於人乎孟子曰何以異於人哉堯舜與人同耳,儲子齊人也瞷竊視也聖人亦人耳豈有異於人哉,儲子曰：“王使人瞷夫子，果有以異於人乎？”孟子曰：“何以異於人哉？堯舜與人同耳。”,儲子，齊人也。瞷，竊視也。聖人亦人耳，豈有異於人哉？,"저자(儲子)가 물었다. “왕(王)이 사람으로 하여금 부자(夫子)를 엿보게 하시니, 과연 다른 사람과 다른 점이 계십니까?” 맹자(孟子)께서 말씀하였다. “어찌 다른 사람과 다르리오, 요순(堯舜)도 사람과 똑같으시다.”","저자(儲子)는 제(齊)나라 사람이다. 간(瞷)은 몰래 훔쳐보는 것이다. 성인(聖人)도 또한 사람이니, 어찌 사람과 다름이 있겠는가."
